European ETF Statistics ,Unnamed: 1,Unnamed: 2,Unnamed: 3,Unnamed: 4,Unnamed: 5
Lyxor ETF MSCI Asia APEX 50,FR0010652867,1.680414,2.099617,-0.19965688980418805,5.996503172996542e-05
Lyxor ETF MSCI EM Latin America,FR0010410266,4.643448,4.170462,0.11341333406226961,0.0001656999445710667
Lyxor ETF MSCI Emerging Markets,FR0010429068,14.68343,7.28094,1.0166942729922233,0.0005239734647858957
Lyxor ETF MSCI EMU,FR0007085501,0.9067761,0.2248082,3.0335543810234675,3.2358012732858866e-05
Lyxor ETF MSCI EMU Growth,FR0010168765,1.230929,0.8321263000000001,0.4792574156110674,4.392530444422303e-05
Lyxor ETF MSCI EMU Small Cap,FR0010168773,1.176133,1.415866,-0.16931898922638156,4.196992685353694e-05
Lyxor ETF MSCI EMU Value,FR0010168781,5.574704,1.06581,4.230485733855002,0.00019893151464172825
Lyxor ETF MSCI Europe,FR0010261198,17.66668,6.087789,1.9019862547798554,0.0006304297790682209
Lyxor ETF MSCI Greece,FR0010405431,0.7010253000000001,0.4839105,0.4486672638845408,2.5015861780494886e-05
Lyxor ETF MSCI India,FR0010361683,67.42304,67.15622,0.003973124157375052,0.002405969441417846
Lyxor ETF MSCI Korea,FR0010361691,6.325181,5.824172,0.08602235648260392,0.00022571204439071228
Lyxor ETF MSCI Malaysia,FR0010397554,0.1813929,0.36967,-0.5093112776259907,6.472947145221621e-06
Lyxor ETF MSCI Taiwan,FR0010444786,1.268194,2.67354,-0.5256498874151874,4.5255093952890043e-05
Lyxor ETF MSCI USA,FR0010296061,12.52391,10.718,0.16849318902780386,0.0004469116899366652
Lyxor ETF MSCI World,FR0010315770,7.940066,6.819273,0.16435666969191587,0.00028333869488591476
Lyxor ETF NASDAQ-100,FR0007063177,6.087785,12.4135,-0.5095835179441737,0.00021724064468054156
Lyxor ETF New Energy,FR0010524777,4.756923,4.379168,0.0862618195967817,0.00016974926335534116
Lyxor ETF Pan Africa (A),FR0010636464,2.777354,1.529453,0.8159132709537331,9.910898191478193e-05
Lyxor ETF PRIVEX,FR0010407197,0.5656547,0.7405445,-0.23616379569357426,2.0185205570593955e-05
Lyxor ETF Russia,FR0010326140,34.12588,30.60432,0.11506741531914444,0.0012177710236959418
Lyxor ETF Short Strategy Europe,FR0010589101,2.939121,2.244354,0.30956212789960946,0.00010488158514699812
Lyxor ETF South Africa,FR0010464446,7.559183,5.674487,0.33213504586405773,0.0002697470078490272
Lyxor ETF Turkey,FR0010326256,6.070344,11.31619,-0.4635699824764342,0.0002166182682195014
Lyxor ETF Wise Quantitative Strategy ,FR0010540690,0.07259264,0.07385307,-0.017066724511249243,2.5904449504478996e-06
Lyxor ETF World Water,FR0010527275,0.46827,0.36491959999999996,0.283214165531257,1.671006395340131e-05
Market Access Amex Gold Bugs Index Fund,LU0259322260,2.781888,0.4371851,5.3631811788645125,9.927077624276519e-05
Market Access DAXglobal Asia Index Fund,LU0259323235,0.07814747999999999,0.09023934,-0.13399765556795973,2.788667624654899e-06
Market Access DAXglobal BRIC Index Fund,LU0269999792,0.7721901,0.5430304,0.4220016043300705,2.7555354720958745e-05
Market Access DAXglobal Russia Index Fund,LU0269999958,0.8724246,0.7815053000000001,0.11633868637871037,3.1132190532215506e-05
Market Access DJ Turkey Titans 20 Index Fund,LU0269999362,0.2580756,0.2406275,0.07251083105630074,9.20934456790402e-06
Market Access FTSE/JSE Africa Top 40 Index Fund,LU0270000028,0.16864110000000002,0.01524418,10.062654731182656,6.017903274119516e-06
Market Access Jim Rogers Commodity Index Fund,LU0249326488,0.09822339,0.22826960000000002,-0.569704463494044,3.505069999401795e-06
Market Access RICI-Agriculture Index Fund,LU0259321452,1.031689,0.2035783,4.067774905282145,3.681548929041076e-05
Market Access RICI-Metals Index Fund,LU0259320728,0.3564778,0.1474288,1.4179658248591864,1.2720795344497409e-05
Market Access South-East Europe Traded Index Fund,LU0259329869,0.03621719,0.05673612,-0.3616555027026874,1.292398746689915e-06
PowerShares Dynamic Europe Fund,IE00B23D9570,0.02948346,0.08551485,-0.6552240926575911,1.05210776297339e-06
PowerShares Dynamic Global Developed Markets Fund,IE00B23D9463,0.053446,0.01650751,2.2376778811583335,1.9072032760020637e-06
PowerShares Dynamic Italy,IE00B23LNR19,0.059237,0.1112233,-0.46740476141240195,2.11385324365779e-06
PowerShares Dynamic US Market Fund,IE00B23D9240,0.02812964,0.02191387,0.28364547202296997,1.0037971328211408e-06
PowerShares EQQQ Fund,IE0032077012,36.29016,18.54732,0.9566255394310339,0.0012950026576102804
PowerShares EuroMTS Cash 3 Months Fund,IE00B3BPCH51,22.92552,13.22368,0.7336717161939792,0.0008180897887222772
PowerShares FTSE RAFI Developed 1000 Fund,IE00B23D8W74,0.06568124,0.1191155,-0.4485919968433999,2.3438138700721812e-06
PowerShares FTSE RAFI Developed Europe Mid-Small Fund,IE00B23D8Y98,0.1316374,0.0517098,1.5456954000982401,4.697438171694683e-06
PowerShares FTSE RAFI Europe Fund,IE00B23D8X81,0.8161764,0.05252511,14.538785163895897,2.912499165280041e-05
PowerShares FTSE RAFI IT 30,IE00B23LNP94,0.07384412,0.6007155,-0.8770730570461391,2.635103610700324e-06
PowerShares FTSE RAFI US 1000 Fund,IE00B23D8S39,0.017821049999999998,0.0247647,-0.2803849834643667,6.359384227406461e-07
PowerShares Global Agriculture-A,IE00B3BQ0418,0.5872539,0.1603235,2.6629308866136276,2.0955966057796437e-05
PowerShares Global Clean Energy Fund,IE00B23D9133,0.4022367,0.4834945,-0.16806354570734516,1.4353686935753083e-05
PowerShares Global Listed Private Equity Fund,IE00B23D8Z06,0.02027137,0.00487488,3.158332102533806,7.233773018195927e-07
PowerShares Middle East North Africa NASDAQ OMX ,IE00B3BPCJ75,0.4043745,0.4349306,-0.07025511656342409,1.4429973639406065e-05
PowerShares Palisades Global Water Fund,IE00B23D9026,0.1738782,0.1737922,0.0004948438422438528,6.204787498883772e-06
Total,,3450.500177089999,2828.6334524000004,0.21984705164338836,0.12312998618403148
,,,,,
London Stock Exchange,ISIN,Exchange and Non-Exchange Order Book Turnover in MEUR,,,
,,09/2009,08/2009,Change (%),Market Share
db x-trackers CAC 40 Short ETF,LU0322251280,7.823293,9.294238,-0.15826418475618986,0.00027917168803510105
db x-trackers DBLCI OY Balanced ETF,LU0292106167,1.2865586,0.4215916,2.051670384324545,4.591042878210958e-05
db x-trackers DJ EURO STOXX 50 ETF,LU0274211217,19.16802,4.923742,2.8929781454836583,0.0006840046128517209
db x-trackers DJ EURO STOXX 50 ETF 1C,LU0380865021,6.141525,9.092469,-0.3245481507828072,0.00021915833925174145
db x-trackers DJ EURO STOXX 50 Short ETF,LU0292106753,3.052922,3.616018,-0.15572267615924473,0.00010894253713615187
db x-trackers DJ EURO STOXX Select Dividend 30 ETF,LU0292095535,0.6691458,0.2465507,1.7140292037296994,2.387825210273962e-05
db x-trackers DJ Islamic Market Titans 100 ETF,LU0328475529,1.065529,0.008235850000000001,128.37693134284862,3.802305877849049e-05
db x-trackers DJ STOXX 600 Banks ETF,LU0292103651,3.208997,2.584898,0.24144047463381546,0.00011451202318378915
db x-trackers DJ STOXX 600 Banks Short ETF,LU0322249037,2.744847,14.72319,-0.8135698174104933,9.794898010186798e-05
db x-trackers DJ STOXX 600 Basic Resources ETF,LU0292100806,7.013156,1.89608,2.6987658748576013,0.00025026221042385825
db x-trackers DJ STOXX 600 ETF,LU0328475792,0.2456547,0.3287643,-0.25279387086736604,8.766108756601132e-06
db x-trackers DJ STOXX 600 Food & Beverage ETF,LU0292105359,1.04503,0.011857340000000001,87.13359488721753,3.7291558573521617e-05
db x-trackers DJ STOXX 600 Health Care ETF,LU0292103222,1.191193,0.2223435,4.357444674568854,4.2507338097345474e-05
db x-trackers DJ STOXX 600 Health Care Short ETF,LU0322249466,0.22965770000000002,5.304381,-0.9567041470060315,8.195260969934124e-06
db x-trackers DJ STOXX 600 Industrial Goods ETF,LU0292106084,0.3618642,0.08353139999999999,3.3320739266910415,1.2913007291618943e-05
db x-trackers DJ STOXX 600 Insurance ETF,LU0292105193,1.004108,0.0786507,11.766675948211521,3.58312701990772e-05
db x-trackers DJ STOXX 600 Oil & Gas ETF,LU0292101796,8.664611,2.455006,2.5293644903515515,0.0003091938495768349
db x-trackers DJ STOXX 600 Oil & Gas Short ETF,LU0322249623,0.6063116,3.410635,-0.8222291156925323,2.1636033937021532e-05
db x-trackers DJ STOXX 600 Technology ETF,LU0292104469,0.3229907,0.09584807000000001,2.3698195487921665,1.152581897912285e-05
db x-trackers DJ STOXX 600 Technology Short ETF,LU0322250043,0.2992297,0.6071466,-0.5071541206028329,1.0677915356006338e-05
db x-trackers DJ STOXX 600 Telecommunications ETF,LU0292104030,1.101453,0.01197581,90.97315254667534,3.930499513457136e-05
db x-trackers DJ STOXX 600 Telecommunications Short ETF,LU0322250126,0.444625,3.952789,-0.8875161310153413,1.586629975287987e-05
db x-trackers DJ STOXX 600 Utilities ETF,LU0292104899,0.8068478,0.1256643,5.420660442146257,2.8792103569865993e-05
db x-trackers DJ STOXX Global Select Dividend 100 ETF,LU0292096186,1.297024,0.2744537,3.7258390030813935,4.6283883206475705e-05
db x-trackers FTSE 100 ETF,LU0292097234,20.16891,15.50582,0.30073159626514423,0.0007197210497584624
db x-trackers FTSE 100 ETF Short,LU0328473581,50.63164,34.5319,0.466228038422444,0.0018067737469100985
db x-trackers FTSE 250 ETF,LU0292097317,15.24776,2.393933,5.369334480121206,0.0005441113988641474
db x-trackers FTSE All-Share ETF,LU0292097747,4.73047,4.449305,0.06319301553838197,0.00016880529658027697
db x-trackers FTSE All-World ex-UK ETF,LU0322254383,0.6374123,0.4929135,0.2931524496691611,2.2745852387905742e-05
db x-trackers FTSE Vietnam ETF,LU0322252924,2.729427,2.1329377999999997,0.2796561625003786,9.73987223741437e-05
db x-trackers FTSE/XINHUA China 25 ETF,LU0292109856,9.363573,4.582478,1.0433427067189411,0.0003341360831621538
db x-trackers Fund Index ETF - 2C,LU0434446117,3.551465,1.40923,1.5201457533546687,0.00012673288333283443
db x-trackers Fund Index ETF - 3C,LU0434446208,0.0573824,0.07748035,-0.25939415606666727,2.0476724406851928e-06
db x-trackers GBP Money Markets ETF,LU0356592187,11.12125,2.272539,3.8937553986972278,0.0003968582201331802
db x-trackers HSI Short Index ETF,LU0429790313,0,,,0
db x-trackers II - EONIA Total Return Index ETF,LU0378820202,0.27090240000000004,,,9.667064789821905e-06
db x-trackers II - IBOXX  GILTS TOTAL RETURN INDEX ETF,LU0321464066,4.49033,,,0.0001602359781149262
db x-trackers II - IBOXX $ TREASURIES 1-3 TOTAL RETURN INDEX ETF,LU0429458895,0,,,0
db x-trackers II - iBoxx = Sovereigns Eurozone Total Return Index ETF,LU0290355717,0.1602105,,,5.717060031619366e-06
db x-trackers II - IBOXX UK GILT INFLATION-LINKED TOTAL RETURN INDEX ETF,LU0321464223,0,,,0
db x-trackers II - USD IG INFLATION LINKED TREASURIES TOTAL RETURN INDEX ETF,LU0429459513,0.1030283,,,3.6765316633784273e-06
db x-trackers LPX MM Private Equity ETF,LU0322250712,0.2604881,0.8405758000000001,-0.690107542948536,9.295433852478262e-06
db x-trackers MSCI AC Asia ex Japan TRN Index,LU0322252171,12.610096,5.743365,1.1955936981194824,0.00044998720955544884
db x-trackers MSCI Brazil TRN Index ETF,LU0292109344,12.391988,11.436056,0.08358930736260817,0.0004422040959057415
db x-trackers MSCI EM Asia TRN Index ETF,LU0292107991,4.840274,2.523135,0.9183571231820731,0.00017272361691328842
db x-trackers MSCI EM EMEA TRN Index ETF,LU0292109005,6.484201,0.526406,11.317870616976249,0.00023138662181371584
db x-trackers MSCI EM LATAM TRN Index ETF,LU0292108619,10.861761,5.235118,1.0747881900656298,0.0003875984388420359
db x-trackers MSCI Emerging Markets TRN Index ETF,LU0292107645,16.82175,6.1767902,1.7233805027083484,0.0006002787244711993
db x-trackers MSCI Europe Mid Cap ETF,LU0322253732,0.24254889999999998,0.0590406,3.108171326172159,8.655279285085824e-06
db x-trackers MSCI Europe Small Cap ETF,LU0322253906,0.08618333,0.2040475,-0.5776310417917396,3.0754243406946627e-06
db x-trackers MSCI Europe TRN Index ETF,LU0274209237,8.203562,1.1139446000000002,6.36442548399624,0.0002927414646799768
db x-trackers MSCI Japan TRN Index ETF,LU0274209740,1.6918607999999997,2.698067,-0.3729359574836356,6.037350709687295e-05
db x-trackers MSCI Korea TRN Index ETF,LU0292100046,5.800552,4.612414,0.2575956971772264,0.00020699082769562403
db x-trackers MSCI Pacific ex Japan TRN Index,LU0322252338,8.865028,7.311032,0.21255494436353173,0.00031634566559611614
db x-trackers MSCI Russia 25% Capped ETF,LU0322252502,4.553023,6.172675,-0.26239061670993535,0.00016247315760417513
db x-trackers MSCI Taiwan TRN Index ETF,LU0292109187,8.91627,3.5208586,1.5324135425376073,0.0003181742198428118
db x-trackers MSCI USA TRN Index ETF,LU0274210672,26.608838,4.411259,5.032028044601325,0.0009495278038432847
db x-trackers MSCI World TRN Index ETF,LU0274208692,11.261107,16.253363,-0.30715218751959206,0.00040184897208041335
db x-trackers Russell 2000 ETF,LU0322248658,2.572543,12.748924,-0.7982148924881818,9.180036742237355e-05
db x-trackers S&P 500 Shariah ETF,LU0328475362,0.1446606,0.00679836,20.27874958078125,5.162166864282156e-06
db x-trackers S&P 500 Short ETF,LU0322251520,8.2362454,15.847561,-0.4802830921426964,0.0002939077612700095
db x-trackers S&P CNX NIFTY ETF,LU0274212538,5.260673,7.400325,-0.28912946390867966,0.00018772541966799393
db x-trackers S&P CNX NIFTY ETF             ,LU0292109690,2.860692,4.158382,-0.3120660872425861,0.0001020828715719211
db x-trackers S&P Europe 350 Shariah ETF,LU0328475107,0.182894,0.00499087,35.64571507572828,6.52651341468251e-06
db x-trackers S&P Global Infrastructure ETF,LU0322253229,0.76912,0.47855652000000004,0.6071664847445815,2.7445799192431748e-05
db x-trackers S&P Japan 500 Shariah ETF,LU0328475289,0.3874599,0.29310040000000004,0.3219357598966086,1.3826381592624931e-05
db x-trackers S&P Select Frontier ETF,LU0328476410,0.18901216,0.09592875999999999,0.9703388222676916,6.744837981443443e-06
db x-trackers S&P U.S. Carbon Efficient ETF,LU0411076002,0,0,,0
db x-trackers S&P/ASX 200 ETF,LU0328474803,1.296267,0.8109404,0.5984738212573946,4.625686990557511e-05
db x-trackers ShortDAX ETF,LU0292106241,3.082175,4.549096,-0.32246428741007005,0.00010998642100833852
db x-trackers USD Money Markets ETF,LU0356591882,47.64141,33.10307,0.4391840394259505,0.0017000683535785181
ETFS 2 x Leveraged  FTSE 100 ,IE00B4QNJJ23,33.1718,55.05366,-0.39746421945425614,0.001183724986545022
ETFS DAX 2X Long Fund,IE00B4QNHH68,34.4857205,5.501768,5.268116085592849,0.0012306118159056154
ETFS DAX 2X Short Fund,IE00B4QNHZ41,19.710719,6.294115,2.131610877780276,0.0007033706516700244
ETFS DAXglobal Alternative Energy Fund,IE00B3CNHC86,0.92811529,0.1138398,7.1528190492253145,3.3119494847053205e-05
ETFS DJ EURO STOXX 50 2x Short Fund,IE00B4QNJ141,4.306747,2.0740681000000003,1.0764732845560854,0.00015368487795741607
ETFS DJ EURO STOXX 50 Leveraged 2x,IE00B4QnJG91,1.9138524,2.340767,-0.18238235586882423,6.82952057602891e-05
ETFS Dow Jones STOXX 600 Basic Resources,IE00B3CNH733,0.6767369,0.5576744,0.2134982348122847,2.414913805844181e-05
ETFS Dow Jones STOXX 600 Basic Resources (USD),IE00B3CNH734,0.8465974,3.451304,-0.7547021647470058,3.021055522835815e-05
ETFS Dow Jones STOXX 600 Oil & Gas Fund,IE00B3CNH840,0.3037905,4.631090599999999,-0.9344019527495316,1.0840666033347772e-05
ETFS Dow Jones STOXX 600 Utilities,IE00B3CNH956,0.25582881,0.21391321,0.19594675803331651,9.129168591245548e-06
ETFS FTSE 100 Super Short Strategy 2x Fund,IE00B4QNK008,66.62314,28.08229,1.3724254681509236,0.0023774252678506183
ETFS Janney Global Water Fund,IE00B3CNHB79,0.15429431,0.11662114,0.32303894474020733,5.50594269918194e-06
ETFS Russell 1000® Fund,IE00B3CNHH32,1.1295898,8.011901,-0.859011013740684,4.030904776968371e-05
ETFS Russell 2000® Fund,IE00B3CNHJ55,2.7810443,7.148447099999999,-0.6109582597316835,9.924066908032156e-05
ETFS Russell Global Coal Fund,IE00B3CNHF18,0.16999989999999998,0.235385,-0.27777938271342706,6.066391613965932e-06
ETFS Russell Global Gold Fund,IE00B3CNHG25,14.75755,0.22472201,64.67024743148212,0.0005266184130854368
ETFS Russell Global Shipping Large Cap Fund,IE00B3CMS880,0.14636957,3.536039,-0.9586063473847433,5.22315090766406e-06
ETFS Russell Global Steel Large Cap Fund,IE00B3CNJ002,1.670086,6.440379,-0.7406851366977005,5.95964803802938e-05
ETFS S-Net ITG Global Agri Business Fund,IE00B3CNHD93,0.241543,0.2489371,-0.02970268393100095,8.619384067944589e-06
ETFS WNA Global Nuclear Energy Fund,IE00B3C94706,8.6468327,1.6146447099999999,4.355254097974284,0.0003085594366740592
HSBC FTSE 100 ETF,IE00B42TW061,4.751276,20.56951,-0.7690136517593273,0.00016954775198125174
iShares $ Corporate Bond,IE0032895942,54.53986,48.50145,0.12449957681677559,0.0019462373173800454
iShares $ TIPS,IE00B1FZSC47,49.495827,39.761704,0.24481151512017685,0.0017662426262551247
iShares $ Treasury Bond 1-3,IE00B14X4S71,43.984306,25.424415,0.7300026765610927,0.0015695657765946417
iShares $ Treasury Bond 7-10,IE00B1FZS798,43.15693,52.17222,-0.17279866565003366,0.0015400411308272228
iShares £ Corporate Bond,IE00B00FV011,186.978,180.3178,0.0369358987299091,0.006672249637771094
iShares £ Index Linked Gilts,IE00B1FZSD53,85.49075,69.2744,0.23408863880452246,0.0030507098467214278
iShares € Corporate Bond,IE0032523478,125.2463,92.8513,0.34889118407604425,0.004469373829044967
iShares € Covered Bond EUR,IE00B3B8Q275,1.457464,1.3562537000000001,0.07462490240579611,5.2009132871591364e-05
iShares € Government Bond 1-3,IE00B14X4Q57,97.41875,17.5551,4.549313304965509,0.00347635668046301
iShares € Government Bond 15-30,IE00B1FZS913,3.8713432,0.7627351,4.075606458913455,0.00013814763375310244
iShares € Government Bond 3-5,IE00B1FZS681,25.849322,9.86111,1.6213399911369004,0.000922424720293983
iShares € Government Bond 7-10,IE00B1FZS806,60.24466,19.008942,2.1692800156894583,0.002149811265831503
iShares € Inflation Linked Bond,IE00B0M62X26,10.51159,16.87668,-0.3771529708449767,0.0003751026996218713
iShares AEX,IE00B0M62Y33,12.2644,25.62836,-0.5214520164380397,0.0004376511592672924
iShares Barclays Euro Aggregate Bond,IE00B3DKXQ41,6.7793483,9.99637767,-0.32181951064680014,0.00024191885804211767
iShares Barclays Euro Corporate Bond,IE00B3F81R35,29.329651,34.288863,-0.14463040083889633,0.0010466191384050669
iShares Barclays Euro Corporate Bond 1-5,IE00B4L60045,0.10503117,,,3.7480034334904325e-06
iShares Barclays Euro Corporate Bond ex-Financials,IE00B4L5ZG21,0,,,0
iShares Barclays Euro Corporate Bond ex-Financials 1-5,IE00B4L5ZY03,0.0215086,,,7.675274554170188e-07
iShares Barclays Euro Government 10-15,IE00B4WXJH41,3.33425381,3.012926,0.10664975176954217,0.00011898177205879509
iShares Barclays Euro Government 5-7,IE00B4WXJG34,0.36620509999999995,3.627898,-0.8990586008757688,1.3067910908368507e-05
iShares Barclays Euro Treasury Bond,IE00B4WXJJ64,1.8931569,2.599312,-0.27167000344706593,6.755669351618289e-05
iShares Barclays Euro Treasury Bond 0-1,IE00B3FH7618,11.1168139,12.1324226,-0.0837102970679574,0.0003966999193351285
iShares Citigroup Global Government Bond,IE00B3F81K65,45.21948,9.209133,3.9102863429163204,0.001613642562495038
iShares DJ Asia/Pacific Select Dividend,IE00B14X4T88,4.1101251,4.04850178,0.015221265383758897,0.00014666848885788104
iShares DJ EURO STOXX 50,IE0008471009,38.76184,215.2512,-0.8199227693039575,0.001383203761401561
iShares DJ EURO STOXX Growth,IE00B0M62V02,0.20275279999999998,0.6690026,-0.6969327174513223,7.235168289087887e-06
iShares DJ EURO STOXX Mid Cap,IE00B02KXL92,2.130834,2.77505,-0.23214572710401604,7.60381241892112e-05
iShares DJ EURO STOXX Select Dividend,IE00B0M62S72,2.44973,9.499322,-0.7421152793852024,8.741782511919574e-05
iShares DJ EURO STOXX SmallCap ,IE00B02KXM00,6.339321,9.563265,-0.3371175011881402,0.0002262166257311806
iShares DJ EURO STOXX Value,IE00B0M62T89,0.5976106999999999,2.346085,-0.7452732104761763,2.132554512618131e-05
iShares DJ STOXX 50,IE0008470928,12.59165,14.15714,-0.1105795379575254,0.00044932896999347723
iShares FTSE 100,IE0005042456,862.5734,850.5491,0.014137102725756856,0.03078065363679674
iShares FTSE 250,IE00B00FV128,163.0367,91.81618,0.7756859411924999,0.005817912067293448
iShares FTSE BRIC 50,IE00B1W57M07,28.238453,28.666603,-0.01493549828697871,0.0010076800896387063
iShares FTSE Developed World Ex UK,IE00B4WXJF27,2.799711,4.512235,-0.37952899173026233,9.990678425062705e-05
iShares FTSE EPRA/NAREIT Asia Property Yield Fund,IE00B1FZS244,17.628896,15.73154,0.12060840833128861,0.0006290814692119088
iShares FTSE EPRA/NAREIT Global Property Yield Fund,IE00B1FZS350,53.98642,36.95078,0.4610360051939364,0.001926487989440245
iShares FTSE EPRA/NAREIT UK Property Yield Fund,IE00B1TXLS18,79.16487,49.425,0.6017171471927163,0.0028249728587411123
iShares FTSE EPRA/NAREIT US Property Yield Fund,IE00B1FZSF77,8.664299,13.16413,-0.3418251718875459,0.00030918271595744125
iShares FTSE Gilts UK 0-5,IE00B4WXJK79,41.59782,12.53781,2.3177899489623783,0.0014844047932220214
iShares FTSE MIB,IE00B1XNH568,2.783581,1.84432,0.5092722521037563,9.933119040184673e-05
iShares FTSE UK All Stocks Gilt,IE00B1FZSB30,108.189,68.56249,0.5779619439142307,0.0038606895787783417
iShares FTSE UK Dividend Plus,IE00B0M63060,44.01451,36.3002,0.21251425611980124,0.0015706435965951726
iShares FTSE/EPRA European Property Index Fund,IE00B0M63284,19.63849,13.44991,0.46012055099253457,0.0007007931830957185
iShares FTSE/Macquarie Global Infrastructure 100,IE00B1FZS467,6.154959,12.845607,-0.5208510582645102,0.0002196377272098639
iShares FTSE/Xinhua China 25,IE00B02KXK85,67.01394,91.40257,-0.26682652358680936,0.002391370839834707
iShares FTSEurofirst 100,IE0030974079,2.741409,2.071315,0.32351139252117633,9.782629618047265e-05
iShares FTSEurofirst 80,IE0004855221,5.613955,2.43887,1.3018672581974435,0.0002003321739199971
iShares Global Clean Energy,IE00B1XNHC34,6.651388,8.730391,-0.23813400797283868,0.00023735263599821902
iShares Global Inflation-Linked Bond,IE00B3B8PX14,10.1462865,7.4033444,0.37050040519525207,0.0003620669620187762
iShares iBoxx GBP Corporate Bond ex-Financials,IE00B4L60H17,27.27667,,,0.0009733591734166674
iShares JPMorgan Emerging Markets Bonds,IE00B2NPKV68,32.24412185,9.366651800000001,2.442438401521448,0.0011506210908979104
iShares MSCI AC Far East ex-Japan,IE00B0M63730,111.93479,101.23296,0.10571487784215727,0.003994356887074862
iShares MSCI AC Far Est ex-Japan SmallCap,IE00B2QWDR12,4.182246,6.124776,-0.317159354072704,0.00014924209991854445
iShares MSCI Brazil,IE00B0M63516,64.84751,42.52559,0.5249055921387569,0.0023140624838636488
iShares MSCI Eastern Europe,IE00B0M63953,11.859217,13.325022,-0.11000394595971408,0.0004231923345660922
iShares MSCI Emerging Markets,IE00B0M63177,198.76736,95.32733,1.0851036108952172,0.007092949147818013
iShares MSCI Emerging Markets Acc,IE00B4L5YC18,0.00215121,,,7.67652351788422e-08
iShares MSCI Emerging Markets Islamic,IE00B27YCP72,1.1909073000000001,3.172696,-0.6246386984444775,4.249714298497124e-05
iShares MSCI Emerging Markets Small Cap,IE00B3F81G20,5.536773,13.660483,-0.5946868789339292,0.00019757795913781712
iShares MSCI Europe,IE00B1YZSC51,5.283298,12.25523,-0.5688944230340842,0.0001885327854974208
iShares MSCI Europe Acc,IE00B4K48X80,0,,,0
iShares MSCI Europe Ex-EMU,IE00B4WXJC95,1.4724324,13.626525,-0.8919436613516653,5.2543275398936886e-05
iShares MSCI Europe ex-UK,IE00B14X4N27,58.0743,32.90192,0.7650732844770156,0.002072362669077698
iShares MSCI GCC Countries Ex SaudiArabia,IE00B3F81623,0.9400871,0.037094260000000004,24.343195955385006,3.3546705026517975e-05
iShares MSCI Japan,IE00B02KXH56,61.21181,69.1346,-0.11459949142686887,0.0021843237017179187
iShares MSCI Japan Acc,IE00B4L5YX21,0,,,0
iShares MSCI Japan Smallcap,IE00B2QWDY88,19.949906,30.8114,-0.35251543259962226,0.0007119059626376758
iShares MSCI Korea,IE00B0M63391,17.013981,17.307285,-0.016946852149253844,0.0006071384257201076
iShares MSCI Latin America,IE00B27YCK28,17.77662,11.871586,0.4974090235289539,0.0006343529525173785
iShares MSCI North America,IE00B14X4M10,35.295919,18.998597,0.8578171324966783,0.0012595234881245271
iShares MSCI Pacific X-JPN,IE00B4WXJD03,6.447243,10.807066,-0.40342337133871486,0.00023006778750105477
iShares MSCI Taiwan,IE00B0M63623,59.400569,29.832474,0.9911378788095146,0.00211969015067894
iShares MSCI Turkey,IE00B1FZS574,7.4376637,19.777548,-0.6239339831206578,0.0002654106308131877
iShares MSCI USA Islamic,IE00B296QM64,0.06974586,0.17695204,-0.6058487938313681,2.4888585241099672e-06
iShares MSCI World,IE00B0M62Q58,109.12384,84.75177,0.2875700413100517,0.0038940490427333205
iShares MSCI World Acc,IE00B4L5Y983,0,,,0
iShares MSCI World Islamic,IE00B27YCN58,1.3633909,0.66452517,1.0516768386666224,4.865216463255252e-05
iShares S&P 500,IE0031442068,269.4943,156.21301,0.725171930302092,0.00961681719537258
iShares S&P 500 Acc,IE00B4L5ZD99,0.8649146999999999,,,3.086420217232986e-05
iShares S&P Emerging Markets Infrastructure,IE00B2NPL135,6.167967,3.459744,0.7827813271733399,0.0002201019134953527
iShares S&P Global Water,IE00B1TXK627,8.120474,3.2110406,1.5289228669360329,0.0002897764961922236
iShares S&P Listed Private Equity,IE00B1TXHL60,5.7382,3.8262776,0.4996820931131605,0.00020476581668141754
iShares S&P Smallcap 600,IE00B2QWCY14,7.595711,1.7884728,3.2470374724178077,0.00027105049775034447
iShares S&P Timber and Forstery,IE00B27YCF74,2.1257375,3.0224426,-0.29668225957376326,7.585625723010958e-05
Lyxor ETF Brazil,FR0010499731,1.19616127,0.7098580199999999,0.6850711498617712,4.2684629210245647e-05
Lyxor ETF China Enterprise,FR0010499749,0.8052685,7.061002,-0.8859554918692842,2.8735746758621186e-05
Lyxor ETF CRB,FR0010455485,4.747682,7.209409,-0.3414603055534787,0.0001694195012501596
Lyxor ETF CRB Non-Energy,FR0010455493,0.7809516,2.0360127,-0.6164308798270266,2.7868006023258113e-05
Lyxor ETF DJ Industrial Average,FR0010551622,0.7883889,0.7588715,0.03889644030642847,2.8133403675554077e-05
Lyxor ETF Eastern Europe,FR0010542043,0.3320022,0.7122411,-0.5338626203963798,1.184739145080815e-05
Lyxor ETF FTSE 100,FR0010438127,44.17122,32.24398,0.3699059483351621,0.00157623574241305
Lyxor ETF FTSE 250,FR0010438135,11.1528,8.456946,0.3187739403798959,0.0003979840717096848
Lyxor ETF FTSE All-Share,FR0010438150,16.97357,13.47353,0.25977156691676195,0.000605696372215888
Lyxor ETF India ,FR0010465609,13.267132,4.804265,1.7615320970013104,0.00047343332735006946
Lyxor ETF Japan,FR0010489450,2.1883901,2.1419118,0.021699446261045807,7.809199505838573e-05
