European ETF Statistics ,Unnamed: 1,Unnamed: 2,Unnamed: 3,Unnamed: 4,Unnamed: 5
Februar 2009,,,,,
,,,,,
XTF Exchange Traded Funds (Deutsche Börse),ISIN,Xetra Order Book Turnover in MEUR,,,
,,02/2009,01/2009,Change (%),Market Share
ComStage ETF ATX,LU0392496690,0.9787172,0.33591531,1.9135831885721428,4.5330451707463305e-05
ComStage ETF Commerzbank EONIA Index TR,LU0378437684,47.622317267,56.314449448,-0.15434994510647215,0.002205684290691161
ComStage ETF Commerzbank FED Funds Effective Rate Index TR,LU0378437767,0.527202,9.11787,-0.9421792589716678,2.4417987955129496e-05
ComStage ETF DAX TR,LU0378438732,16.936188091,57.988010564999996,-0.7079363832974428,0.000784419704044836
ComStage ETF DJ EURO STOXX 50 Leveraged TR,LU0392496930,0.31961843,0.20371926,0.5689161152460498,1.4803507903948393e-05
ComStage ETF DJ EURO STOXX 50 Short TR,LU0392496856,4.091451045,1.064196798,2.8446376203060146,0.0001895004236247435
ComStage ETF DJ EURO STOXX 50 TR,LU0378434079,4.359787166,16.982283662,-0.7432743880167558,0.00020192873036581078
ComStage ETF DJ EURO STOXX Select Dividend 30 TR,LU0378434236,0.25191101,0.7267569399999999,-0.6533765332877317,1.1667558180630018e-05
ComStage ETF DJ STOXX 600 Automobiles & Parts TR,LU0378435043,0.033359099999999996,0.00326146,9.22827200088304,1.5450664109657405e-06
ComStage ETF DJ STOXX 600 Banks TR,LU0378435399,1.587223577,1.90367215,-0.1662306048864559,7.351414862857797e-05
ComStage ETF DJ STOXX 600 Basic Resources TR,LU0378435472,2.466769505,1.989682033,0.23978076098956258,0.0001142513648680596
ComStage ETF DJ STOXX 600 Chemicals TR,LU0378435555,0.071858107,0.243334436,-0.704694049139843,3.3281937306846462e-06
ComStage ETF DJ STOXX 600 Construction & Materials TR,LU0378435639,0.205373377,1.6651402,-0.8766630119193567,9.51211233244614e-06
ComStage ETF DJ STOXX 600 Financial Services TR,LU0378435712,0,0.014628799999999999,-1,0
ComStage ETF DJ STOXX 600 Food & Beverage TR,LU0378435803,0.019838358,0.5947874599999999,-0.966646307573465,9.188371567132654e-07
ComStage ETF DJ STOXX 600 Health Care TR,LU0378435985,2.729911383,0.4221755,5.4662951379225,0.0001264390940638786
ComStage ETF DJ STOXX 600 Industrial Goods & Services TR,LU0378436017,0.007552,0.000478363,14.78717417526021,3.4977986623180104e-07
ComStage ETF DJ STOXX 600 Insurance TR,LU0378436108,0.13409175,4.17519075,-0.9678836829191576,6.210618958923214e-06
ComStage ETF DJ STOXX 600 Media TR,LU0378436363,0.0047736,0.5776017,-0.991735481387953,2.210949641742751e-07
ComStage ETF DJ STOXX 600 Oil & Gas TR,LU0378436447,2.157708497,0.649143692,2.3239304696193517,9.993683652646722e-05
ComStage ETF DJ STOXX 600 Personal & Household Goods TR,LU0378436520,0.0043538000000000006,0.0024521,0.775539333632397,2.0165142764830716e-07
ComStage ETF DJ STOXX 600 Real Estate TR,LU0378436793,0.004895,0.007419899999999999,-0.3402876049542446,2.2671774962985515e-07
ComStage ETF DJ STOXX 600 Retail TR,LU0378436876,0.57369,0,,2.657113499185937e-05
ComStage ETF DJ STOXX 600 Technology TR,LU0378437098,0.92667142,2.804199074,-0.6695414998913876,4.291988947675227e-05
ComStage ETF DJ STOXX 600 Telecommunications TR,LU0378437171,0.037616580000000004,0.007029720000000001,4.351077994571619,1.7422566632015153e-06
ComStage ETF DJ STOXX 600 TR,LU0378434582,4.396813254,1.4304230900000001,2.0737851512170424,0.00020364363768939748
ComStage ETF DJ STOXX 600 Travel & Leisure TR,LU0378437254,0,0.39975004,-1,0
ComStage ETF DJ STOXX 600 Utilities TR,LU0378437338,0.376328393,3.5442772519999997,-0.8938208367340219,1.7430097320281866e-05
ComStage ETF Dow Jones Industrial Average TR,LU0378437502,3.1309022179999997,2.112486731,0.48209319947676366,0.0001450114617315796
ComStage ETF MSCI EM Eastern Europe TRN,LU0392495379,0.880511,0.3470083,1.5374349835436214,4.078191469751448e-05
ComStage ETF MSCI EMU TRN,LU0392494729,0.0009672000000000001,0.003999,-0.7581395348837209,4.479701888498385e-08
ComStage ETF MSCI Europe Large Cap TRN,LU0392496187,0.00364121,0,,1.6864697387736975e-07
ComStage ETF MSCI Europe Mid Cap TRN,LU0392496260,0,0,,0
ComStage ETF MSCI Europe Small Cap TRN,LU0392496344,0.00907109,3.63413517,-0.9975039205820184,4.201383271685154e-07
ComStage ETF MSCI Europe TRN,LU0392494646,0,0.01622028,-1,0
ComStage ETF MSCI Japan TRN,LU0392495452,0,13.63372366,-1,0
ComStage ETF MSCI North America TRN,LU0392494992,0.00269344,2.7982457000000003,-0.9990374540734576,1.2474987856241821e-07
ComStage ETF MSCI Pacific ex Japan TRN,LU0392495296,0.77581762,5.7855215300000005,-0.8659035981497765,3.593291622667827e-05
ComStage ETF MSCI Pacific TRN,LU0392495023,0.004499,0.77246,-0.9941757502006576,2.083765384238444e-07
ComStage ETF MSCI Russia 30% Capped TRN,LU0392495536,1.2322696599999998,0.25636105,3.8067741179871124,5.7074035598027926e-05
ComStage ETF MSCI Taiwan TRN,LU0392495619,0.5583864599999999,2.42172825,-0.7694264581502901,2.586233332686029e-05
ComStage ETF MSCI USA Large Cap TRN,LU0392495882,0,12.64422923,-1,0
ComStage ETF MSCI USA Mid Cap TRN,LU0392495965,1.08357498,12.61661641,-0.9141152473224792,5.0187064559921413e-05
ComStage ETF MSCI USA Small Cap TRN,LU0392496005,0.025858811000000002,0.018911869999999997,0.3673323156303425,1.1976816012305914e-06
ComStage ETF MSCI USA TRN,LU0392495700,0.00737,6.15726734,-0.9988030404409889,3.413503196674224e-07
ComStage ETF MSCI World TRN,LU0392494562,6.6820083200000004,8.87294722,-0.24692346811908572,0.0003094851663571745
ComStage ETF NASDAQ-100,LU0378449770,2.9932109810000003,0.367727705,7.139748352656758,0.00013863412824917083
ComStage ETF Nikkei 225,LU0378453376,1.148996029,1.31517391,-0.12635430169079298,5.3217118289789546e-05
ComStage ETF SMI,LU0392496427,3.78009967,3.6600411,0.032802519621979,0.00017507981421020593
ComStage ETF TOPIX,LU0392496773,0.1345,0.21995,-0.388497385769493,6.229527543455673e-06
db x-trackers CAC 40 ETF,LU0322250985,0.7685503199999999,0,,0
db x-trackers CAC 40 Short ETF,LU0322251280,4.91267713,0,,0
db x-trackers Currency Carry ETF,LU0328474126,0.08059825,0.024578,2.279284319309952,3.733003853749637e-06
db x-trackers Currency Momentum ETF,LU0328474043,0.262313011,2.38490413,-0.8900110877832226,1.214933923443339e-05
db x-trackers Currency Returns ETF,LU0328474472,0.03776282,0.25686164,-0.8529838087150732,1.7490299428145633e-06
db x-trackers Currency Valuation ETF,LU0328473748,0.0089235,0.0124382,-0.2825730411152739,4.133025206990832e-07
db x-trackers DAX ETF,LU0274211480,240.97604454100002,239.473303748,0.006275191303082961,0.011161092243726101
db x-trackers DBLCI - OY Balanced ETF,LU0292106167,12.972325227,13.967947532,-0.07127906964993025,0.000600828678842092
db x-trackers DJ EURO STOXX 50 ETF,LU0274211217,153.66943961,260.676850275,-0.4104983260006132,0.007117382948980619
db x-trackers DJ EURO STOXX 50 Short ETF,LU0292106753,471.615858681,356.896775048,0.3214349124269087,0.021843449677202885
"db x-trackers DJ EURO STOXX ETF Anteilsklasse ""1C""",LU0380865021,20.8409486,30.047503539999997,-0.30639999518575634,0.0009652733333490257
db x-trackers DJ EURO STOXX Select Dividend 30 ETF,LU0292095535,0.70527978,3.04508236,-0.7683872892029101,3.266587223310303e-05
db x-trackers DJ Islamic Market Titans 100 ETF,LU0328475529,0.00023219999999999998,0.15965823,-0.9985456434034125,1.0754619298069942e-08
db x-trackers DJ STOXX 600 Banks ETF,LU0292103651,9.60896209,18.956134885,-0.4930948662111717,0.00044505051303848615
db x-trackers DJ STOXX 600 Banks Short ETF,LU0322249037,26.610458511999997,13.341595657,0.9945484180550892,0.0012324950501448955
db x-trackers DJ STOXX 600 Basic Resources ETF,LU0292100806,2.254456396,27.339432449,-0.917538288323814,0.00010441783059034803
db x-trackers DJ STOXX 600 ETF,LU0328475792,0.30421403999999996,0,,0
db x-trackers DJ STOXX 600 Food & Beverage ETF,LU0292105359,1.2365691699999999,8.94039074,-0.8616873461170446,5.72731725197258e-05
db x-trackers DJ STOXX 600 Health Care ETF,LU0292103222,3.4795514169999997,15.67743792,-0.7780535675053721,0.00016115956424588634
db x-trackers DJ STOXX 600 Health Care Short ETF,LU0322249466,1.04534858,0.0242383,42.12796607022769,4.841656335778644e-05
db x-trackers DJ STOXX 600 Industrial Goods ETF,LU0292106084,0.15520495,4.51161222,-0.9655987832216661,7.188501939819038e-06
db x-trackers DJ STOXX 600 Insurance ETF,LU0292105193,1.46535245,2.97072122,-0.5067351186860947,6.78695423653922e-05
db x-trackers DJ STOXX 600 Oil & Gas ETF,LU0292101796,3.500488065,7.7498674670000005,-0.5483163963892855,0.00016212927001082046
db x-trackers DJ STOXX 600 Oil & Gas Short ETF,LU0322249623,5.373649028,8.370172179999999,-0.3580001805888776,0.00024888694891293534
db x-trackers DJ STOXX 600 Technology ETF,LU0292104469,0.10987373,3.25734398,-0.9662689201157073,5.088932545258081e-06
db x-trackers DJ STOXX 600 Technology Short ETF,LU0322250043,9.360502539999999,3.18920446,1.9350587763821196,0.00043354281333469726
db x-trackers DJ STOXX 600 Telecommunications ETF,LU0292104030,0.73009205,6.89005991,-0.8940369083089729,3.3815082042624655e-05
db x-trackers DJ STOXX 600 Telecommunications Short ETF,LU0322250126,0.38428038,0.19647125599999998,0.9559114540398723,1.7798403060368865e-05
db x-trackers DJ STOXX 600 Utilities ETF,LU0292104899,0.654983483,9.941156416,-0.9341139545952799,3.0336339389271602e-05
db x-trackers DJ STOXX Global Select Dividend 100 ETF,LU0292096186,1.1272571599999999,0.620115686,0.8178175225194995,5.22102567046663e-05
db x-trackers FTSE 100 ETF,LU0292097234,2.248174267,11.37238072,-0.8023127854798023,0.00010412686631051872
db x-trackers FTSE 100 Short ETF,LU0328473581,2.2938186660000004,3.3515034700000004,-0.3155851734803664,0.00010624094096312083
db x-trackers FTSE 250 ETF,LU0292097317,0.1068,0.03951,1.703113135914958,4.946569082833204e-06
db x-trackers FTSE All-Share ETF,LU0292097747,0.009726700000000001,0.0029325,2.3168627450980392,4.505036844381435e-07
db x-trackers FTSE Vietnam ETF,LU0322252924,2.201308992,2.700225521,-0.18476846660394186,0.00010195624533323898
db x-trackers FTSE/XINHUA China 25 ETF,LU0292109856,10.466838637,8.772826843,0.19309759833589824,0.0004847840861122493
db x-trackers II Emerging Markets Liquid Eurobond Index ETF,LU0321462953,0.489779835,0.06923564900000001,6.074098994868957,2.2684735853990146e-05
db x-trackers II EONIA TRI ETF,LU0290358497,777.866555986,880.4776520290001,-0.11654026176194243,0.03602781513492782
db x-trackers II EONIA TRI ETF 1D,LU0335044896,39.406713093,19.758628350000002,0.994405299546008,0.0018251688075085412
db x-trackers II FED Funds Effective Rate TRI ETF,LU0321465469,13.26702047,28.61516833,-0.5363640598929862,0.000614477839683682
db x-trackers II Global Sovereign EUR Hedged Index ETF,LU0378818131,0.21222158,0.022086,8.608873494521415,9.829295003164919e-06
db x-trackers II iBoxx € Germany Covered TRI ETF,LU0321463506,31.571302895,7.575806835,3.167384884886654,0.00146226246072256
db x-trackers II iBoxx € Inflation-Linked TRI ETF,LU0290358224,5.224379099999999,14.056970274,-0.6283424523090089,0.00024197333457921306
db x-trackers II iBoxx € Sovereigns Eurozone 10-15 TRI ETF,LU0290357333,3.91956011,5.76488235,-0.32009712045554584,0.00018153909043475946
db x-trackers II iBoxx € Sovereigns Eurozone 1-3 TRI ETF,LU0290356871,44.638843689000005,47.158098498,-0.05342146713372764,0.0020675011618486094
db x-trackers II iBoxx € Sovereigns Eurozone 15+ TRI ETF,LU0290357507,0.32134928,21.32912918,-0.9849337834054039,1.4883674281261332e-05
db x-trackers II iBoxx € Sovereigns Eurozone 25+ TRI ETF,LU0290357846,0.68811148,13.49844379,-0.9490229028838294,3.187070198979961e-05
db x-trackers II iBoxx € Sovereigns Eurozone 3-5 TRI ETF,LU0290356954,7.57214829,15.50011092,-0.5114777997988674,0.0003507130582578868
db x-trackers II iBoxx € Sovereigns Eurozone 5-7 TRI ETF,LU0290357176,17.37586133,44.302817282,-0.6077933098611379,0.0008047836932825377
db x-trackers II iBoxx € Sovereigns Eurozone 7-10 TRI ETF,LU0290357259,0.57421564,6.31608217,-0.9090867369130506,2.6595480633925853e-05
db x-trackers II iBoxx € Sovereigns Eurozone TRI ETF,LU0290355717,8.855334638,19.797643328000003,-0.5527076384149313,0.00041014536084712323
db x-trackers II iBoxx Global Inflation-Linked TRI Hedged ETF,LU0290357929,7.3353355449999995,8.807727643,-0.1671704845653571,0.0003397447941863712
db x-trackers II iTraxx Crossover 5-year Short TRI ETF,LU0321462870,0.47802306,1.75981826,-0.7283679395393932,2.2140206830311997e-05
db x-trackers II iTraxx Crossover 5-year TRI ETF,LU0290359032,11.53340076,22.179298261,-0.4799925306798236,0.0005341831799563761
db x-trackers II iTraxx Europe 5-year Short TRI ETF,LU0321462102,0.00401724,0,,1.8606325077079455e-07
db x-trackers II iTraxx Europe 5-year TRI ETF,LU0290358653,4.04246006,4.570403860000001,-0.11551359927304128,0.00018723134785940127
db x-trackers II iTraxx Europe Senior Financials 5-year   TRI ETF,LU0378819295,0,1.4220925,-1,0
db x-trackers II iTraxx Europe Senior Financials 5-year  Short TRI ETF,LU0378819709,0.00010961,0.00010927,0.003111558524755198,5.076717576492017e-09
db x-trackers II iTraxx Europe Subordinated Financials 5- year Short TRI ETF,LU0378819881,0.28289195,0.1042778,1.7128684149454627,1.310247728138948e-05
db x-trackers II iTraxx Europe Subordinated Financials 5- year TRI ETF,LU0378819378,0,0.00010431999999999999,-1,0
db x-trackers II iTraxx HiVol 5-year Short TRI ETF,LU0321462441,0.00137892,0.03699215,-0.9627239833315987,6.386632059644532e-08
db x-trackers II iTraxx HiVol 5-year TRI ETF,LU0290358737,6.74778778,7.74952625,-0.12926447858667478,0.000312531820318986
db x-trackers II Short IBOXX € Sovereigns Eurozone TRI ETF,LU0321463258,9.566962455,9.703746379,-0.014095991244785111,0.00044310524996750043
db x-trackers II SONIA TRI ETF,LU0321464652,2.33133352,1.6908063999999998,0.3788293680459218,0.0001079784860655871
db x-trackers LPX MM Private Equity ETF,LU0322250712,0.038657004999999994,0.25648812,-0.8492834482938235,1.7904451850929637e-06
db x-trackers MSCI AC Asia ex Japan TRN Index ETF,LU0322252171,1.00940866,0,,0
db x-trackers MSCI Brazil TRN Index ETF,LU0292109344,26.727086082,19.461934417,0.3733005933189195,0.0012378967948262435
db x-trackers MSCI EM Asia TRN Index ETF,LU0292107991,2.3446434,14.676632895,-0.8402465049869329,0.0001085949489954019
db x-trackers MSCI EM EMEA TRN Index ETF,LU0292109005,3.73640829,2.54081118,0.47055724542270005,0.00017305619595651384
db x-trackers MSCI EM LATAM TRN Index ETF,LU0292108619,13.792239621,9.384569849,0.4696720087250106,0.0006388039896279564
db x-trackers MSCI Emerging Markets TRN Index ETF,LU0292107645,10.121456131999999,18.981874390999998,-0.4667831045811286,0.00046878728441763796
db x-trackers MSCI Europe Mid Cap TRN Index ETF,LU0322253732,0.21122099,0.81247692,-0.7400283198198419,9.782951486698701e-06
db x-trackers MSCI Europe Small Cap TRN Index ETF,LU0322253906,0.28393525,0.3758919,-0.24463589132939556,1.315079896232693e-05
db x-trackers MSCI Europe TRN Index ETF,LU0274209237,31.176467859000002,61.351074473,-0.4918350146789938,0.0014439752062104165
db x-trackers MSCI Japan TRN Index ETF,LU0274209740,22.25514284,12.713322089,0.7505371675634578,0.0010307734223443889
db x-trackers MSCI Korea TRN Index ETF,LU0292100046,6.074828169,4.67308445,0.29996113573338046,0.00028136289517134494
db x-trackers MSCI Pacific ex Japan TRN Index ETF,LU0322252338,0.30559903000000005,0,,0
db x-trackers MSCI Russia Capped Index ETF,LU0322252502,13.18025374,8.08962061,0.6292795886752962,0.0006104591353387706
db x-trackers MSCI Taiwan TRN Index ETF,LU0292109187,5.3434845310000005,5.46127946,-0.021569108459430386,0.000247489844341218
db x-trackers MSCI USA TRN Index ETF,LU0274210672,20.166578695000002,42.879224005999994,-0.5296888140471447,0.0009340390887566459
db x-trackers MSCI World TRN Index ETF,LU0274208692,14.557850359,24.86118075,-0.414434474959521,0.0006742641619694911
db x-trackers Quirin Wealth Management Total Return Index ETF,LU0397221945,1.21754923,0.51807132,1.3501575613180052,5.639224136652971e-05
db x-trackers S&P 500 Shariah ETF,LU0328475362,0.33417571,0.13382616,1.497088088009101,1.5477745649062122e-05
db x-trackers S&P 500 Short ETF,LU0322251520,34.108393494000005,14.683629795,1.322885687680197,0.001579770830735296
db x-trackers S&P CNX NIFTY ETF,LU0292109690,5.447683056,9.736716406,-0.4405010037425958,0.00025231592301389424
db x-trackers S&P Europe 350 Shariah ETF,LU0328475107,0,0.08135,-1,0
db x-trackers S&P Global Infrastructure ETF,LU0322253229,1.404233616,1.370531105,0.02459083991384503,6.503875084251567e-05
db x-trackers S&P Japan 500 Shariah ETF,LU0328475289,0.016611,0.016956799999999998,-0.0203929986789958,7.693582306642541e-07
db x-trackers S&P Select Frontier ETF,LU0328476410,0.04180656,0.22381657000000002,-0.8132106126012029,1.9363205726180834e-06
db x-trackers S&P/ASX 200 ETF,LU0328474803,3.5690537599999996,3.28701883,0.08580265115183394,0.0001653049717620374
db x-trackers S&P/MIB Index ETF,LU0274212538,1.7890278400000001,0.7260665,1.4639999779634514,8.286095319917479e-05
db x-trackers ShortDAX ETF,LU0292106241,899.194685309,671.693383547,0.3386981431328646,0.041647271814582686
db x-trackers SLI ETF,LU0322248146,0.39668852000000004,1.18850624,-0.6662293333857464,1.837310082909046e-05
db x-trackers SMI ETF,LU0274221281,10.115380235,20.369014510000003,-0.5033937341429093,0.0004685058720182871
EasyETF EPRA Eurozone,LU0192223062,0.061915375,0.514370905,-0.8796289323557288,2.867684267106965e-06
EasyETF GS Ultra-Light Energy,LU0246046329,0.09583219999999999,2.9805267,-0.9678472264650405,4.438582375092585e-06
EasyETF GSAL,LU0252701189,9.600812150000001,4.329712607,1.2174248088609918,0.00044467303886965714
EasyETF GSCI,LU0203243414,8.328744952,17.847822585,-0.5333467198962523,0.00038575573294350477
EasyETF GSNE,LU0230484932,3.26910533,3.61512943,-0.09571554952598205,0.00015141250331370071
EasyETF iTraxx Crossover,LU0281436138,0,0.0463478,-1,0
EasyETF iTraxx Europe HiVol,LU0281436302,1.4909947,0.07953980000000001,17.74526589204398,6.90571936862188e-05
EasyETF NMX Infrastructure Europe,LU0315455286,0.05373421,0.10279722,-0.4772795412171652,2.4887638752478157e-06
EasyETF NMX30 Infrastructure Global,LU0315440411,0.48403078000000005,1.1864800500000001,-0.5920447377096648,2.241846153078315e-05
EasyETF S&P GSCI Light Energy Dynamic TR,LU0309198074,0.43480102000000004,4.91776756,-0.9115856911301436,2.013832661719421e-05
ETFlab DAX,DE000ETFL011,32.97365405,62.932944049999996,-0.4760509849371968,0.0015272140231438937
ETFlab DAX Preisindex,DE000ETFL060,0.89681054,3.13124278,-0.7135927799249089,4.153684728766807e-05
ETFlab DJ EURO STOXX 50,DE000ETFL029,31.619581366000002,51.156269200000004,-0.3819021234253729,0.0014644985355541618
ETFlab DJ EURO STOXX Select Dividend 30,DE000ETFL078,0.51903113,0.73256029,-0.29148339449303207,2.4039544388445518e-05
ETFlab DJ STOXX Strong Growth 20,DE000ETFL037,0.00024765000000000003,0.00025564,-0.031254889688624554,1.1470204432243848e-08
ETFlab DJ STOXX Strong Style Composite 40,DE000ETFL052,0.9206557,0.27513565999999995,2.3461882040299686,4.26412642467618e-05
ETFlab DJ STOXX Strong Value 20,DE000ETFL045,0.00210116,0.0647927,-0.967571038095341,9.731772560005443e-08
ETFlab MSCI Europe LC,DE000ETFL086,0.008214780000000001,5.98790527,-0.9986281045491556,3.8047731058311375e-07
ETFlab MSCI Japan LC,DE000ETFL102,0.01982888,0.25403654000000003,-0.9219447721969446,9.183981718652589e-07
ETFlab MSCI USA LC,DE000ETFL094,2.35359322,5.41559558,-0.5654045459576211,0.00010900947055821953
ETFS DAXglobal Alternative Energy Fund,DE000A0Q8M94,0.041611730000000006,0.23719259,-0.8245656409418186,1.9272967893371063e-06
ETFS Janney Global Water Fund,DE000A0Q8M86,0.30908199,0.34836646000000004,-0.11276765851683901,1.431550014788915e-05
ETFS Russell 1000 Fund,DE000A0Q8ND6,0.03346949,0.11679147,-0.7134252184684378,1.5501792551703657e-06
ETFS Russell 2000 Fund,DE000A0Q8NE4,0.11884466,0.0014125,83.13781238938054,5.504431842844794e-06
ETFS S-Net ITG Global Agri Business Fund,DE000A0Q8NA2,0.23225184,0.06578156,2.5306526631475443,1.0757020329355092e-05
ETFS WNA Global Nuclear Energy Fund,DE000A0Q8M37,0.01393976,0.23991766,-0.9418977327471433,6.456365715179305e-07
iShares $ Corporate Bond,DE000A0DPYY0,0.7161945799999999,1.225275455,-0.4154827985189665,3.3171404182778194e-05
iShares $ TIPS,DE000A0LGQF7,0.7432508689999999,3.51681933,-0.7886582166278073,3.442454840247482e-05
iShares $ Treasury Bond 1-3,DE000A0J2078,21.54643948,28.98679696,-0.25668091201201826,0.0009979489829298196
iShares $ Treasury Bond 7-10,DE000A0LGQB6,12.924614876,9.1513555,0.4123169923843524,0.0005986189171643042
iShares € Corporate Bond,DE0002511243,68.677341387,63.250064788,0.08580665675507215,0.003180872786480481
iShares € Government Bond 1-3,DE000A0J21A7,62.9997559,9.757308645,5.4566734734053295,0.0029179086588106617
iShares € Government Bond 15-30,DE000A0LGQC4,8.24866333,12.53461115,-0.3419290609585445,0.00038204665733031814
iShares € Government Bond 3-5,DE000A0LGQD2,37.83282552,7.01925836,4.389860805750424,0.0017522723317739233
iShares € Government Bond 7-10,DE000A0LGQH3,43.21829696,31.755370673,0.3609759874963876,0.0020017068497662945
iShares € Inflation Linked Bond,DE000A0HG2S8,7.742582855,6.737893122,0.14911036948917644,0.0003586069379383655
iShares ATX (DE),DE000A0D8Q23,4.2022170690000005,2.2427427119999996,0.873695563256389,0.00019463068382836484
iShares DAX (DE),DE0005933931,1144.588526612,1102.424918646,0.038246239950549654,0.053012979572139775
iShares DivDAX (DE),DE0002635273,20.179441748,16.716562019999998,0.2071526264704997,0.0009346348563622698
iShares DJ Asia/Pacific Select Dividend,DE000A0J2086,0.18908628,0.49736771999999996,-0.6198259911198096,8.757756054643655e-06
iShares DJ Asia/Pacific Select Dividend 30 (DE),DE000A0H0744,0.288526554,2.1861635219999997,-0.8680215129854316,1.3363450670344614e-05
iShares DJ China Offshore 50 (DE),DE000A0F5UE8,2.584687485,2.08564151,0.23927696711406554,0.00011971287642403473
iShares DJ EURO STOXX (DE),DE000A0D8Q07,18.654859259,21.576682673,-0.13541578463570902,0.0008640220042619299
iShares DJ EURO STOXX 50,IE0008471009,491.939742142,441.704031103,0.11373161099198947,0.02278477452337599
iShares DJ EURO STOXX 50 (DE),DE0005933956,596.8068978719999,741.7584593830001,-0.19541612188902013,0.027641821623925356
ishares DJ EURO STOXX Banks (DE),DE0006289309,13.13123954,14.300167697000001,-0.08174226916550276,0.0006081889843430796
iShares DJ EURO STOXX Growth,DE000A0HG3L1,1.05229952,3.8892221499999997,-0.7294318813853304,4.873850441490843e-05
iShares DJ EURO STOXX Healthcare (DE),DE0006289333,0.28224828,0.46971854100000004,-0.3991119034834948,1.3072664939427427e-05
iShares DJ EURO STOXX MidCap,DE000A0DPMX7,2.91368129,5.961197820000001,-0.5112255325222541,0.00013495061597699966
iShares DJ EURO STOXX Select Dividend,DE000A0HG2P4,2.813953803,3.46888438,-0.18880150078683222,0.0001303316187494449
iShares DJ EURO STOXX Select Dividend 30 (DE),DE0002635281,6.544273528,13.928814233999999,-0.5301629113535351,0.00030310581557311395
iShares DJ EURO STOXX SmallCap,DE000A0DPMZ2,1.5942039,2.5249510699999997,-0.36861988379046096,7.38374505943082e-05
iShares DJ EURO STOXX Sustainability 40 (DE),DE000A0F5UG3,2.31011945,2.5216540899999997,-0.0838872551310158,0.00010699593117061466
iShares DJ EURO STOXX Technology (DE),DE0006289325,1.2599596599999998,2.40296511,-0.47566460505121533,5.835653089675125e-05
iShares DJ EURO STOXX Telecommunication (DE),DE0006289317,1.3778883,2.47322805,-0.4428785893803848,6.381853618331088e-05
iShares DJ EURO STOXX Value,DE000A0HG2N9,2.76945139,6.3146356500000005,-0.5614234069070954,0.00012827043653729813
iShares DJ Global Titans 50 (DE),DE0006289382,0.419411169,0.640220136,-0.34489537986040486,1.942552735552745e-05
iShares DJ Industrial Average (DE),DE0006289390,17.238561213,13.833129162,0.2461794443700287,0.0007984244749883281
iShares DJ STOXX 50,IE0008470928,135.351274833,78.206940897,0.7306811042674608,0.006268955350290053
iShares DJ STOXX 50 (DE),DE0005933949,82.9051928,80.764864722,0.026500732532236615,0.0038398526545955604
iShares DJ STOXX 600 (DE),DE0002635307,36.167285898,34.119098292000004,0.060030531536064746,0.001675130882331799
iShares DJ STOXX 600 Automobiles & Parts (DE),DE0006344716,5.487117230000001,2.1480447099999997,1.5544706795232401,0.0002541423637059866
iShares DJ STOXX 600 Automobiles & Parts Swap (DE),DE000A0D8Q56,0.00460305,0.02792158,-0.8351436415847527,2.1319573798441364e-07
iShares DJ STOXX 600 Banks (DE),DE0006289341,16.349362998,33.389167918,-0.510339310097449,0.0007572402015910485
iShares DJ STOXX 600 Banks Swap (DE),DE000A0D8Q64,1.0017506999999999,2.06653057,-0.5152499970034317,4.63972756678513e-05
iShares DJ STOXX 600 Basic Resources (DE),DE0006344724,26.376208383,23.246248386,0.1346436614212989,0.0012216454766827132
iShares DJ STOXX 600 Basic Resources Swap (DE),DE000A0D8Q72,0.213141126,1.2121226159999998,-0.8241587747093071,9.871884870335732e-06
iShares DJ STOXX 600 Chemicals (DE),DE0006344732,2.95303815,4.673123379,-0.3680804227702801,0.000136773475779185
iShares DJ STOXX 600 Chemicals Swap (DE),DE000A0D8Q80,0.00531328,0.52393,-0.9898587979310213,2.4609088554715357e-07
iShares DJ STOXX 600 Construction & Materials (DE),DE0006344740,2.8520942000000002,4.03375198,-0.2929425968326391,0.0001320981366202987
iShares DJ STOXX 600 Construction & Materials Swap (DE),DE000A0F5T02,0.036037120000000006,20.40758464,-0.9982341310529534,1.6691020938796828e-06
iShares DJ STOXX 600 Financial Services (DE),DE0006344773,0.26853191,0.347197589,-0.2265732294586873,1.2437374941574422e-05
iShares DJ STOXX 600 Financial Services Swap (DE),DE000A0F5T10,2.739e-05,0.6498446600000001,-0.9999578514656102,1.2686004417490772e-09
iShares DJ STOXX 600 Food & Beverage (DE),DE0006344781,2.269850735,12.771317351,-0.8222696474751472,0.00010513083771907512
iShares DJ STOXX 600 Food & Beverage Swap (DE),DE000A0F5T28,0.21077876999999998,0.9200023199999999,-0.7708932190518825,9.762469541194856e-06
iShares DJ STOXX 600 Healthcare (DE),DE0006289374,17.814950331,17.84530857,-0.0017011887959750283,0.0008251206228420762
