European ETF Statistics ,Unnamed: 1,Unnamed: 2,Unnamed: 3,Unnamed: 4,Unnamed: 5
db x-trackers DJ STOXX 600 Health Care ETF,LU0292103222,2.346897,2.221777,0.05631528276690223,8.37482626733416e-05
db x-trackers DJ STOXX 600 Health Care Short ETF,LU0322249466,0.5199233,9.61127,-0.9459048283941665,1.855329530797073e-05
db x-trackers DJ STOXX 600 Industrial Goods ETF,LU0292106084,0.3769314,0.01373871,26.43571994750599,1.3450675465105794e-05
db x-trackers DJ STOXX 600 Insurance ETF,LU0292105193,1.00123,0.10990380000000001,8.110058068965769,3.572856969710636e-05
db x-trackers DJ STOXX 600 Oil & Gas ETF,LU0292101796,2.632604,2.141011,0.22960788151018363,9.394362484032738e-05
db x-trackers DJ STOXX 600 Oil & Gas Short ETF,LU0322249623,1.781307,12.92107,-0.8621393584277464,6.356536590138473e-05
db x-trackers DJ STOXX 600 Technology ETF,LU0292104469,0.1308921,0.1882856,-0.30482150520273454,4.670842381521343e-06
db x-trackers DJ STOXX 600 Technology Short ETF,LU0322250043,0.2682426,2.496194,-0.892539361924594,9.572150684491097e-06
db x-trackers DJ STOXX 600 Telecommunications ETF,LU0292104030,2.16011,0.2697897,7.006643693217345,7.708282880898136e-05
db x-trackers DJ STOXX 600 Telecommunications Short ETF,LU0322250126,1.136522,10.48771,-0.8916329684935986,4.055642109135235e-05
db x-trackers DJ STOXX 600 Utilities ETF,LU0292104899,0.5958511999999999,0.05543658,9.748339814613383,2.126275793604312e-05
db x-trackers DJ STOXX Global Select Dividend 100 ETF,LU0292096186,1.21573,1.169606,0.03943550221185599,4.3382933030235916e-05
db x-trackers FTSE 100 Short ETF,LU0328473581,0.836549,1.996691,-0.5810323179700815,2.9851981314527754e-05
db x-trackers FTSE MIB Index ETF,LU0274212538,34.78891,8.436163,3.1237835257569113,0.0012414310354477596
db x-trackers FTSE Vietnam ETF,LU0322252924,2.817389,3.044618,-0.07463300814749174,0.00010053761798024506
db x-trackers FTSE/XINHUA China 25 ETF,LU0292109856,13.54772,12.3514,0.09685703644930932,0.0004834460196527089
db x-trackers II Emerging Markets Liquid Eurobond Index ETF,LU0321462953,3.476533,2.320028,0.49848751825408977,0.00012405895907512782
db x-trackers II EONIA TRI ETF,LU0290358497,31.60763,17.10578,0.8477748456954317,0.0011279080844714497
db x-trackers II EONIA TRI ETF 1D,LU0335044896,0.5115486,0.38389870000000004,0.3325093312376415,1.825444683894528e-05
db x-trackers II FED Funds Effective Rate TRI ETF,LU0321465469,2.43292,1.616924,0.5046594645141023,8.681796568968568e-05
db x-trackers II Global Sovereign EUR Hedged Index ETF,LU0378818131,0.047686269999999996,0.0028648000000000002,15.645584333984917,1.7016691682131295e-06
db x-trackers II iBoxx € Inflation-Linked TRI ETF,LU0290358224,2.469866,0.3224162,6.660489764472134,8.813637178621625e-05
db x-trackers II iBoxx € Sovereigns Eurozone 10-15 TRI ETF,LU0290357333,0.1307764,0.1403394,-0.06814194730774126,4.666713664329533e-06
db x-trackers II iBoxx € Sovereigns Eurozone 1-3 TRI ETF,LU0290356871,1.632005,1.50717,0.08282741827398366,5.8237572174751106e-05
db x-trackers II iBoxx € Sovereigns Eurozone 15+ TRI ETF,LU0290357507,0.14478970000000002,0.03529212,3.102607040891848,5.166773756153052e-06
db x-trackers II iBoxx € Sovereigns Eurozone 25+ TRI ETF,LU0290357846,0.032417,0.120674,-0.7313671544823243,1.1567901919350166e-06
db x-trackers II iBoxx € Sovereigns Eurozone 3-5 TRI ETF,LU0290356954,0.5118725,0.6587845999999999,-0.2230047575489773,1.826600510600169e-05
db x-trackers II iBoxx € Sovereigns Eurozone 5-7 TRI ETF,LU0290357176,0.3207035,0.3833668,-0.16345520791054424,1.1444200984644833e-05
db x-trackers II iBoxx € Sovereigns Eurozone 7-10 TRI ETF,LU0290357259,0.09135283,0.2126391,-0.5703855499764625,3.259896281256962e-06
db x-trackers II iBoxx € Sovereigns Eurozone TRI ETF,LU0290355717,0.5529169,3.386325,-0.8367206632558895,1.9730661284977463e-05
db x-trackers II iBoxx Global Inflation-Linked TRI Hedged ETF,LU0290357929,0.2910085,0.2836778,0.025841641467890808,1.0384544484983844e-05
db x-trackers II iTraxx Crossover 5-year Short TRI ETF,LU0321462870,1.085997,0.0160635,66.6064992062751,3.875345275845551e-05
db x-trackers II iTraxx Crossover 5-year TRI ETF,LU0290359032,0.2950667,0.1206067,1.4465199694544335,1.05293600433918e-05
db x-trackers II iTraxx Europe 5-year Short TRI ETF,LU0321462102,0.016370950000000002,0,,5.841920718344869e-07
db x-trackers II iTraxx Europe 5-year TRI ETF,LU0290358653,0.03559694,0.08393573,-0.5759024196251108,1.2702653254434178e-06
db x-trackers II iTraxx Europe Senior Financials 5-year   TRI ETF,LU0378819295,0.3560437,0.1920191,0.8542098155860538,1.2705304625975676e-05
db x-trackers II iTraxx Europe Senior Financials 5-year  Short TRI ETF,LU0378819709,0.00032046,0,,1.1435511765662938e-08
db x-trackers II iTraxx Europe Subordinated Financials 5- year Short TRI ETF,LU0378819881,0,0.0588325,-1,0
db x-trackers II iTraxx Europe Subordinated Financials 5- year TRI ETF,LU0378819378,0.011151,0.0149934,-0.25627276001440635,3.979198392901061e-07
db x-trackers II iTraxx HiVol 5-year Short TRI ETF,LU0321462441,0.533369,0.00211,251.78151658767774,1.903310077682043e-05
db x-trackers II iTraxx HiVol 5-year TRI ETF,LU0290358737,0.037966190000000004,0.019501630000000002,0.9468213682651141,1.3548112477138944e-06
db x-trackers II Short iBoxx € Sovereigns Eurozone TRI ETF,LU0321463258,4.321262,1.622641,1.6631041616722366,0.00015420284105196327
db x-trackers II SONIA TRI ETF,LU0321464652,0.14350960000000001,0.6455749000000001,-0.7777026337300288,5.121093800429327e-06
db x-trackers LPX MM Private Equity ETF,LU0322250712,0.044265559999999995,0.2168247,-0.795846321936569,1.5796022348925251e-06
db x-trackers MSCI AC Asia ex Japan TRN Index ETF,LU0322252171,6.226903,7.141133,-0.128023102216413,0.00022220502565106984
db x-trackers MSCI Brazil TRN Index ETF,LU0292109344,17.69963,13.38694,0.3221565197124958,0.0006316055891932868
db x-trackers MSCI EM Asia TRN Index ETF,LU0292107991,5.52557,7.44507,-0.2578216188699368,0.00019717818369529476
db x-trackers MSCI EM EMEA TRN Index ETF,LU0292109005,4.143373,1.051872,2.939046766146452,0.00014785492944838715
db x-trackers MSCI EM LATAM TRN Index ETF,LU0292108619,8.563649,6.952382,0.23175754726941067,0.00030559105316266505
db x-trackers MSCI Emerging Markets TRN Index ETF,LU0292107645,12.47093,6.027586,1.06897587193281,0.0004450211157203984
db x-trackers MSCI Europe Mid Cap TRN Index ETF,LU0322253732,0.04353375,0.026238599999999997,0.6591491161876017,1.5534878310192501e-06
db x-trackers MSCI Europe Small Cap TRN Index ETF,LU0322253906,0.1621072,0.8976583,-0.8194110164190539,5.784743159516554e-06
db x-trackers MSCI Europe TRN Index ETF,LU0274209237,4.522339,3.008751,0.503061901765882,0.00016137820895842337
db x-trackers MSCI Japan TRN Index ETF,LU0274209740,6.086584,7.147096,-0.14838362322263476,0.00021719778738281154
db x-trackers MSCI Korea TRN Index ETF,LU0292100046,5.682228,4.716918,0.20464845901497553,0.00020276847390994003
db x-trackers MSCI Pacific ex Japan TRN Index ETF,LU0322252338,7.192767,8.168218,-0.11942029461015846,0.0002566715710421647
db x-trackers MSCI Pan-Euro TRN Index ETF,LU0412624271,0.00033408,0.11021,-0.9969686961255785,1.1921537073808506e-08
db x-trackers MSCI Russia Capped Index ETF,LU0322252502,5.446543,1.640669,2.3197086066720347,0.0001943581306830466
db x-trackers MSCI Taiwan TRN Index ETF,LU0292109187,8.158065,3.697853,1.206162603002337,0.00029111791890576986
db x-trackers MSCI USA TRN Index ETF,LU0274210672,17.96063,12.61672,0.4235577868098839,0.0006409192900321996
db x-trackers MSCI World TRN Index ETF,LU0274208692,4.163916,7.222039,-0.42344315781180353,0.00014858799977916795
db x-trackers Russell 2000 ETF,LU0322248658,1.918711,8.074586,-0.7623765478502551,6.846858333460307e-05
db x-trackers S&P 500 Short ETF,LU0322251520,9.627464,8.489647,0.13402406484038742,0.0003435529484038456
db x-trackers S&P CNX NIFTY ETF,LU0292109690,1.021221,3.014307,-0.6612086957300634,3.644194208588301e-05
db x-trackers S&P Global Infrastructure ETF,LU0322253229,0.1442714,0.08903023,0.6204765504930179,5.1482783877821375e-06
db x-trackers S&P Select Frontier ETF,LU0328476410,0.1132891,0.5025302,-0.7745626034017459,4.042685002719107e-06
db x-trackers S&P/ASX 200 ETF,LU0328474803,5.640806,5.849737,-0.035716306562158184,0.00020129034319672374
db x-trackers ShortDAX ETF,LU0292106241,141.3423,77.70355,0.8189941128815863,0.005043754398788805
db x-trackers SMI ETF,LU0274221281,8.921951,2.246875,2.9708265924895687,0.0003183769444959377
EasyETF DJ EURO STOXX,FR0010230516,0.1416706,0.07206051,0.9659949672851333,5.055469678426411e-06
EasyETF DJ South Africa FTSE/JSE Top 40,FR0010636571,0,,,0
EasyETF DJ South Korea Titans 30,FR0010636530,0,,,0
EasyETF EPRA Eurozone,LU0192223062,2.696973,0.8564598,2.14897792050485,9.624061184913956e-05
EasyETF EURO STOXX 50-B1 CAP,FR0010129072,0,,,0
EasyETF FTSE Xinhua China 25,FR0010636589,0,,,0
EasyETF GS Ultra-Light Energy,LU0246046329,0.1238765,0.03605724,2.4355513622229545,4.420492957745569e-06
EasyETF GSNE,LU0230484932,0.02363965,0.03509946,-0.32649533639548867,8.435732874965795e-07
EasyETF iBoxx Liquid Sovereigns Extra Short,FR0010276923,0.49806490000000003,0.6886649,-0.2767674089386579,1.7773285352348918e-05
EasyETF iBoxx Liquid Sovereigns Global,FR0010276949,3.380778,0.1303894,24.928319326571025,0.0001206419727769282
EasyETF iBoxx Liquid Sovereigns Long,FR0010276964,3.068453,0.03328387,91.19039132168224,0.00010949675586308349
EasyETF S&P 100,FR0010616300,0,,,0
EasyETF S-Box BNP Parib Next 11 Emerging,FR0010616656,0,,,0
ETFS DAX Global Alternative Energy,IE00B3CNHC86,0.07505655,0.10087710000000001,-0.2559604707113905,2.6783687842946653e-06
ETFS DJ STOXX 600 Basic Resources,IE00B3CNH733,0.8366299,0.5837988000000001,0.43307917042652355,2.9854868204941045e-05
ETFS DJ STOXX 600 Oil & Gas,IE00B3CNH840,0.1795304,0.2050462,-0.1244392727102478,6.406484433296429e-06
ETFS DJ STOXX 600 Utilities,IE00B3CNH956,0.251713,0.0007423999999999999,338.0530711206897,8.9822972385643e-06
ETFS Janney Global Water TR,IE00B3CNHB79,0.0004108,0.0041375,-0.9007129909365559,1.4659265534963286e-08
ETFS RUSSELL 1000,IE00B3CNHH32,0.8174768,0.781291,0.046315393368156155,2.9171396007478273e-05
ETFS RUSSELL 2000,IE00B3CNHJ55,1.564852,1.543802,0.013635168240486717,5.584123902365717e-05
ETFS RUSSELL Global Coal,IE00B3CNHF18,0.0139454,0.028668799999999998,-0.5135687576738475,4.976371022182984e-07
ETFS RUSSELL Global Gold Miner,IE00B3CNHG25,0.1548709,0.07905382000000001,0.9590565010014693,5.526518127406878e-06
ETFS RUSSELL Global Ship Large Cap,IE00B3CMS880,0.3358294,0.036088300000000004,8.305769459908058,1.1983963848703504e-05
ETFS RUSSELL Global Steel Large Cap,IE00B3CNJ002,0.1267342,0.00796402,14.913345270353412,4.522469060762278e-06
ETFS S-Net ITG Global Agri Business Fund,IE00B3CNHD93,0.00331427,0.1514824,-0.9781210886545235,1.1826865624284997e-07
ETFS WNA Global Nuclear Energy,IE00B3C94706,0.05095601,0.1525254,-0.6659178733509303,1.8183487857649576e-06
iShares € Covered Bond EUR,IE00B3B8Q275,1.017816,0.519082,0.9608000277412816,3.632043575884662e-05
iShares Barclays Euro Aggregate Bond,IE00B3DKXQ41,0.03584157,,,1.27899486811094e-06
iShares Barclays Euro Corporate Bond,IE00B3FH7618,0.0503555,,,1.7969197800531736e-06
iShares Barclays Euro Treasury Bond 0-1,IE00B3F81R35,0.41903640000000003,,,1.4953178813084444e-05
iShares DAX DE,DE0005933931,103.872,39.81112,1.6091202658955588,0.00370663882582207
iShares DJ Asia/Pacific selected dividend,IE00B14X4T88,0.9286305,1.80439,-0.4853493424370563,3.3137879949770504e-05
iShares DJ EURO STOXX (DE),DE000A0D8Q07,2.423741,0.1422289,16.04112877200063,8.649041603451181e-05
iShares DJ EURO STOXX 50,IE0008471009,165.1906,161.5103,0.022786782019474927,0.005894773294254883
iShares DJ EURO STOXX GROWTH,IE00B0M62V02,1.109144,0.2596922,3.2709946621423365,3.9579445989560165e-05
iShares DJ EURO STOXX MID CAP,IE00B02KXL92,2.672788,1.377065,0.9409308928772426,9.537757792274452e-05
iShares DJ EURO STOXX Selected Dividend,IE00B0M62S72,18.792,6.412485,1.9305331708378266,0.0006705864604017285
iShares DJ EURO STOXX SMALL CAP,IE00B02KXM00,6.465537,9.656145,-0.3304225444004828,0.00023072060299203972
iShares DJ EURO STOXX Sustainability 40 (DE),DE000A0F5UG3,0.0354445,0.005210899999999999,5.801991978353068,1.2648255531986517e-06
iShares DJ EURO STOXX VALUE,IE00B0M62T89,0.8249795,1.166856,-0.29298945199750437,2.9439127437685598e-05
iShares DJ STOXX 50,IE0008470928,25.48717,24.13896,0.055852033393319234,0.000909501442952167
iShares DJ STOXX 600 (DE),DE0002635307,0.9852909,0.6942419000000001,0.4192328351256238,3.5159788053269125e-05
iShares DJ STOXX 600 Automobiles & Parts Swap (DE),DE000A0D8Q56,0.26644870000000004,0.0074168,34.92502157264589,9.508135941445405e-06
iShares DJ STOXX 600 Banks Swap (DE),DE000A0D8Q64,0.5679599000000001,0.1053813,4.389570066036385,2.0267465889267758e-05
iShares DJ STOXX 600 Basic Resources Swap (DE),DE000A0D8Q72,0.3460534,0.40736140000000004,-0.15050026831211805,1.2348803991910575e-05
iShares DJ STOXX 600 Chemicals Swap (DE),DE000A0D8Q80,0.03950296,0.042926610000000004,-0.0797558903440082,1.4096503896227682e-06
iShares DJ STOXX 600 Construction & Materials Swap (DE),DE000A0F5T02,0.5533326,0.3849685,0.43734513343299497,1.9745495405432387e-05
iShares DJ STOXX 600 Financial Services Swap (DE),DE000A0F5T10,0.14181470000000002,0.3653531,-0.6118420782525178,5.060611840460462e-06
iShares DJ STOXX 600 Food & Beverage Swap (DE),DE000A0F5T28,0.006833939999999999,0.02227,-0.6931324651998204,2.4386694525318154e-07
iShares DJ STOXX 600 Healthcare Swap (DE),DE000A0F5T36,0.131455,0.02587484,4.080417888574383,4.6909292865107075e-06
iShares DJ STOXX 600 Industrial Goods & Services Swap (DE),DE000A0F5T44,0.04448305,0.1910665,-0.7671855087103181,1.5873632954115108e-06
iShares DJ STOXX 600 Insurance Swap (DE),DE000A0F5T51,0.014195600000000001,0.2188655,-0.9351400746120334,5.065654085397392e-07
iShares DJ STOXX 600 Media Swap (DE),DE000A0F5T69,0.01188936,0,,4.242679778012928e-07
iShares DJ STOXX 600 Oil & Gas Swap (DE),DE000A0F5T77,0.04994758,0.07342519,-0.31974871294170304,1.7823632863895361e-06
iShares DJ STOXX 600 Personal & Household Goods Swap (DE),DE000A0F5T85,0,0.0466758,-1,0
iShares DJ STOXX 600 Retail Swap (DE),DE000A0F5T93,0.00083411,0.1452963,-0.9942592481708068,2.9764946385998603e-08
iShares DJ STOXX 600 Technology Swap (DE),DE000A0F5UA6,0.03053633,0.00326075,8.364817909990032,1.0896790894188546e-06
iShares DJ STOXX 600 Telecommunication Swap (DE),DE000A0F5UB4,0,0.11979,-1,0
iShares DJ STOXX 600 Travel & Leisure Swap (DE),DE000A0F5UC2,0.0002454,1.514e-05,15.208718626155878,8.757019869230746e-09
iShares DJ STOXX 600 Utilities Swap (DE),DE000A0F5UD0,0.1969019,0.00052935,370.9692075186549,7.026380809247291e-06
iShares DJ STOXX EU Enlarged 15 (DE),DE000A0D8Q15,0.8713001,0.1981215,3.3978069013206547,3.1092063112317584e-05
iShares DJ STOXX Large 200 (DE),DE0005933980,0.6993450999999999,2.348759,-0.7022491026112088,2.495590438528591e-05
iShares DJ STOXX Mid 200 (DE),DE0005933998,0.02482336,0.01366025,0.8171966106037589,8.858135971518652e-07
iShares DJ STOXX Select Dividend 30 (DE),DE0002635299,0.4073558,0.4784929,-0.14866908161019732,1.4536360368567179e-05
iShares DJ STOXX Small 200 (DE),DE000A0D8QZ7,0.08425735000000001,0.1252976,-0.3275421875598574,3.0066963654389945e-06
iShares DJ US Select Dividend (DE),DE000A0D8Q49,0.07193698,0.06886053,0.04467653676206096,2.567047934769579e-06
iShares DJ-UBS Commodities,DE000A0H0728,0,0.9169356999999999,-1,0
iShares eb.rexx Jumbo Pfandbriefe (DE),DE0002635265,1.769277,0.4957583,2.568829810817086,6.313607923053369e-05
iShares eb.rexx Money Market ,DE000A0Q4RZ9,6.378281,1.2652,4.041322320581726,0.00022760690076828422
iShares EPRA Asia Property YLD,IE00B1FZS244,0.7866469,0.6655297,0.18198616831074554,2.807124096727291e-05
iShares EPRA Global Property YLD,IE00B1FZS350,0.8784166,0.8234785,0.06671467439647794,3.1346013120057525e-05
iShares EPRA US Property YLD,IE00B1FZSF77,4.762056,10.17806,-0.53212537556273,0.00016993243280517316
iShares EURO Corporate Bond,IE0032523478,144.4231,100.4682,0.43750062208738694,0.005153691753365521
iShares EURO Government Bond 1-3,IE00B14X4Q57,10.79363,13.99669,-0.2288441052848923,0.0003851672060763042
iShares EURO Government Bond 15-30,IE00B1FZS913,6.016135,7.628602,-0.21137123158345394,0.00021468383753453347
iShares EURO Government Bond 3-5,IE00B1FZS681,6.011286,2.217423,1.7109333672465739,0.00021451080253312392
iShares EURO Government Bond 7-10,IE00B1FZS806,8.187539,10.58508,-0.22650192535153257,0.00029216968909169365
iShares EURO Inflation Linked Bond,IE00B0M62X26,11.80147,7.985312,0.4778971692026561,0.0004211316514919746
iShares FTSE 100,IE0005042456,21.92894,18.29231,0.19880649300170394,0.0007825271527757493
iShares FTSE BRIC 50,IE00B1W57M07,20.31569,24.05196,-0.1553416020981243,0.0007249588467283307
iShares FTSE EPRA/NAR UK Proprietary,IE00B1TXLS18,4.134701,2.994737,0.38065579715347275,0.0001475454719247279
iShares FTSE MIB,IE00B1XNH568,29.38347,20.55066,0.42980663394752283,0.0010485396520657927
iShares FTSE UK All Stocks Gilt,IE00B1FZSB30,1.274313,1.097735,0.16085667305861628,4.547344849478011e-05
iShares FTSE UK Dividend Plus,IE00B0M63060,1.859208,0.4669034,2.9819971325974493,6.634523796671864e-05
iShares FTSE/EPRA EUR Proprietary,IE00B0M63284,4.716415,1.694625,1.783161466401121,0.00016830374843739986
iShares FTSE/Macquarie Global Infrastructure 100,IE00B1FZS467,1.041361,0.16607260000000001,5.270516629474097,3.7160631491613683e-05
iShares FTSE/XINHUA CHINA 25,IE00B02KXK85,57.22985,68.27867,-0.16181949648404115,0.0020422287431258973
iShares FTSEurofirst 100,IE0030974079,0.539081,0.9879978,-0.4543702425248315,1.9236931654950202e-05
iShares FTSEurofirst 80,IE0004855221,0.5641566,0.05817895,8.69691959033293,2.0131746355165697e-05
iShares MSCI AC Far East ex-Japan,IE00B0M63730,13.21717,13.03776,0.013760799401123958,0.0004716504494906297
iShares MSCI Brazil,IE00B0M63516,70.8475,37.43758,0.8924166572732533,0.0025281701922792387
iShares MSCI East Europe 10/40,IE00B0M63953,3.326267,3.047263,0.09155888415276259,0.00011869676531934207
iShares MSCI Emerging Markets,IE00B0M63177,43.02033,20.75645,1.0726246540232074,0.0015351666038747496
iShares MSCI EUROPE,IE00B1YZSC51,5.364698,1.346784,2.983339570413667,0.0001914375182494802
iShares MSCI EUROPE ex-UK,IE00B14X4N27,1.855212,2.564793,-0.2766620931981645,6.620264199525392e-05
iShares MSCI Japan,IE00B02KXH56,32.38023,21.88748,0.47939506969281065,0.0011554780663417337
iShares MSCI Korea,IE00B0M63391,5.378435,6.039238,-0.1094182742922204,0.00019192771866489836
iShares MSCI Latin America,IE00B27YCK28,3.738614,3.342959,0.1183547270546843,0.0001334112350504655
iShares MSCI North America,IE00B14X4M10,4.74213,3.597261,0.31826131048039064,0.00016922137992043682
iShares MSCI Taiwan,IE00B0M63623,3.522373,3.544149,-0.006144211205567296,0.0001256947446937323
iShares MSCI Turkey,IE00B1FZS574,0.8376726,2.138554,-0.608299533236009,2.9892076618215886e-05
iShares MSCI WORLD ISLAMIC,IE00B0M62Q58,13.3508,11.74622,0.13660394578000412,0.000476418992950798
iShares S&P 500,IE0031442068,111.542,71.23672,0.5657935963362715,0.003980340302582461
iShares S&P Emerging Markets Infrastructure,IE00B2NPL135,0.443534,0.3512692,0.26266122962104266,1.5827367769679662e-05
iShares S&P Global Clean Energy,IE00B1XNHC34,3.053165,3.482031,-0.12316547440272652,0.00010895120851279498
iShares S&P Global Timber & Forrest,IE00B27YCF74,2.390372,0.6173389,2.872057957144771,8.529965402955516e-05
iShares S&P Global Water 50,IE00B1TXK627,1.056806,0.9159600999999999,0.1537685975622738,3.7711781336276554e-05
iShares S&P Listed Private Equity,IE00B1TXHL60,0.3231214,0.426661,-0.2426741605161944,1.1530482966477813e-05
iShares USD Corporate Bond,IE0032895942,2.472312,1.949061,0.26846312147233986,8.82236565074882e-05
iShares USD TIPS,IE00B1FZSC47,0.2050805,0.48167340000000003,-0.5742332875346656,7.318231513006422e-06
iShares USD Treasury BD 1-3,IE00B14X4S71,19.1762,3.749592,4.114209759355152,0.0006842965135140286
iShares USD Treasury BD 7-10,IE00B1FZS798,4.340425,4.565649,-0.049330117142163066,0.00015488666652773372
JPMORGAN ETF GBI EMU,FR0010476515,1.155258,0.1362056,7.481721750060201,4.1225009209811623e-05
JPMORGAN ETF GBI EMU 1-3Y,FR0010561183,0.6439596,0.44120940000000003,0.45953282047028,2.2979490677187786e-05
JPMORGAN ETF GBI EMU 3-5Y,FR0010561225,0.22817089999999998,0.11740260000000001,0.94349103001126,8.142204991362109e-06
JPMORGAN ETF GBI EMU 5-7Y,FR0010561241,1.2083,1.195552,0.010662856989909208,4.311779587608602e-05
JPMORGAN ETF GBI EMU 7-10Y,FR0010561258,8.031913,0.3554361,21.597347315030746,0.0002866162254642735
JPMORGAN ETF GBI LOCAL US,FR0010561365,0.04909031,0.054759260000000004,-0.1035249563270213,1.7517718828716248e-06
Lyxor ETF Brazil,FR0010408799,31.50867,30.87718,0.020451673371726375,0.0011243767287817225
Lyxor ETF China Enterprise,FR0010204081,76.91198,103.4209,-0.25632072434101816,0.002744579205549624
Lyxor ETF Commodities CRB,FR0010270033,32.19523,16.36911,0.9668283736867798,0.0011488764009961443
Lyxor ETF Commodities CRB Non-Energy,FR0010346205,14.86691,8.231745,0.8060459841746799,0.0005305208894216189
Lyxor ETF DAX,LU0252633754,84.26009,59.68119,0.41183662725223824,0.0030067941414554642
Lyxor ETF DAXplus Covered Call,LU0252635023,0.052903610000000004,0.488447,-0.8916901731405864,1.8878482637491215e-06
Lyxor ETF DAXplus Protective Put ,LU0288030280,0.42693790000000004,0.6014556,-0.2901589078229547,1.5235141292696207e-05
Lyxor ETF DJ EURO STOXX 50,FR0007054358,123.0633,117.7483,0.04513865592963984,0.0043914741779670086
Lyxor ETF DJ EURO STOXX 50 BuyWrite,FR0010389205,0.2559989,0.2127295,0.20340103276696464,9.135238198048959e-06
Lyxor ETF DJ Global Titans 50,FR0007075494,1.552898,0.9996237,0.553482575493158,5.541466438829945e-05
Lyxor ETF DJ STOXX 600 Automobiles & Parts ,FR0010344630,2.20431,0.6741413,2.2698041197001277,7.866009155641412e-05
Lyxor ETF DJ STOXX 600 Banks ,FR0010345371,26.50415,30.58852,-0.13352623794809293,0.000945792046320587
Lyxor ETF DJ STOXX 600 Basic Resources ,FR0010345389,33.72223,34.87169,-0.03296255501238965,0.0012033669036054162
Lyxor ETF DJ STOXX 600 Chemicals ,FR0010345470,0.5777121999999999,1.357674,-0.5744838598956746,2.061547357007745e-05
Lyxor ETF DJ STOXX 600 Construction & Materials ,FR0010345504,2.173996,5.966095,-0.6356082160944471,7.757834624135355e-05
Lyxor ETF DJ STOXX 600 Financial Services ,FR0010345363,0.5818987,0.7120725999999999,-0.18280987079126476,2.0764867472614266e-05
Lyxor ETF DJ STOXX 600 Food & Beverage ,FR0010344861,2.032086,2.9655,-0.31475771370763783,7.251433365112319e-05
Lyxor ETF DJ STOXX 600 Health Care ,FR0010344879,7.834074,5.54118,0.4137916472664669,0.0002795564045437
Lyxor ETF DJ STOXX 600 Industrial Goods & Services ,FR0010344887,2.18483,3.278926,-0.33367511191164423,7.79649540378623e-05
Lyxor ETF DJ STOXX 600 Insurance ,FR0010344903,4.453744,4.192376,0.062343644749421445,0.00015893041850231142
Lyxor ETF DJ STOXX 600 Media ,FR0010344929,3.003226,0.0071733199999999995,417.66611276229145,0.00010716915140093877
Lyxor ETF DJ STOXX 600 Oil & Gas ,FR0010344960,8.481757,4.088739,1.0744187877974114,0.0003026687635492541
Lyxor ETF DJ STOXX 600 Personal & Household Goods ,FR0010344978,0.4720158,2.234678,-0.788776817062682,1.6843731618544604e-05
Lyxor ETF DJ STOXX 600 Retail ,FR0010344986,2.442415,1.999068,0.22177684801117326,8.715679170296338e-05
Lyxor ETF DJ STOXX 600 Technology ,FR0010344796,1.503505,2.392442,-0.3715605226793376,5.3652091110382125e-05
Lyxor ETF DJ STOXX 600 Telecommunications ,FR0010344812,7.617671,5.312186,0.43399929897032985,0.00027183413326920474
Lyxor ETF DJ STOXX 600 Travel & Leisure ,FR0010344838,0.08551456,0.2139812,-0.6003641441397656,3.051559498893744e-06
Lyxor ETF DJ STOXX 600 Utilities ,FR0010344853,3.011684,7.464595,-0.5965375214596371,0.00010747097240360361
Lyxor ETF DJ STOXX Select Dividend 30,FR0010378604,3.897236,1.526416,1.553193886856532,0.00013907160997180665
Lyxor ETF Dow Jones Industrial Average,FR0007056841,16.87164,11.69065,0.44317381839333136,0.0006020590330338558
Lyxor ETF Eastern Europe,FR0010204073,9.319378,5.568784,0.6735032279937596,0.00033255899883810874
Lyxor ETF Euro Cash,FR0010510800,131.0681,149.3103,-0.12217643390978405,0.004677122884769039
Lyxor ETF Euro Corporate Bonds,FR0010737544,17.39875,17.6105,-0.012024076545242846,0.0006208687834139301
Lyxor ETF EuroMTS 10-15Y,FR0010037242,6.287243,13.92819,-0.548595833342308,0.00022435823909405835
Lyxor ETF EuroMTS 1-3Y,FR0010222224,44.64179,50.27878,-0.11211469331594759,0.001593027881124802
Lyxor ETF EuroMTS 15+Y,FR0010481093,1.094315,0.7252758,0.5088260217699252,3.905027790626423e-05
Lyxor ETF EuroMTS 3-5Y,FR0010037234,38.94856,32.65203,0.19283732129365294,0.001389866804392526
Lyxor ETF EuroMTS 5-7Y,FR0010411413,7.742359,8.560416,-0.09556276237042682,0.00027628358434277707
Lyxor ETF EuroMTS 7-10Y,FR0010411439,14.90736,15.39237,-0.031509767501690766,0.0005319643346282626
Lyxor ETF EuroMTS Global,FR0010028860,17.04972,27.82347,-0.3872180572732301,0.0006084137604108428
Lyxor ETF EuroMTS Inflation Linked,FR0010174292,20.41937,16.05089,0.27216434727295513,0.0007286586340960645
Lyxor ETF FTSE 100,FR0010438127,24.94883,9.255408,1.6955948349332632,0.0008902909536432767
Lyxor ETF FTSE MIB,FR0010010827,233.8972,225.4998,0.03723905741823286,0.008346546160380755
Lyxor ETF FTSE RAFI Europe,FR0010400770,2.029381,0.7642561,1.6553677491092316,7.24178065983674e-05
Lyxor ETF FTSE RAFI US 1000,FR0010400804,2.000441,1.49426,0.3387502844217205,7.138509203025192e-05
Lyxor ETF Hong Kong (HSI),FR0010361675,10.74292,30.03682,-0.6423416327027961,0.00038335763607806177
Lyxor ETF Japan (TOPIX),FR0010245514,9.557944,5.874542,0.6270109227238483,0.0003410721496210057
Lyxor ETF LevDAX,LU0252634307,320.6702,226.2072,0.4175950190798525,0.011443012684882629
Lyxor ETF LevDJ EURO STOXX 50,FR0010468983,108.3231,88.9784,0.21740894419319745,0.003865474894036956
Lyxor ETF MSCI AC Asia-Pacific ex-Japan,FR0010312124,20.14966,17.63024,0.14290332973345787,0.0007190341197157457
