,879,Lyxor MSCI Millennials ESG Filtered (DR) UCITS ETF,LU2023678449,GENY,Lyxor,Passive,Full Replication,Accumulating,EUR,3.014228994,1.62907578,88.73925322685936,56.1197142857143
,880,BNP Paribas Easy ECPI Global ESG Blue Economy UCITS ETF - Acc,LU2194447293,BJLE,EasyETF,Passive,Optimised,Accumulating,EUR,3.002157902,3.918894894,172.61923877,31.6665238095238
,881,Invesco Nasdaq Next Generation 100 UCITS ETF Acc,IE00BMD8KP97,EQQJ,Invesco,Passive,Full Replication,Accumulating,EUR,2.995853225,3.781490815,32.188758028546,31.1449047619048
,882,UBS ETF (LU) MSCI Japan UCITS ETF (JPY) A-dis,LU0136240974,UIM5,UBS ETF,Passive,Full Replication,Distributing,EUR,2.993134509,1.090900516,703.68539372,19.1605238095238
,883,Lyxor Euro Government Bond 10-15Y (DR) UCITS ETF - Acc,LU1650489385,LYQ6,Lyxor,Passive,Full Replication,Accumulating,EUR,2.9926961,1.20499082,197.9737659118,7.65233333333333
,884,Tabula EUR IG Bond Paris-Aligned Climate UCITS ETF (EUR) – Acc,IE00BN4GXL63,TABC,Tabula,Passive,Optimised,Accumulating,EUR,2.9912487484,11.6776557152,121.2734376,33.2093333333333
,885,Lyxor MSCI World Materials TR UCITS ETF - Acc (EUR),LU0533033824,LYPH,Lyxor,Passive,Swap-based,Accumulating,EUR,2.98629635,1.6778887,45.72804130399999,26.0425714285714
,886,CSIF (IE) MSCI World ESG Leaders Blue UCITS ETF B (USD) - Acc,IE00BJBYDQ02,CSY5,Credit Suisse,Passive,Full Replication,Accumulating,EUR,2.97893964,4.29966396,655.064539261384,16.8239047619048
,887,SPDR MSCI Japan UCITS ETF,IE00BZ0G8B96,ZPDJ,SPDR,Passive,Optimised,Accumulating,EUR,2.952139806,4.472783289,283.5402250424722,20.7817619047619
,888,BNP Paribas Easy MSCI World SRI S-Series PAB 5% Capped UCITS ETF - USD,LU1291108642,EWRD,EasyETF,Passive,Optimised,Accumulating,USD,2.95053658043218,1.91820311425918,19.05647949982073,22.057
,889,VanEck J.P. Morgan EM Local Currency Bond UCITS ETF - USD A,IE00BDS67326,EM1C,VanEck,Passive,Optimised,Accumulating,EUR,2.935432136,1.774541314,52.8314505916099,56.7934285714286
,890,Invesco MSCI World ESG Universal Screened UCITS ETF,IE00BJQRDK83,ESGW,Invesco,Passive,Full Replication,Accumulating,EUR,2.93273858,4.9005307,176.9164959857274,26.8619523809524
,891,Lyxor Euro Government Bond (DR) UCITS ETF - Acc,LU1650490474,LYQ1,Lyxor,Passive,Full Replication,Accumulating,EUR,2.93160901,6.3693177500000004,720.6929526249002,4.804
,892,Amundi Index J.P. Morgan GBI Global Govies UCITS ETF DR - EUR (D),LU1737653631,10AK,Amundi,Passive,Optimised,Distributing,EUR,2.927510498,3.538036,74.80521148995435,26.6581428571429
,893,iShares Edge S&P 500 Minimum Volatility UCITS ETF EUR Hedged (Acc),IE00BYX8XD24,IS31,iShares,Passive,Optimised,Accumulating,EUR,2.902939411,4.511770692,191.03645409,25.6560952380952
,894,Xtrackers Spain UCITS ETF 1C,LU0592216393,XESP,Xtrackers,Passive,Full Replication,Accumulating,EUR,2.899771155,2.259552345,42.82570763149999,15.3975714285714
,895,Market Access NYSE Arca Gold BUGS Index ETF,LU0259322260,M9SD,Market Access,Passive,Swap-based,Accumulating,EUR,2.89668267,5.18989496,71.9072,67.9488571428572
,896,SPDR MSCI Europe Consumer Staples UCITS ETF,IE00BKWQ0D84,SPYC,SPDR,Passive,Full Replication,Accumulating,EUR,2.88275055,1.93898575,176.34942489,15.4946666666667
,897,Franklin LibertyQ Global Dividend UCITS ETF,IE00BF2B0M76,FLXX,Franklin LibertyShares,Passive,Full Replication,Distributing,EUR,2.88192408,1.150881555,71.02740205270707,61.1841428571429
,898,iShares MSCI Europe Health Care Sector UCITS ETF EUR (Acc),IE00BMW42181,ESIH,iShares,Passive,Full Replication,Accumulating,EUR,2.872688073,2.273049105,294.67229104,18.0319523809524
,899,Amundi Govt Bond EuroMTS Broad Investment Grade UCITS ETF DR - EUR (C),LU1681046261,CB3G,Amundi,Passive,Full Replication,Accumulating,EUR,2.87166088,1.13038415,415.076551279832,6.75928571428571
,900,SPDR Bloomberg Global Aggregate Bond UCITS ETF,IE00B43QJJ40,SYBZ,SPDR,Passive,Optimised,Distributing,EUR,2.866807495,1.807417098,427.5219782269631,17.2795238095238
,901,UBS ETF (LU) MSCI EMU Value UCITS ETF (EUR) A-dis,LU0446734369,UIME,UBS ETF,Passive,Full Replication,Distributing,EUR,2.86470106,1.348827455,295.20409593,23.5675714285714
,902,SPDR MSCI Europe Materials UCITS ETF,IE00BKWQ0L68,SPYP,SPDR,Passive,Full Replication,Accumulating,EUR,2.8021661,3.1228643,49.39608609,15.3903333333333
,903,iShares MSCI Japan ESG Screened UCITS ETF USD (Dist),IE00BFNM3M05,SODJ,iShares,Passive,Optimised,Distributing,EUR,2.798410148,6.560987326,115.2946240229473,15.8925714285714
,904,Lyxor Core EURO STOXX 50 (DR) UCITS ETF Acc,LU0908501215,MSED,Lyxor,Passive,Full Replication,Accumulating,EUR,2.79100895,1.7225785,111.4715004196,17.6170952380952
,905,Invesco MSCI USA ESG Universal Screened UCITS ETF,IE00BJQRDM08,ESGU,Invesco,Passive,Full Replication,Accumulating,EUR,2.78086569,1.38095414,1378.97967496176,18.6589047619048
,906,HSBC Developed World Sustainable Equity UCITS ETF,IE00BKY59K37,H41C,HSBC ETF,Passive,Full Replication,Accumulating,EUR,2.771123792,1.8142651,107.7014221,22.8419523809524
,907,CSIF (IE) MSCI USA ESG Leaders Blue UCITS ETF B (USD) - Acc,IE00BJBYDP94,CSY2,Credit Suisse,Passive,Full Replication,Accumulating,EUR,2.76775066,1.61897038,1930.082466833991,21.1540952380952
,908,Xtrackers MSCI Europe Information Technology ESG Screened UCITS ETF 1C,LU0292104469,DXSH,Xtrackers,Passive,Full Replication,Accumulating,EUR,2.75189382,2.39536506,42.867262176,14.7890952380952
,909,HSBC MSCI Europe UCITS ETF,IE00B5BD5K76,H4ZE,HSBC ETF,Passive,Full Replication,Distributing,EUR,2.736351032,1.506427806,122.9209249,13.5131904761905
,910,Amundi BBB Euro Corporate Investment Grade ESG UCITS ETF DR - EUR (C),LU1681041387,CAB3,Amundi,Passive,Swap-based,Accumulating,EUR,2.7328073475,2.2260237445,68.55306866985526,14.88
,911,Goldman Sachs Access China Government Bond UCITS ETF,IE00BJSBCS90,GASF,Goldman Sachs ETF,Passive,Full Replication,Distributing,EUR,2.73020526,2.56253444,107.7895302975977,28.4857142857143
,912,UBS ETF (IE) MSCI World UCITS ETF (USD) A-dis,IE00B7KQ7B66,UBU7,UBS ETF,Passive,Optimised,Distributing,EUR,2.727353184,1.949083422,187.4818071,36.4937619047619
,913,Xtrackers II iTraxx Crossover Swap UCITS ETF 1C,LU0290359032,DBXM,Xtrackers,Passive,Swap-based,Accumulating,EUR,2.71675751,0.6133247900000001,72.933219812,33.5812857142857
,914,Fidelity US Quality Income UCITS ETF Inc-USD,IE00BYXVGX24,FUSD,Fidelity ETF,Passive,Full Replication,Distributing,EUR,2.71304943,1.400179765,664.2854976066691,21.9259047619048
,915,WisdomTree Eurozone Quality Dividend Growth UCITS - EUR Acc,IE00BZ56TQ67,WTIM,WisdomTree,Passive,Full Replication,Accumulating,EUR,2.70142318,1.02161367,47.06778618,28.3780476190476
,916,iShares USD Treasury Bond 3-7yr UCITS ETF USD (Dist),IE00BFXYHY63,OM3M,iShares,Passive,Optimised,Distributing,EUR,2.6760310725,1.2902243252,82.78232883650054,4.25328571428571
,917,VanEck Morningstar Developed Markets Dividend Leaders UCITS ETF,NL0011683594,VDIV,VanEck,Passive,Full Replication,Distributing,EUR,2.674015615,0.840891555,183.29408831,26.2122380952381
,918,SPDR Bloomberg 7-10 Year U.S. Treasury Bond UCITS ETF,IE00BYSZ5T81,SPP7,SPDR,Passive,Optimised,Distributing,EUR,2.673979095,0.855918722,13.6787843581929,7.61
,919,iShares MSCI Eastern Europe Capped UCITS ETF USD (Dist),IE00B0M63953,IQQR,iShares,Passive,Optimised,Distributing,EUR,2.65041264,2.602098065,134.928150546791,46.299619047619
,920,JPM Global Equity Multi-Factor UCITS ETF - USD (acc),IE00BJRCLL96,JPGL,J.P. Morgan ETF,Passive,Full Replication,Accumulating,EUR,2.65018547,1.24915139,62.82517278594479,31.8767619047619
,921,iShares MSCI Poland UCITS ETF USD (Acc),IE00B4M7GH52,IBCJ,iShares,Passive,Full Replication,Accumulating,EUR,2.635783296,3.771516974,77.99441857296522,42.2699523809524
,922,Amundi ETF MSCI EMU High Dividend UCITS ETF - EUR (C),FR0010717090,18M2,Amundi,Passive,Swap-based,Accumulating,EUR,2.62592084,2.66675896,128.76203353994,16.7993333333333
,923,SPDR MSCI Europe Technology UCITS ETF,IE00BKWQ0K51,SPYK,SPDR,Passive,Full Replication,Accumulating,EUR,2.60805772,2.25680714,76.26837698,13.3814285714286
,924,Xtrackers MSCI Korea UCITS ETF 1C,LU0292100046,DBX8,Xtrackers,Passive,Full Replication,Accumulating,EUR,2.59346272,4.05930634,85.194411860638,40.9175714285714
,925,BNP Paribas Easy MSCI Emerging SRI S-Series PAB 5% Capped UCITS ETF - USD,LU1291098314,ESRI,EasyETF,Passive,Swap-based,Accumulating,USD,2.58726654328641,3.099210700391095,352.7896608103263,24.0560476190476
,926,Invesco MSCI China Technology All Shares Stock Connect UCITS ETF Acc,IE00BM8QS095,ICNT,Invesco,Passive,Full Replication,Accumulating,EUR,2.58304524,2.6464057,25.51565789473689,58.2190476190476
,927,iShares USD TIPS 0-5 UCITS ETF,IE00BDQYWQ65,SXRH,iShares,Passive,Optimised,Distributing,EUR,2.5749027327,4.2204874369,634.0689337576192,14.4765238095238
,928,Lyxor STOXX Europe 600 Retail UCITS ETF - Acc,LU1834988435,LRET,Lyxor,Passive,Swap-based,Accumulating,EUR,2.57172225,2.68811795,8.8096334612,11.3295714285714
,929,Lyxor USD 10Y Inflation Expectations UCITS ETF - Acc,LU1390062831,UINF,Lyxor,Passive,Swap-based,Accumulating,EUR,2.566573591,14.092195433,416.3489690808147,13.4814761904762
,930,iShares European Property Yield UCITS ETF EUR (Acc),IE00BGDQ0L74,IPRE,iShares,Passive,Full Replication,Accumulating,EUR,2.566252643,7.460395484,337.58225618,13.1289047619048
,931,HSBC Asia Pacific ex Japan Sustainable Equity UCITS ETF,IE00BKY58G26,H4Z2,HSBC ETF,Passive,Full Replication,Accumulating,EUR,2.564800382,1.118153002,174.5893879,34.1956666666667
,932,Xtrackers II iTraxx Crossover Short Daily Swap UCITS ETF 1C,LU0321462870,DXST,Xtrackers,Passive,Swap-based,Accumulating,EUR,2.557402951,2.009478091,113.6752642116,38.189
,933,Vanguard USD Emerging Markets Government Bond UCITS ETF,IE00BZ163L38,VGEM,Vanguard,Passive,Optimised,Distributing,EUR,2.554875711,4.412549815999999,402.4652545,42.7243333333333
,934,Lyxor MSCI Greece UCITS ETF - Dist,FR0010405431,LYMH,Lyxor,Passive,Swap-based,Distributing,EUR,2.552061421,1.3807753414,121.195233222,91.2118571428571
,935,Amundi Euro Corporate 0-1Y ESG UCITS ETF DR (C) - Acc,LU2300294316,ECR1,Amundi,Passive,Optimised,Accumulating,EUR,2.541456738,4.513423541,63.6990695199451,4.82985714285714
,936,HSBC FTSE EPRA/NAREIT Development UCITS ETF,IE00B5L01S80,H4ZL,HSBC ETF,Passive,Full Replication,Distributing,EUR,2.53214675,0.833734475,220.2052723,27.6734761904762
,937,Xtrackers MSCI USA Consumer Staples UCITS ETF 1D,IE00BGQYRQ28,XUCS,Xtrackers,Passive,Full Replication,Distributing,EUR,2.5305975,1.42665188,107.78843406344,18.8851428571429
,938,Vanguard EUR Eurozone Government Bond UCITS ETF,IE00BZ163H91,VGEB,Vanguard,Passive,Optimised,Distributing,EUR,2.519208108,2.074378326,567.1743297,7.09357142857143
,939,Xtrackers MSCI Europe Financials ESG Screened UCITS ETF 1C,LU0292103651,DXSF,Xtrackers,Passive,Full Replication,Accumulating,EUR,2.51306968,3.193518015,82.6003261556,16.8661904761905
,940,CSIF (IE) MSCI USA Small Cap ESG Leaders Blue UCITS ETF - B USD,IE00BMDX0L03,CSY8,Credit Suisse,Passive,Full Replication,Accumulating,EUR,2.51109436,2.42007594,623.7002509860165,28.3650476190476
,941,Lyxor MSCI Smart Cities ESG Filtered (DR) UCITS ETF,LU2023679256,IQCY,Lyxor,Passive,Full Replication,Accumulating,EUR,2.506228044,0.723248762,67.95308985943049,47.4366666666667
,942,Invesco Morningstar US Energy Infrastructure MLP UCITS ETF Dist,IE00B8CJW150,SMLD,Invesco,Passive,Swap-based,Distributing,EUR,2.504548695,3.00096031,241.8120233057988,42.835
,943,Xtrackers MSCI Europe Energy ESG Screened UCITS ETF 1C,LU0292101796,DXSD,Xtrackers,Passive,Full Replication,Accumulating,EUR,2.50064323,3.46601986,53.31462497,18.832380952381
,944,HSBC MSCI Japan UCITS ETF,IE00B5VX7566,H4ZC,HSBC ETF,Passive,Full Replication,Distributing,EUR,2.500521646,0.5292062780000001,155.7992604,11.4681428571429
,945,Xtrackers Nifty 50 Swap UCITS ETF 1C,LU0292109690,DBX7,Xtrackers,Passive,Swap-based,Accumulating,EUR,2.49925035,1.89449362,110.371045658104,33.6166666666667
,946,Lyxor Core EURO STOXX 50 (DR) - UCITS ETF,LU0908501488,MTDB,Lyxor,Passive,Full Replication,Distributing,EUR,2.49902271,5.29452899,192.4128330876,15.3586666666667
,947,Amundi ETF STOXX Europe 50 UCITS ETF - EUR (C/D),FR0010790980,AE50,Amundi,Passive,Swap-based,Accumulating,EUR,2.49742989,2.31931576,570.9649069496799,10.2104761904762
,948,UBS ETF (LU) Solactive China Technology UCITS ETF (USD) A-acc,LU2265794276,UIC2,UBS ETF,Passive,Full Replication,Accumulating,EUR,2.484335195,3.669561437,27.6811215937612,142.776571428571
,949,Deka MSCI Germany Climate Change ESG UCITS ETF,DE000ETFL540,D6RT,Deka ETF,Passive,Full Replication,Distributing,EUR,2.481118988,5.730970576000001,341.00086048,12.6259047619048
,950,iShares Fallen Angels High Yield Corp Bond UCITS ETF,IE00BYM31M36,QDVQ,iShares,Passive,Optimised,Distributing,EUR,2.4728193066,2.0603191052,831.4479604786663,30.8995238095238
,951,iShares EM Infrastructure UCITS ETF USD (Dist),IE00B2NPL135,IUS8,iShares,Passive,Full Replication,Distributing,EUR,2.461535966,1.242918322,44.71551841161707,75.9874285714286
,952,Amundi Index MSCI EMU SRI UCITS ETF DR (A),LU2109787635,SRHE,Amundi,Passive,Full Replication,Accumulating,EUR,2.461214,3.86197226,91.14898830990155,14.6770952380952
,953,Deka iBoxx EUR Liquid Non-Financials Diversified UCITS ETF,DE000ETFL383,EFQ8,Deka ETF,Passive,Full Replication,Distributing,EUR,2.45803338,4.46301421,338.27029504,18.9232380952381
,954,Amundi Govt Bond Lowest Rated EuroMTS Investment Grade UCITS ETF DR - EUR (D),LU1681046857,X1GD,Amundi,Passive,Full Replication,Distributing,EUR,2.43975707,4.8171634,234.9919635399461,11.9309523809524
,955,Tabula US Enhanced Inflation UCITS ETF (USD) - EUR Hedged Acc,IE00BKX90X67,TABI,Tabula,Passive,Optimised,Accumulating,EUR,2.42532946,3.8473612,43.45514754,32.1271
,956,UBS ETF (LU) MSCI EMU Small Cap UCITS ETF (EUR) A-dis,LU0671493277,UEFD,UBS ETF,Passive,Full Replication,Distributing,EUR,2.41412584,1.5782218,160.82800316,46.9945714285714
,957,Lyxor STOXX Europe 600 Healthcare UCITS ETF - Acc,LU1834986900,LHTC,Lyxor,Passive,Swap-based,Accumulating,EUR,2.40157994,3.3136408,370.8123073664,9.91280952380952
,958,SPDR MSCI Europe Utilities UCITS ETF,IE00BKWQ0P07,SPYU,SPDR,Passive,Full Replication,Accumulating,EUR,2.39782574,2.29254552,412.28088514,26.3147142857143
,959,Xtrackers US Treasuries Ultrashort Bond UCITS ETF 1C,IE00BM97MR69,XT01,Xtrackers,Passive,Optimised,Accumulating,EUR,2.385250037,2.912832217,12.260176275367,8.29909523809524
,960,iShares USD Floating Rate Bond UCITS ETF USD (Dist),IE00BZ048462,QDVY,iShares,Passive,Optimised,Distributing,EUR,2.3547987396,4.1870682349,601.2542197741127,22.8961428571429
,961,Lyxor Net Zero 2050 S&P Europe Climate PAB (DR) UCITS ETF - Acc,LU2198884491,EABE,Lyxor,Passive,Full Replication,Accumulating,EUR,2.348104125,0.51831094,19.82296885,35.6732857142857
,962,Lyxor EuroMTS Highest Rated Macro-Weighted Govt Bond 3-5Y (DR) UCITS ETF - Acc,LU1829219713,LYS5,Lyxor,Passive,Full Replication,Accumulating,EUR,2.344057025,1.510225805,131.151818793,4.27661904761905
,963,Lyxor ESG USD High Yield (DR) UCITS ETF - Monthly Hedged to EUR - Dist,LU1435356495,LYXE,Lyxor,Passive,Optimised,Distributing,EUR,2.33590687,0.9848714980000001,96.1464137772,43.0343809523809
,964,Lyxor F.A.Z. 100 Index (DR) UCITS ETF,LU0650624025,C006,Lyxor,Passive,Full Replication,Distributing,EUR,2.332176145,2.09739375,89.56179184,20.7624285714286
,965,SPDR Dow Jones Global Real Estate UCITS ETF (Acc),IE00BH4GR342,SPY2,SPDR,Passive,Optimised,Accumulating,EUR,2.328002479,2.330338214,28.75345027787738,45.4902857142857
,966,iShares MSCI Europe Consumer Staples Sector UCITS ETF EUR (Acc),IE00BMW42074,ESIS,iShares,Passive,Full Replication,Accumulating,EUR,2.318350316,3.310762685,274.97827473,24.9250476190476
,967,Lyxor STOXX Europe 600 Healthcare UCITS ETF - Dist,LU2082997516,EHLT,Lyxor,Passive,Swap-based,Distributing,EUR,2.31054964,3.05999308,79.68279833,13.6004285714286
,968,SPDR MSCI Europe Consumer Discretionary UCITS ETF,IE00BKWQ0C77,SPYR,SPDR,Passive,Full Replication,Accumulating,EUR,2.30684028,4.69694042,258.26434097,15.3602857142857
,969,PIMCO Euro Short-Term High Yield Corporate Bond Index UCITS ETF EUR Acc,IE00BD8D5G25,EUHA,PIMCO,Passive,Full Replication,Accumulating,EUR,2.301252084,1.426492713,71.04705542,54.2931428571429
,970,Amundi MSCI UK IMI SRI UCITS ETF (DR) - EUR (D),LU2368674631,CUIK,Amundi,Passive,Full Replication,Distributing,EUR,2.284931714,2.210029132,55.14149676989582,36.9670952380952
,971,Lyxor STOXX Europe 600 Technology UCITS ETF,LU2082998837,CSTA,Lyxor,Passive,Swap-based,Distributing,EUR,2.28196845,1.35669212,25.912578224,14.4409523809524
,972,Amundi ETF Govt Bond EuroMTS Broad Investment Grade 5-7 UCITS ETF DR - EUR (C),FR0010754176,18MZ,Amundi,Passive,Full Replication,Accumulating,EUR,2.26969104,0.51977317,216.5581616699944,5.83052380952381
,973,iShares MSCI UK Small Cap UCITS ETF GBP (Acc),IE00B3VWLG82,SXRD,iShares,Passive,Optimised,Accumulating,EUR,2.26854405,4.82496875,341.2771642273881,27.6070952380952
,974,iShares MSCI USA ESG Enhanced UCITS ETF USD (Dist),IE00BHZPJ890,OM3L,iShares,Passive,Optimised,Distributing,EUR,2.265927419,0.558645172,1159.619662450699,14.4657142857143
,975,UBS ETF (LU) J.P. Morgan USD EM Diversified Bond 1-5 UCITS ETF (hedged to EUR) A-acc,LU1645386480,SEAB,UBS ETF,Passive,Optimised,Accumulating,EUR,2.261703052,1.44791635,323.56563058,66.8856666666667
,976,SPDR Bloomberg UK Gilt UCITS ETF,IE00B3W74078,SYBG,SPDR,Passive,Full Replication,Distributing,EUR,2.259279144,4.804325284,382.0071386360083,9.64304761904762
,977,Lyxor STOXX Europe 600 Oil & Gas UCITS ETF - Dist,LU2082998167,OIGS,Lyxor,Passive,Swap-based,Distributing,EUR,2.25803838,2.16065134,26.4325663914,18.8646666666667
,978,Lyxor Core MSCI EMU (DR) UCITS ETF - Dist,LU1646360971,LMVF,Lyxor,Passive,Full Replication,Distributing,EUR,2.25597754,0.50506768,317.8777731662,10.2775238095238
,979,Amundi MSCI World Energy UCITS ETF - EUR (C),LU1681046006,WDNR,Amundi,Passive,Swap-based,Accumulating,EUR,2.2542763,0.9594020999999999,87.78936212998047,40.2497619047619
,980,Lyxor 1 STOXX Europe 600 ESG (DR) UCITS ETF,DE000ETF9603,E960,Lyxor,Passive,Full Replication,Distributing,EUR,2.252769575,1.65605373,56.37292297,23.6355238095238
,981,Amundi MSCI Europe Momentum Factor UCITS ETF - EUR (C),LU1681041460,MJMT,Amundi,Passive,Swap-based,Accumulating,EUR,2.24274226,1.82706902,431.8364390295889,14.3435714285714
,982,Amundi ETF Short EURO STOXX 50 Daily UCITS ETF - EUR (C/D),FR0010757781,18MS,Amundi,Passive,Swap-based,Accumulating,EUR,2.239060812,6.358022923,109.4896815796723,10.6301428571429
,983,Vanguard Global Aggregate Bond UCITS ETF EUR Hedged Distributing,IE00BG47KB92,VAGE,Vanguard,Passive,Optimised,Distributing,EUR,2.225774899,3.638853153,97.92289989,28.1668095238095
,984,UBS ETF (IE) MSCI AC Asia Ex Japan SF UCITS ETF (USD) A-acc,IE00B7WK2W23,UIQI,UBS ETF,Passive,Swap-based,Accumulating,EUR,2.2144327600000002,0.55038584,174.4578765686626,46.8540476190476
,985,iShares S&P 500 Industrials Sector UCITS ETF,IE00B4LN9N13,2B7C,iShares,Passive,Full Replication,Accumulating,EUR,2.199295272,1.418051388,264.2808468447473,29.3697142857143
,986,Xtrackers USD High Yield Corporate Bond UCITS ETF 1D,IE00BDR5HM97,XUHY,Xtrackers,Passive,Optimised,Distributing,EUR,2.1791900875,1.178958135,565.2406921314799,33.7344761904762
,987,Amundi ETF Short MSCI USA Daily UCITS ETF - EUR (C/D),FR0010791194,GC2U,Amundi,Passive,Swap-based,Accumulating,EUR,2.174959735,2.849788611,37.00469473991915,22.7172857142857
,988,Invesco US Treasury Bond 7-10 Year UCITS ETF - EUR Hdg Dist,IE00BF2FN869,TRDE,Invesco,Passive,Full Replication,Distributing,EUR,2.17349044,1.576033942,377.4740050197204,6.2097619047619
,989,BNP Paribas Easy MSCI Pacific ex Japan ESG Filtered Min TE UCITS ETF - C,LU1291106356,PAC,EasyETF,Passive,Optimised,Accumulating,EUR,2.165235114,3.05202079,71.95369291,54.6596666666667
,990,Deka MSCI USA MC UCITS ETF,DE000ETFL276,EL41,Deka ETF,Passive,Full Replication,Distributing,EUR,2.159895485,5.103913445,35.33363545941124,17.8718095238095
,991,Deka MSCI Japan Climate Change ESG UCITS ETF,DE000ETFL318,EL45,Deka ETF,Passive,Full Replication,Distributing,EUR,2.155007266,3.312349229,138.68965029,26.7873809523809
,992,Lyxor STOXX Europe Select Dividend 30 UCITS ETF - Dist,LU1812092168,SELD,Lyxor,Passive,Swap-based,Distributing,EUR,2.154863132,1.772754276,169.4068091177,13.2425714285714
,993,iShares EUR Govt Bond 10-15yr UCITS ETF EUR (Dist),IE00B4WXJH41,EUN8,iShares,Passive,Optimised,Distributing,EUR,2.14905953,1.690164685,47.94400051,7.57395238095238
,994,BNP Paribas Easy S&P 500 UCITS ETF,FR0011550680,ESEA,EasyETF,Passive,Swap-based,Distributing,USD,2.148709475539585,1.30617118601737,93.45289533883114,16.8648571428571
,995,Lyxor MSCI Europe (DR) UCITS ETF - Acc,FR0010261198,LYY5,Lyxor,Passive,Full Replication,Accumulating,EUR,2.13847012,3.53245152,908.1842351648,7.90057142857143
,996,Lyxor DAX (DR) UCITS ETF - Dist,LU2090062436,LDAX,Lyxor,Passive,Full Replication,Distributing,EUR,2.13657289,2.50139941,57.34327789260001,9.67795238095238
,997,Rize Medical Cannabis And Life Sciences UCITS ETF - USD Acc,IE00BJXRZ273,BLUM,Rize ETF,Passive,Full Replication,Accumulating,EUR,2.1329494675,3.0269887595,34.04760308354249,58.7707142857143
,998,Xtrackers Nikkei 225 UCITS ETF 1C,LU2196470426,XNKY,Xtrackers,Passive,Full Replication,Accumulating,EUR,2.12167505,1.55283728,82.742444593587,21.6833333333333
,999,Lyxor Hong Kong (HSI) UCITS ETF - Dist,LU1900067940,LHKG,Lyxor,Passive,Swap-based,Distributing,EUR,2.12163521,1.745211305,125.2706905692,26.5526666666667
,1000,Amundi Prime USA UCITS ETF DR - USD (C),LU2089238468,PRAU,Amundi,Passive,Full Replication,Accumulating,EUR,2.113126175,0.837221075,1.867568635145798,33.6206190476191
,1001,SPDR S&P Emerging Markets Dividend Aristocrats UCITS ETF (Dist),IE00B6YX5B26,SPYV,SPDR,Passive,Optimised,Distributing,EUR,2.110766062,1.902232588,91.4393283434923,38.1303809523809
,1002,Amundi ETF Govies 0-6 Months EuroMTS Investment Grade UCITS ETF DR - EUR (C),FR0010754200,18M1,Amundi,Passive,Full Replication,Accumulating,EUR,2.098589555,0.33279553,314.9775297499556,5.21561904761905
,1003,Global X Copper Miners UCITS ETF,IE0003Z9E2Y3,4COP,Global X,Passive,Full Replication,Accumulating,EUR,2.09440668,0.533805895,1.879466654714952,116.387952380952
,1004,UC MSCI European Green Bond EUR UCITS ETF,LU1899270539,ECBI,Unicredit ETF,Passive,Optimised,Accumulating,EUR,2.090042065,0.13914306,20.0602,87.2008095238095
,1005,JPM EUR Ultra-Short Income UCITS ETF - EUR (acc),IE00BD9MMF62,JEST,J.P. Morgan ETF,Active,Full Replication,Accumulating,EUR,2.081622848,2.788310338,1160.07680148,5.3162380952381
,1006,Vanguard LifeStrategy 80% Equity UCITS ETF (EUR) - Dist,IE00BMVB5S82,V80D,Vanguard,Active,Full Replication,Distributing,EUR,2.065308955,1.03578285,15.16648879,41.100380952381
,1007,Xtrackers MSCI Europe ESG Screened UCITS ETF 1C,LU0322253732,DX2I,Xtrackers,Passive,Full Replication,Accumulating,EUR,2.05369132,1.10812486,38.555624029031,35.8490476190476
,1008,Invesco JPX-Nikkei 400 UCITS ETF Acc,IE00BPRCH686,SMLN,Invesco,Passive,Swap-based,Accumulating,EUR,2.05109082,1.9291782,63.08196757943522,18.5432857142857
,1009,Xtrackers II Harvest China Government Bond UCITS ETF 1D,LU1094612022,CGB,Xtrackers,Passive,Optimised,Distributing,EUR,2.048031111,1.74487015,274.570639766015,65.6549047619048
,1010,JPM US Research Enhanced Index Equity (ESG) UCITS ETF - USD (dist),IE00BJ06C044,JRUD,J.P. Morgan ETF,Active,Full Replication,Distributing,EUR,2.04227137,0.7174636999999999,87.07006432413053,55.572619047619
,1011,First Trust US Large Cap Core AlphaDEX UCITS ETF,IE00B8X9NW27,FTGU,First Trust,Passive,Full Replication,Accumulating,EUR,2.03610669,0.03421556,93.12845285048404,35.1318571428571
,1012,Amundi Prime Euro Corporates UCITS ETF DR - EUR (C),LU2089238625,PRAC,Amundi,Passive,Full Replication,Accumulating,EUR,2.020393762,0.437840265,38.03016316999633,16.3660952380952
,1013,iShares Refinitiv Inclusion and Diversity UCITS ETF,IE00BD0B9B76,OPEN,iShares,Passive,Full Replication,Accumulating,EUR,2.018506781,2.132488779,47.7835340354966,33.8438571428571
,1014,Ossiam STOXX Europe 600 ESG Equal Weight NR UCITS ETF 1C-EUR,LU0599613147,OSX6,Ossiam,Passive,Swap-based,Accumulating,EUR,2.01173662,0.49809712,301.37657612,26.9950952380952
,1015,Amundi Floating Rate USD Corporate ESG UCITS ETF DR - Hedged EUR (C),LU1681041031,FRNH,Amundi,Passive,Optimised,Accumulating,EUR,1.995227152,1.528044213,815.7349069895376,8.59628571428571
,1016,BNP Paribas Easy Euro Corp Bond SRI Fossil Free UCITS ETF,LU1859444769,ASRI,EasyETF,Passive,Full Replication,Accumulating,EUR,1.9841914645,0.5625978465,577.15460992,17.5387142857143
,1017,HSBC MSCI China A UCITS ETF,IE00BF4NQ904,H41K,HSBC ETF,Passive,Full Replication,Distributing,EUR,1.98069857,1.74004849,53.71394507,51.1436190476191
,1018,Lyxor Net Zero 2050 S&P Eurozone Climate PAB (DR) UCITS ETF - Acc,LU2195226068,ZPAB,Lyxor,Passive,Full Replication,Accumulating,EUR,1.978618605,1.81963649,1363.4120263497,27.4934285714286
,1019,Deka MSCI Japan UCITS ETF,DE000ETFL300,EL44,Deka ETF,Passive,Full Replication,Distributing,EUR,1.971390265,1.262378015,104.2167319130043,10.5260952380952
,1020,Amundi MSCI China UCITS ETF - EUR (C),LU1681043912,18MG,Amundi,Passive,Swap-based,Accumulating,EUR,1.96001625,3.02251445,65.50331173998556,52.3510952380952
,1021,Invesco MSCI Europe UCITS ETF Acc,IE00B60SWY32,SC0E,Invesco,Passive,Swap-based,Accumulating,EUR,1.9535437,4.17751555,63.26287641450001,13.169619047619
,1022,WisdomTree Enhanced Commodity UCITS ETF – EUR Hedged Acc,IE00BG88WG77,WTEH,WisdomTree,Passive,Swap-based,Accumulating,EUR,1.938892656,2.360734684,33.55866689,54.8450952380952
,1023,iShares STOXX Europe 50 UCITS ETF (DE),DE0005933949,EXW3,iShares,Passive,Full Replication,Distributing,EUR,1.92682203,3.110762705,111.63064336,14.2534761904762
,1024,SPDR FTSE UK All Share UCITS ETF,IE00B7452L46,SPYF,SPDR,Passive,Optimised,Accumulating,EUR,1.91347299,3.35277421,689.1214328286412,37.2364285714286
