,1315,SPDR S&P Euro Dividend Aristocrats ESG UCITS ETF (Dist),IE00BYTH5T38,ZPD9,SPDR,Passive,Full Replication,Distributing,EUR,0.925066326,0.262609242,1.92323928,28.8721304347826
,1316,UBS ETF (LU) J.P. Morgan USD EM Diversified Bond 1-5 UCITS ETF (USD) A-dis,LU1645385839,SEAA,UBS ETF,Passive,Optimised,Distributing,EUR,0.9211324736000001,1.3301899239,109.1419525267994,145.953086956522
,1317,Vanguard FTSE Japan UCITS ETF (USD) Accumulating,IE00BFMXYX26,VJPA,Vanguard,Passive,Full Replication,Accumulating,EUR,0.90137874,0.52977628,130.621579,27.3815217391304
,1318,UC MSCI European Green Bond EUR UCITS ETF,LU1899270539,ECBI,Unicredit ETF,Passive,Optimised,Accumulating,EUR,0.897827331,0.744603585,18.791,59.4052173913043
,1319,Ossiam US Steepener UCITS ETF 1C,LU1965301184,USTP,Ossiam,Passive,Swap-based,Accumulating,EUR,0.896539275,0.382577755,59.4548,55.1629565217391
,1320,Tabula EUR IG Bond Paris-Aligned Climate UCITS ETF (EUR) – Acc,IE00BN4GXL63,TABC,Tabula,Passive,Optimised,Accumulating,EUR,0.8891231568,1.080970433,107.7840441,34.6206956521739
,1321,Xtrackers MSCI Africa Top 50 Swap UCITS ETF 1C,LU0592217524,XMKA,Xtrackers,Passive,Swap-based,Accumulating,EUR,0.884469407,1.001905826,35.98498681142301,172.385130434783
,1322,Franklin LibertyQ U.S. Equity UCITS ETF,IE00BF2B0P08,FLXU,Franklin LibertyShares,Passive,Optimised,Accumulating,EUR,0.8764919,0.68782635,89.66137358796503,36.6388695652174
,1323,iShares Smart City Infrastructure UCITS ETF USD (Dist),IE00BKTLJB70,AYEV,iShares,Passive,Optimised,Distributing,EUR,0.8758749849999999,1.574109453,62.42004801369244,34.8629130434783
,1324,CSIF (IE) MSCI USA Tech 125 ESG Universal Blue UCITS ETF - Class B USD Shares,IE000YKE1AQ5,CSYU,Credit Suisse,Passive,Full Replication,Accumulating,EUR,0.875781072,,12.83822448428069,21.0260869565217
,1325,iShares US Mortgage Backed Securities UCITS ETF USD (Dist),IE00BZ6V7883,QDVP,iShares,Passive,Optimised,Distributing,EUR,0.8749073879,0.6528518668,437.3490374290604,63.7835217391304
,1326,Amundi Govt Bond Lowest Rated EuroMTS Investment Grade 1-3 UCITS ETF DR - EUR (C),LU1681046345,X13G,Amundi,Passive,Full Replication,Accumulating,EUR,0.8747588000000001,0.22967983,138.2167768599183,9.55765217391304
,1327,Ossiam Shiller Barclays Cape Europe Sector Value TR UCITS ETF 1C (EUR),LU1079842321,EUPE,Ossiam,Passive,Swap-based,Accumulating,EUR,0.8694415999999999,0.26975745,73.8096,39.6703913043478
,1328,Lyxor SG Global Quality Income NTR UCITS ETF - Dist,LU0832436512,LGQI,Lyxor,Passive,Swap-based,Distributing,EUR,0.86731132,0.71484896,68.0139683185,43.837347826087
,1329,Deka iBoxx EUR Liquid Sovereign Diversified 1-10 UCITS ETF,DE000ETFL110,EL4K,Deka ETF,Passive,Full Replication,Distributing,EUR,0.86692766,0.23135299,54.94061568,20.2615217391304
,1330,Xtrackers II EUR High Yield Corporate Bond 1-3 Swap UCITS ETF 1D,LU1109939865,XHY1,Xtrackers,Passive,Swap-based,Distributing,EUR,0.8520952124,2.7637947934,119.33725625,53.9009565217391
,1331,HSBC MSCI South Africa UCITS ETF,IE00B57S5Q22,H4ZQ,HSBC ETF,Passive,Full Replication,Distributing,EUR,0.8513839,0.26865005,4.945414371,72.2339130434783
,1332,iShares USD Treasury Bond UCITS ETF USD (Dist),IE00BK95B138,SNA2,iShares,Passive,Optimised,Distributing,EUR,0.8471779463,0.5701806074,65.9504119899108,12.5609565217391
,1333,iShares USD Treasury Bond 3-7yr UCITS ETF USD (Acc),IE00B3VWN393,SXRL,iShares,Passive,Optimised,Accumulating,USD,0.845538629652616,1.89025392335237,2769.992681785425,7.03047826086957
,1334,Amundi MSCI Europe High Dividend Factor UCITS ETF - EUR (C),LU1681041973,EHF1,Amundi,Passive,Swap-based,Accumulating,EUR,0.8453236,1.22587872,124.6795374799909,36.4386086956522
,1335,Lyxor MSCI Millennials ESG Filtered (DR) UCITS ETF,LU2023678449,GENY,Lyxor,Passive,Full Replication,Accumulating,EUR,0.839815554,1.20579614,65.258103359453,60.89
,1336,HSBC MSCI Japan UCITS ETF,IE00B5VX7566,H4ZC,HSBC ETF,Passive,Full Replication,Distributing,EUR,0.838428127,0.129121503,160.8774586,22.1377391304348
,1337,The Medical Cannabis and Wellness UCITS ETF - Acc,IE00BG5J1M21,CBSX,HANetf,Passive,Full Replication,Accumulating,EUR,0.8374402249999999,0.614650934,28.78620720655797,72.7615652173913
,1338,UBS ETF (IE) MSCI World Socially Responsible UCITS ETF (hedged to EUR) A-acc,IE00BK72HM96,4UB1,UBS ETF,Passive,Full Replication,Accumulating,EUR,0.836420606,0.84749362,120.9122359208,104.321347826087
,1339,UBS ETF (LU) Solactive China Technology UCITS ETF (hedged to EUR) A-acc,LU2265794946,UIC1,UBS ETF,Passive,Full Replication,Accumulating,EUR,0.833867362,0.335233051,5.710193752,182.178826086957
,1340,Invesco Euro Government Bond UCITS ETF,IE00BGJWWX56,EIBB,Invesco,Passive,Optimised,Distributing,EUR,0.831401485,1.264199225,2.7819925,20.7936956521739
,1341,SPDR Bloomberg EM Inflation Linked Local Bond UCITS ETF,IE00B7MXFZ59,SYBI,SPDR,Passive,Optimised,Distributing,EUR,0.827352211,5.489501427,36.57628884785154,283.347695652174
,1342,Lyxor S&P SmallCap 600 UCITS ETF,LU0392496005,X023,Lyxor,Passive,Swap-based,Distributing,EUR,0.8273325600000001,0.99637641,85.05783696063418,30.5835652173913
,1343,Invesco STOXX Europe 600 Optimised Retail UCITS ETF Acc,IE00B5MTZM66,SC05,Invesco,Passive,Swap-based,Accumulating,EUR,0.82675413,1.57470175,3.50667496,27.252
,1344,CSIF (IE) MSCI World ESG Leaders Blue UCITS ETF BH (EUR) - Acc,IE00BKKFT300,CSY7,Credit Suisse,Passive,Full Replication,Accumulating,EUR,0.82618136,0.96786934,126.303912,19.5645652173913
,1345,iShares USD Corp Bond 0-3yr ESG UCITS ETF USD (Dist),IE00BZ048579,SNAV,iShares,Passive,Optimised,Distributing,EUR,0.8258556745,0.4365510113,170.4024584902261,29.2930869565217
,1346,Fidelity Sustainable Research Enhanced Pacific ex-Japan Equity UCITS ETF,IE00BNGFMY78,FEPX,Fidelity ETF,Active,Full Replication,Accumulating,EUR,0.8252287565,0.7223526204999999,73.11781848482119,62.128347826087
,1347,Lyxor ESG USD High Yield (DR) UCITS ETF - Dist,LU1435356149,LYX8,Lyxor,Passive,Optimised,Distributing,EUR,0.820129614,2.640999442,82.86074545965795,58.6306086956522
,1348,CSIF (IE) DAX 50 ESG Blue UCITS ETF,IE00BKVD2J03,CSYX,Credit Suisse,Passive,Full Replication,Accumulating,EUR,0.819239625,0.470556284,13.64,28.7288260869565
,1349,Invesco Euro Corporate Hybrid Bond UCITS ETF Acc,IE00BKWD3B81,EHBA,Invesco,Passive,Full Replication,Accumulating,EUR,0.818267392,1.75597505,25.148191432,53.161
,1350,UBS ETF (LU) Bloomberg Euro Inflation Linked 10+ UCITS ETF (EUR) A-dis,LU1645381689,FRC4,UBS ETF,Passive,Full Replication,Distributing,EUR,0.813781426,0.963666646,45.89692985,76.0175217391304
,1351,Global X Autonomous & Electric Vehicles UCITS ETF,IE00BMH5YR69,DR7E,Global X,Passive,Full Replication,Accumulating,EUR,0.81316095,0.09472367999999999,3.798289847761462,55.0327826086956
,1352,Invesco S&P 500 Equal Weight UCITS ETF ,IE00BM8QRY62,SP2D,Invesco,Passive,Full Replication,Distributing,EUR,0.80680598,0,10.0785564,30.6673043478261
,1353,Invesco US High Yield Fallen Angels UCITS ETF Dist,IE00BD0Q9673,FAHY,Invesco,Passive,Optimised,Distributing,EUR,0.7994188760000001,0.379137847,195.904883154,107.970086956522
,1354,Invesco US Treasury Bond 7-10 Year UCITS ETF Dist,IE00BF2FN646,TRDX,Invesco,Passive,Full Replication,Distributing,EUR,0.793720384,0.472013768,1009.18598315,12.3926086956522
,1355,Rize Environmental Impact 100 UCITS ETF - USD Acc,IE00BLRPRR04,WRLD,Rize ETF,Passive,Full Replication,Accumulating,EUR,0.7892756135,1.695942837,14.69546527339879,65.7176086956522
,1356,BNP Paribas Easy MSCI Europe Small Caps SRI S-Series PAB 5% Capped UCITS ETF,LU1291101555,EESM,EasyETF,Passive,Swap-based,Accumulating,EUR,0.78613225,0.76404525,74.27109182,40.2827826086956
,1357,Amundi FTSE EPRA Europe Real Estate UCITS ETF - EUR (C),LU1681039480,REAL,Amundi,Passive,Swap-based,Accumulating,EUR,0.7857755,0.4494148,42.28191639999091,43.346347826087
,1358,Global X Data Center REITS & Digital Infrastructure UCITS ETF,IE00BMH5Y327,V9N,Global X,Passive,Full Replication,Accumulating,EUR,0.776357666,1.076288076,2.552543401495361,63.3973043478261
,1359,Vanguard LifeStrategy 40% Equity UCITS ETF (EUR) - Acc,IE00BMVB5M21,V40A,Vanguard,Active,Full Replication,Accumulating,EUR,0.7753525400000001,1.93321408,68.81416012999999,39.1982173913043
,1360,Franklin Liberty Euro Green Bond UCITS ETF,IE00BHZRR253,FLRG,Franklin LibertyShares,Active,Full Replication,Accumulating,EUR,0.773020432,0.984970973,86.42303313,22.7045217391304
,1361,SPDR S&P U.S. Dividend Aristocrats EUR Hdg UCITS ETF (Dist),IE00B979GK47,SPPD,SPDR,Passive,Full Replication,Distributing,EUR,0.771445901,0.59601126,108.8113658826,21.1012173913043
,1362,Lyxor MSCI Europe ESG Leaders (DR) UCITS ETF - Acc,LU1940199711,LEAD,Lyxor,Passive,Full Replication,Accumulating,EUR,0.7684765,0.62001007,1332.0356037216,29.4681304347826
,1363,Lyxor STOXX Europe 600 Utilities UCITS ETF - Dist,LU2082999215,LUTL,Lyxor,Passive,Swap-based,Distributing,EUR,0.7671003000000001,1.0833788,8.969579261999998,21.3218695652174
,1364,Lyxor MSCI Smart Cities ESG Filtered (DR) UCITS ETF,LU2023679256,IQCY,Lyxor,Passive,Full Replication,Accumulating,EUR,0.76152309,1.44807561,72.36858725147937,53.2196086956522
,1365,HSBC MSCI Turkey UCITS ETF,IE00B5BRQB73,H4ZK,HSBC ETF,Passive,Full Replication,Distributing,EUR,0.760212578,0.188765232,10.52642677,87.9982608695652
,1366,Amundi Prime Europe UCITS ETF DR - EUR (C),LU2089238039,PRAE,Amundi,Passive,Full Replication,Accumulating,EUR,0.7574317349999999,0.395433595,3.594606849994788,48.8125217391304
,1367,Deka iBoxx EUR Liquid Sovereign Diversified 1-3 UCITS ETF,DE000ETFL128,EL4L,Deka ETF,Passive,Full Replication,Distributing,EUR,0.755699436,0.725154152,124.93547301,15.6305652173913
,1368,Lyxor MSCI Europe Small Cap UCITS ETF,LU0392496344,X026,Lyxor,Passive,Swap-based,Distributing,EUR,0.75465584,0.6974701,59.83447723628501,35.007
,1369,Xtrackers FTSE Developed Europe ex UK Real Estate UCITS ETF 1C,IE00BP8FKB21,XREA,Xtrackers,Passive,Full Replication,Accumulating,EUR,0.75293254,0.81127662,24.94065,34.3268260869565
,1370,Xtrackers EMU Net Zero Pathway Paris Aligned UCITS ETF,IE000Y6L6LE6,XNZE ,Xtrackers,Passive,Full Replication,Accumulating,EUR,0.75141256,,8.298833,77.0403888888889
,1371,iClima Smart Energy UCITS ETF - Acc,IE00BLCH4S17,DGEN,HANetf,Passive,Optimised,Accumulating,EUR,0.750621261,0.6083474470000001,3.376166831816953,105.37547826087
,1372,Lyxor STOXX Europe 600 Insurance UCITS ETF,LU2082997946,EGV1,Lyxor,Passive,Swap-based,Distributing,EUR,0.74950375,1.24804918,9.748497868200001,22.1946956521739
,1373,Lyxor STOXX Europe 600 Food & Beverage UCITS ETF,LU2082997359,DFOP,Lyxor,Passive,Swap-based,Distributing,EUR,0.7468150600000001,1.50522712,73.450180505,20.143652173913
,1374,UBS ETF (LU) SBI Foreign AAA-BBB 1-5 ESG UCITS ETF (CHF) A-dis,LU0879397742,UEFY,UBS ETF,Passive,Full Replication,Distributing,EUR,0.7445767375000001,0.165985797,190.0968210772378,144.383173913043
,1375,iShares Asia Property Yield UCITS ETF USD (Acc),IE00BGDPWV87,AYEP,iShares,Passive,Full Replication,Accumulating,EUR,0.738378905,0.877554297,239.370283073597,87.7603913043478
,1376,HSBC Developed World Sustainable Equity UCITS ETF,IE00BKY59K37,H41C,HSBC ETF,Passive,Full Replication,Accumulating,EUR,0.736138412,0.47252942,100.394881,26.6184347826087
,1377,Lyxor Euro Government Bond 10-15Y (DR) UCITS ETF - Dist,LU1650489898,NADB,Lyxor,Passive,Full Replication,Distributing,EUR,0.733134385,0.70439119,3.94916736,40.2788695652174
,1378,BNP Paribas Easy MSCI Japan ESG Filtered Min TE UCITS ETF - C,LU1291102447,EJAP,EasyETF,Passive,Optimised,Accumulating,EUR,0.732602772,0.135621854,125.53977575,42.9672608695652
,1379,Global X Renewable Energy Producers UCITS ETF,IE00BLCHJH52,R4RU,Global X,Passive,Full Replication,Accumulating,EUR,0.732539568,0.083847238,1.427240653995135,97.0623043478261
,1380,Lyxor Euro Government Bond 3-5Y (DR) UCITS ETF - Dist,LU1650488817,EGV5,Lyxor,Passive,Full Replication,Distributing,EUR,0.729353815,0.816777,4.661294004999999,22.762
,1381,Lyxor Euro Government Bond 25+Y (DR) UCITS ETF - Dist,LU1686832277,DFOB,Lyxor,Passive,Full Replication,Distributing,EUR,0.72876542,0.73194653,14.9549496,94.3902173913043
,1382,Deka MSCI Europe MC UCITS ETF,DE000ETFL292,EL43,Deka ETF,Passive,Full Replication,Distributing,EUR,0.716772598,1.424102,18.35671927,35.8840434782609
,1383,iShares Emerging Asia Local Govt Bond UCITS ETF USD (Dist),IE00B6QGFW01,IS0S,iShares,Passive,Optimised,Distributing,EUR,0.71558047,0.747134004,215.4965697865057,98.8096521739131
,1384,Fidelity Sustainable Research Enhanced Europe Equity UCITS ETF - Acc,IE00BKSBGT50,FEUR,Fidelity ETF,Active,Full Replication,Accumulating,EUR,0.712007522,1.411768575,279.90694863,32.0102173913044
,1385,Xtrackers II ESG Global Government Bond UCITS ETF - 4D - EUR Hedged,LU2385068593,XZEG,Xtrackers,Passive,Optimised,Distributing,EUR,0.7099772314,0.0282757504,0.6664344383999999,30.4058260869565
,1386,Global X U.S. Infrastructure Developments UCITS ETF,IE00BLCHJ534,94VE,Global X,Passive,Full Replication,Accumulating,EUR,0.70715294,1.36094061,174.5668448067741,87.5024782608696
,1387,JPM EUR Corporate Bond Research Enhanced Index (ESG) UCITS ETF - EUR (acc),IE00BF59RX87,JREB,J.P. Morgan ETF,Active,Full Replication,Accumulating,EUR,0.7065105899999999,0.074832235,177.30824071,22.4946086956522
,1388,Lyxor STOXX Europe 600 Real Estate UCITS ETF - Dist,LU1812091194,LEEU,Lyxor,Passive,Swap-based,Distributing,EUR,0.704253145,1.561814595,33.8044881051,32.0332173913043
,1389,iShares MSCI Eastern Europe Capped UCITS ETF USD (Dist),IE00B0M63953,IQQR,iShares,Passive,Optimised,Distributing,EUR,0.6996283329999999,6.433530295,97.57840983695161,4013.66
,1390,Lyxor MSCI EM Latin America UCITS ETF - Acc,LU1900066629,LLAM,Lyxor,Passive,Swap-based,Accumulating,EUR,0.698025235,0.706070555,42.644237796,87.6381304347826
,1391,Xtrackers USD Corporate Bond UCITS ETF 1C,IE00BFMKQC67,XDCC,Xtrackers,Passive,Optimised,Accumulating,USD,0.695417712142794,0.302399658869531,30.357188360292,34.3372608695652
,1392,Amundi Prime Japan UCITS ETF DR - JPY (C),LU2089238385,PRAJ,Amundi,Passive,Full Replication,Accumulating,EUR,0.6933199499999999,0.700495735,6.215908676241142,26.5752608695652
,1393,Lyxor Euro Government Green Bond (DR) UCITS ETF - Acc,LU2356220926,EAH,Lyxor,Passive,Full Replication,Accumulating,EUR,0.6905525778,1.1096996342,54.1,21.444347826087
,1394,JPM USD Ultra-Short Income UCITS ETF,IE00BDFC6Q91,JPPS,J.P. Morgan ETF,Active,Full Replication,Distributing,EUR,0.690283436,0.465978286,93.82648628051525,9.77073913043478
,1395,Xtrackers MSCI Russia Capped Swap UCITS ETF 1C,LU0322252502,DBXV,Xtrackers,Passive,Swap-based,Distributing,EUR,0.684484981,10.511605914,0,4389.571
,1396,Invesco Euro Corporate Hybrid Bond UCITS ETF Dist,IE00BKWD3966,EHBD,Invesco,Passive,Full Replication,Distributing,EUR,0.6781425969999999,1.978239458,36.559948656,69.2874347826087
,1397,Lyxor Net Zero 2050 S&P Europe Climate PAB (DR) UCITS ETF - Acc,LU2198884491,EABE,Lyxor,Passive,Full Replication,Accumulating,EUR,0.66707447,0.627803405,21.3020469,41.3902173913043
,1398,Franklin LibertyQ Global Equity SRI UCITS ETF,IE00BF2B0N83,FLXG,Franklin LibertyShares,Passive,Optimised,Accumulating,EUR,0.6665112900000001,0.4949608,23.04148338888388,170.347739130435
,1399,Lyxor Euro Government Bond 3-5Y (DR) UCITS ETF - Acc,LU1650488494,LYQ3,Lyxor,Passive,Full Replication,Accumulating,EUR,0.665004135,0.933452765,517.2858322559999,16.5158260869565
,1400,Lyxor MSCI World Utilities TR UCITS ETF - Acc (EUR),LU0533034558,LYPQ,Lyxor,Passive,Swap-based,Accumulating,EUR,0.6619168000000001,0.8569068000000001,29.1791010175,59.3615217391304
,1401,iClima Global Decarbonisation Enablers UCITS ETF - Acc,IE00BNC1F287,ECLM,HANetf,Passive,Optimised,Accumulating,EUR,0.661392552,0.6679902780000001,51.6786134402306,76.3585217391304
,1402,HSBC MSCI EM Latin America UCITS ETF,IE00B4TS3815,H4ZW,HSBC ETF,Passive,Full Replication,Distributing,EUR,0.65832528,0.211084075,23.49441496,101.179826086957
,1403,BNP Paribas Easy CAC 40 ESG UCITS ETF,FR0010150458,XEYX,EasyETF,Passive,Full Replication,Distributing,EUR,0.6563849300000001,0.311162848,190.50956442,43.8080869565217
,1404,JPM BetaBuilders US Equity UCITS ETF,IE00BJK9H860,BBUD,J.P. Morgan ETF,Passive,Full Replication,Distributing,EUR,0.65592407,0.0217181,2.70744677056121,29.4603913043478
,1405,HSBC MSCI Europe Climate Paris Aligned UCITS ETF,IE00BP2C0316,HPAE,HSBC ETF,Passive,Full Replication,Accumulating,EUR,0.644561916,0.00108744,13.57315866,33.8969130434783
,1406,Xtrackers MSCI USA UCITS ETF 1D,IE00BK1PV445,XD9D,Xtrackers,Passive,Full Replication,Distributing,EUR,0.6442987800000001,0.5800007765,323.286581855937,25.603
,1407,Invesco MSCI China All Shares Stock Connect UCITS ETF Acc,IE00BK80XL30,MCHN,Invesco,Passive,Full Replication,Accumulating,EUR,0.63873315,0.08439016,78.975,96.319
,1408,BNP Paribas Easy FTSE EPRA Nareit Developed Europe UCITS ETF QD H EUR ,LU1859445063,ZSRL,EasyETF,Passive,Full Replication,Distributing,EUR,0.635912378,0.140729201,5.67146719,44.0561304347826
,1409,ETC Group Digital Assets & Blockchain Equity UCITS ETF - Acc,IE00BMQ8YK98,KO1N,HANetf,Passive,Full Replication,Accumulating,EUR,0.6351353959999999,0.7099275195000001,3.508676993063687,165.921695652174
,1410,CSIF (IE) FTSE EPRA Nareit Developed Green Blue UCITS ETF - A USD,IE00BMDX0K95,CSYZ,Credit Suisse,Passive,Full Replication,Accumulating,EUR,0.62777276,0.90552128,311.1611566525538,61.1201739130435
,1411,iShares EUR Govt Bond 10-15yr UCITS ETF EUR (Dist),IE00B4WXJH41,EUN8,iShares,Passive,Optimised,Distributing,EUR,0.62698204,0.90000845,57.61015369,16.355347826087
,1412,Lyxor STOXX Europe 600 Technology UCITS ETF,LU2082998837,CSTA,Lyxor,Passive,Swap-based,Distributing,EUR,0.62685325,0.8068405,24.189621318,18.7963043478261
,1413,WisdomTree Europe Equity UCITS ETF - USD Hedged,IE00BVXBH163,WTDH,WisdomTree,Passive,Full Replication,Distributing,EUR,0.625409526,0.054035162,41.20450016214755,29.7251739130435
,1414,SPDR S&P U.S. Dividend Aristocrats ESG UCITS ETF (Dist),IE00BYTH5R14,ZPD6,SPDR,Passive,Full Replication,Distributing,EUR,0.621930422,3.636491804,27.95001513377173,28.8153043478261
,1415,Amundi Index MSCI Emerging Markets SRI UCITS ETF (DR) (D),LU2059756754,ACUG,Amundi,Passive,Full Replication,Distributing,EUR,0.6107959150000001,0.41709892,83.96697453820897,66.7908695652174
,1416,Deka Euro Corporates 0-3 Liquid UCITS ETF,DE000ETFL532,ELFF,Deka ETF,Passive,Full Replication,Distributing,EUR,0.6091599799999999,0.8569166,107.08247284,23.1039565217391
,1417,Lyxor MSCI World Communication Services TR UCITS ETF - Acc (EUR),LU0533034129,LYPI,Lyxor,Passive,Swap-based,Accumulating,EUR,0.6083351,1.13359448,21.6819780536,38.3413043478261
,1418,Lyxor Euro Government Bond 1-3Y (DR) UCITS ETF - Dist,LU1650487926,EGV3,Lyxor,Passive,Full Replication,Distributing,EUR,0.6043402950000001,0.576131625,22.9769757432,12.295
,1419,UBS ETF (LU) J.P. Morgan Global Government ESG Liquid Bond UCITS ETF (USD) A-acc,LU1974693662,UIQG,UBS ETF,Passive,Optimised,Distributing,EUR,0.6036668588,0.2565187166,86.69242506080532,34.3717391304348
,1420,Tabula iTraxx IG Bond UCITS ETF (EUR) - Acc,IE00BKP52691,TABA,Tabula,Passive,Optimised,Accumulating,EUR,0.60138916,0.339871324,0.4547164,54.3701739130435
,1421,Lyxor Euro Government Bond 7-10Y (DR) UCITS ETF - Dist,LU2090062949,MTDD,Lyxor,Passive,Full Replication,Distributing,EUR,0.59840764,0.77287732,9.248875728,31.5479565217391
,1422,Amundi Smart Factory UCITS ETF - EUR (C),LU2037749822,540S,Amundi,Passive,Swap-based,Accumulating,EUR,0.59782772,0.64515746,34.43425954997307,104.428434782609
,1423,Invesco US Treasury Bond UCITS ETF,IE00BF2GFK56,TRFE,Invesco,Passive,Full Replication,Distributing,EUR,0.5952384300000001,0.198407804,0.57726,9.897
,1424,UBS ETF (IE) MSCI ACWI Socially Responsible UCITS ETF (USD) A-acc ,IE00BDR55471,AW1P,UBS ETF,Passive,Full Replication,Accumulating,EUR,0.59258923,0.050371216,491.9241924331141,67.036
,1425,UBS ETF (LU) Bloomberg MSCI Global Liquid Corporates Sustainable UCITS ETF (USD) A-acc,LU2099991536,4UBP,UBS ETF,Passive,Optimised,Accumulating,EUR,0.5814710645,0.003098179,34.46656070624267,66.7661739130435
,1426,Lyxor Pan Africa UCITS ETF - Acc,LU1287022708,LGQM,Lyxor,Passive,Swap-based,Accumulating,EUR,0.574954606,0.973625721,41.6245901946,129.909869565217
,1427,BNP Paribas Easy ESG Momentum Europe UCITS ETF - C,LU1377382012,MOEU,EasyETF,Passive,Swap-based,Accumulating,EUR,0.5738374399999999,0.0146535,2.61760074,34.2914782608696
,1428,iShares TecDAX UCITS ETF (DE) EUR (Dist),DE000A2QP323,EXIB,iShares,Passive,Full Replication,Distributing,EUR,0.5677257950000001,0.2041367315,2.54057221,27.9877826086957
,1429,CSIF (IE) MSCI USA Blue UCITS ETF B (USD) - Acc,IE00BJBYDR19,CSY1,Credit Suisse,Passive,Optimised,Accumulating,EUR,0.5671499,0.642032105,2956.409332492568,17.2523913043478
,1430,Invesco S&P 500 Equal Weight UCITS ETF Acc,IE00BNGJJT35,SP2Q,Invesco,Passive,Full Replication,Accumulating,EUR,0.56101134,0.58753099,10.8843806,29.2276086956522
,1431,Amundi Prime US Corporates UCITS ETF DR - USD (D),LU2037749152,PR1P,Amundi,Passive,Optimised,Distributing,EUR,0.56019476,0.3147623565,82.30369322750593,52.1742608695652
,1432,WisdomTree Emerging Markets Equity Income UCITS ETF,IE00BQQ3Q067,WTEI,WisdomTree,Passive,Optimised,Distributing,EUR,0.55551082,1.314691246,43.12932562832177,77.4295217391304
,1433,HSBC Japan Sustainable Equity UCITS ETF,IE00BKY55S33,XU8Z,HSBC ETF,Passive,Full Replication,Accumulating,EUR,0.55538095,0.205104926,153.1191172,47.8150869565217
,1434,iShares Edge MSCI USA Multifactor UCITS ETF,IE00BZ0PKS76,IBCY,iShares,Passive,Optimised,Accumulating,EUR,0.554279656,0.406233356,52.15965084226646,30.6693913043478
,1435,Global X Cleantech UCITS ETF,IE00BMH5YL08,CT3C,Global X,Passive,Full Replication,Accumulating,EUR,0.552344684,0.454811316,1.829345635528331,81.6360434782609
,1436,Invesco FTSE RAFI All World 3000 UCITS ETF Dist,IE00B23LNQ02,PSWD,Invesco,Passive,Optimised,Distributing,EUR,0.551559885,1.105812475,38.70585168,52.2085652173913
,1437,Tabula iTraxx IG Bond UCITS ETF (EUR) - Dist,IE00BL6XZW69,TABX,Tabula,Passive,Optimised,Distributing,EUR,0.549931536,0.286430842,38.29872721,56.6530869565217
,1438,VanEck New China ESG UCITS ETF ,IE0000H445G8,CNIE,VanEck,Passive,Full Replication,Accumulating,EUR,0.54970908,0.17268022,6.971443248356003,140.200692307692
,1439,Amundi Prime US Corporates UCITS ETF DR - USD (C),LU2089239276,PRAP,Amundi,Passive,Optimised,Accumulating,EUR,0.5491780625,0.531670454,4.633601339122727,81.3200434782609
,1440,Lyxor MSCI Europe Mid Cap UCITS ETF,LU0392496260,X025,Lyxor,Passive,Swap-based,Distributing,EUR,0.54711886,0.7353789000000001,21.91099595531934,34.2673913043478
,1441,UBS ETF (IE) MSCI USA UCITS ETF (USD) A-dis,IE00B77D4428,UBU3,UBS ETF,Passive,Full Replication,Distributing,EUR,0.5414746629999999,0.333527348,924.299704341951,22.3458695652174
,1442,Invesco STOXX Europe 600 Optimised Personal & Household Goods UCITS ETF Acc,IE00B5MTZ595,SC04,Invesco,Passive,Swap-based,Accumulating,EUR,0.537361,0.2308134,5.080967100000001,28.083
,1443,Xtrackers MSCI Pakistan Swap UCITS ETF 1C,LU0659579147,XBAK,Xtrackers,Passive,Swap-based,Accumulating,EUR,0.5255350074999999,0.2585946196,8.266344744923,205.93852173913
,1444,SPDR MSCI Japan UCITS ETF,IE00BZ0G8B96,ZPDJ,SPDR,Passive,Optimised,Accumulating,EUR,0.524753816,0.729608009,231.1227426611675,30.3961304347826
,1445,Invesco Russell 2000 UCITS ETF Acc,IE00B60SX402,SC0K,Invesco,Passive,Swap-based,Accumulating,EUR,0.52226323,1.12307818,45.0743847,152.980304347826
,1446,Amundi Index Equity Global Multi Smart Allocation Scientific Beta UCITS ETF DR - EUR (C),LU1602145119,SM8T,Amundi,Passive,Full Replication,Accumulating,EUR,0.5188201,0.4149195,44.98397990999926,48.6754347826087
,1447,Lyxor Global Gender Equality (DR) UCITS ETF - Acc,LU1691909508,VOOM,Lyxor,Passive,Full Replication,Accumulating,EUR,0.517459576,0.403389546,54.58606501321287,39.0915652173913
,1448,WisdomTree Enhanced Commodity ex-Agriculture UCITS ETF – EUR Hedged Acc,IE00BDVPNV63,EXAG,WisdomTree,Passive,Swap-based,Accumulating,EUR,0.516024594,4.399864559999999,92.33622293487072,301.4481875
,1449,UBS ETF (IE) Factor MSCI USA Low Volatility UCITS ETF (USD) A-dis,IE00BX7RQY03,UBUR,UBS ETF,Passive,Full Replication,Distributing,EUR,0.515952245,0.94061807,72.93820563012339,62.453347826087
,1450,JPM USD Ultra-Short Income UCITS ETF,IE00BG8BCY43,JPPA,J.P. Morgan ETF,Active,Full Replication,Accumulating,EUR,0.5126330179999999,1.225780234,99.55613626700297,22.7516086956522
,1451,Lyxor ESG USD High Yield (DR) UCITS ETF - Monthly Hedged to EUR - Dist,LU1435356495,LYXE,Lyxor,Passive,Optimised,Distributing,EUR,0.509289974,1.467575782,67.9148419948,78.2038260869565
,1452,Ossiam Global Multi-Asset Risk-Control UCITS ETF 1C (EUR),LU1446552496,OSXM,Ossiam,Passive,Swap-based,Accumulating,EUR,0.50643415,0.009321649999999999,91.6816,73.0325217391304
,1453,L&G Global Equity UCITS ETF,IE00BFXR5S54,ETLQ,L&G ETF,Passive,Optimised,Accumulating,EUR,0.503584972,1.210596704,55.84299089271236,21.4048695652174
,1454,WisdomTree New Economy Real Estate UCITS ETF - USD Acc,IE000MO2MB07,WTRE,WisdomTree,Passive,Full Replication,Accumulating,EUR,0.50350042,0.0008642000000000001,0.348640644986938,69.3523043478261
,1455,L&G US Equity (Responsible Exclusions) UCITS ETF - Acc,IE00BKLWY790,DELG,L&G ETF,Passive,Full Replication,Accumulating,EUR,0.500986148,0.651152496,1251.336370155842,21.6280434782609
,1456,Lyxor MSCI Indonesia UCITS ETF - Acc,LU1900065811,LYXI,Lyxor,Passive,Swap-based,Accumulating,EUR,0.49765138,0.22997436,38.3640065793,114.051173913043
,1457,Xtrackers World Net Zero Pathway Paris Aligned UCITS ETF,IE000UZCJS58,XNZW,Xtrackers,Passive,Full Replication,Accumulating,EUR,0.49508937,,18.23904681825,76.5785789473684
,1458,Lyxor Core UK Equity All Cap (DR) UCITS ETF - Dist,LU1781541096,LCUK,Lyxor,Passive,Full Replication,Accumulating,EUR,0.48864607,0.358855706,367.7846055983298,42.1466956521739
