,1315,Amundi Prime Emerging Markets UCITS ETF DR (C),LU2300295123,PRAM,Amundi,Passive,Full Replication,Accumulating,EUR,0.6641857879999999,0.181756614,5.858557466517253,32.2383333333333
,1316,Vanguard ESG Global Corporate Bond UCITS ETF EUR Hedged - Dist,IE00BNDS1Q47,V3GE,Vanguard,Passive,Optimised,Distributing,EUR,0.6627281753,0.1298811976,12.3741428,57.728619047619
,1317,Amundi Prime Europe UCITS ETF DR - EUR (D),LU1931974262,PR1E,Amundi,Passive,Full Replication,Distributing,EUR,0.66253383,0.51907051,13.2782762199673,34.7474285714286
,1318,Amundi Index MSCI Pacific ex Japan SRI - UCITS ETF DR - EUR (D),LU2402389261,APXJ,Amundi,Passive,Full Replication,Distributing,EUR,0.66235851,,0.5913555199948,48.7523
,1319,Franklin LibertyQ Global Equity SRI UCITS ETF,IE00BF2B0N83,FLXG,Franklin LibertyShares,Passive,Optimised,Accumulating,EUR,0.657763255,0.51552438,19.96931777518824,73.9621904761905
,1320,Lyxor STOXX Europe 600 Financial Services UCITS ETF - Dist,LU2082997193,6FIN,Lyxor,Passive,Swap-based,Distributing,EUR,0.6576151800000001,1.53014616,8.3176037452,20.569380952381
,1321,BNP Paribas Easy Bloomberg Barclays Euro Aggregate Treasury UCITS ETF,LU1481202692,JBEM,EasyETF,Passive,Optimised,Accumulating,EUR,0.6568526570000001,1.351313277,281.697,6.66766666666667
,1322,Vanguard LifeStrategy 20% Equity UCITS ETF (EUR) - Acc,IE00BMVB5K07,V20A,Vanguard,Active,Full Replication,Accumulating,EUR,0.6560139399999999,0.826627925,34.7855336,36.228380952381
,1323,UBS ETF (LU) MSCI Pacific (ex Japan) UCITS ETF (USD) A-dis,LU0446734526,UIMD,UBS ETF,Passive,Full Replication,Distributing,EUR,0.65349055,0.988206085,97.366901,32.9858095238095
,1324,Deka Deutsche Boerse EUROGOV Germany 3-5 UCITS ETF,DE000ETFL193,EL4T,Deka ETF,Passive,Full Replication,Distributing,EUR,0.65014301,1.43723294,63.78957728,5.20014285714286
,1325,VanEck Global Fallen Angel High Yield Bond UCITS ETF,IE00BF540Z61,GFEA,VanEck,Passive,Optimised,Accumulating,EUR,0.648674554,0.590850742,46.06716945141628,81.4342380952381
,1326,Amundi Govt Bond Lowest Rated EuroMTS Investment Grade 1-3 UCITS ETF DR - EUR (C),LU1681046345,X13G,Amundi,Passive,Full Replication,Accumulating,EUR,0.64760156,0.15446347,152.2892780798702,5.19485714285714
,1327,SPDR Bloomberg 10+ Year Euro Government Bond UCITS ETF,IE00BYSZ6062,SYBV,SPDR,Passive,Optimised,Distributing,EUR,0.638817389,0.791884634,10.61664043,16.5230952380952
,1328,Xtrackers iBoxx USD Corporate Bond Yield Plus UCITS ETF 1D,IE00BF8J5974,XYLD,Xtrackers,Passive,Optimised,Distributing,EUR,0.6384157874999999,1.397312109,28.570562836358,43.8311428571429
,1329,Deka DAX ex Financials 30 UCITS ETF,DE000ETFL433,ELF0,Deka ETF,Passive,Full Replication,Distributing,EUR,0.63776255,0.9781725849999999,32.33949133,12.399619047619
,1330,BNP Paribas Easy FTSE EPRA/NAREIT Developed Europe UCITS ETF - D,LU1291091228,EEP,EasyETF,Passive,Full Replication,Distributing,EUR,0.6347057859999999,1.295921524,124.26281989,22.572619047619
,1331,Xtrackers II USD Emerging Markets Bond UCITS ETF 2C,LU1920015440,XUEB,Xtrackers,Passive,Optimised,Accumulating,EUR,0.633770221,0.119504823,7.783794474154,71.6608571428571
,1332,Lyxor iBoxx USD Liquid Emerging Markets Sovereign UCITS ETF - Dist,LU1686830909,LYQS,Lyxor,Passive,Swap-based,Distributing,EUR,0.620446038,0.856588366,289.8866149427439,35.1786666666667
,1333,Lyxor MSCI World Utilities TR UCITS ETF - Acc (EUR),LU0533034558,LYPQ,Lyxor,Passive,Swap-based,Accumulating,EUR,0.6168126500000001,0.4801183,25.4100024325,55.8573333333333
,1334,UBS ETF (IE) Bloomberg Commodity CMCI SF UCITS ETF (hedged to EUR) A-acc,IE00BYYLVJ24,BCFE,UBS ETF,Passive,Swap-based,Accumulating,EUR,0.61459955,0.392399774,13.42899212,44.3143333333333
,1335,L&G Pharma Breakthrough UCITS ETF,IE00BF0H7608,ETLI,L&G ETF,Passive,Full Replication,Accumulating,EUR,0.608899622,0.114348398,28.16011571351739,41.8966666666667
,1336,Invesco STOXX Europe 600 Optimised Personal & Household Goods UCITS ETF Acc,IE00B5MTZ595,SC04,Invesco,Passive,Swap-based,Accumulating,EUR,0.6059042,0.3983783,5.4929223459,22.4633333333333
,1337,Invesco Euro Government Bond UCITS ETF,IE00BGJWWX56,EIBB,Invesco,Passive,Optimised,Distributing,EUR,0.6046504309999999,0.011947684,5.220690574999999,11.0272380952381
,1338,Invesco US High Yield Fallen Angels UCITS ETF Dist,IE00BD0Q9673,FAHY,Invesco,Passive,Optimised,Distributing,EUR,0.6044073419999999,1.067817786,206.8252696685552,85.2259047619048
,1339,JPM BetaBuilders US Equity UCITS ETF      ,IE00BJK9H753,BBUS,J.P. Morgan ETF,Passive,Full Replication,Accumulating,EUR,0.604144525,0.91605378,15.33632335066332,24.2752380952381
,1340,BNP Paribas Easy MSCI EMU SRI S-Series PAB 5% Capped UCITS ETF,LU1953137681,EMUS,EasyETF,Passive,Full Replication,Accumulating,EUR,0.601049238,1.099990946,141.05203934,19.9464761904762
,1341,Amundi iCPR Euro Corporate Climate Paris Aligned PAB UCITS ETF DR (C),LU2300295396,PABC,Amundi,Passive,Optimised,Accumulating,EUR,0.596355247,1.005006908,28.31450311995652,9.06390476190476
,1342,UBS ETF (LU) Bloomberg USD Emerging Markets Sovereign UCITS ETF (USD) A-dis,LU1324516050,UEFS,UBS ETF,Passive,Optimised,Distributing,EUR,0.5919513948,0.8376203987,77.27867387,58.0541904761905
,1343,Invesco S&P 500 QVM UCITS ETF Dist,IE00BDZCKK11,QVMP,Invesco,Passive,Full Replication,Distributing,EUR,0.5805284350000001,0.37244566,6.091048189232838,28.2325238095238
,1344,UBS ETF (LU) Solactive China Technology UCITS ETF (hedged to EUR) A-acc,LU2265794946,UIC1,UBS ETF,Passive,Full Replication,Accumulating,EUR,0.578096648,0.495292625,3.62816333,158.360285714286
,1345,Deka MSCI Europe LC UCITS ETF,DE000ETFL086,EL4H,Deka ETF,Passive,Full Replication,Distributing,EUR,0.5777713000000001,1.11178912,37.96865347,26.4052857142857
,1346,Rize Education Tech & Digital Learning UCITS ETF - USD Acc,IE00BLRPQJ54,LERN,Rize ETF,Passive,Full Replication,Accumulating,EUR,0.5741371990999999,0.456705363,10.84394048045895,121.5161
,1347,Xtrackers II Eurozone Government Bond 3-5 UCITS ETF 1D,LU0614173895,X03C,Xtrackers,Passive,Optimised,Distributing,EUR,0.56937573,0.11902775,18.9794952945,4.77757142857143
,1348,HSBC MSCI Turkey UCITS ETF,IE00B5BRQB73,H4ZK,HSBC ETF,Passive,Full Replication,Distributing,EUR,0.568883087,1.6103019922,10.2235356,117.631238095238
,1349,PIMCO Covered Bond UCITS ETF,IE00BF8HV717,COVR,PIMCO,Active,Full Replication,Distributing,EUR,0.5682863,3.05612082,28.17022384,18.3557142857143
,1350,Invesco S&P 500 Equal Weight UCITS ETF Acc,IE00BNGJJT35,SP2Q,Invesco,Passive,Full Replication,Accumulating,EUR,0.56678085,0.36939407,3.564450714540595,27.5599047619048
,1351,SPDR Bloomberg SASB US High Yield Corporate ESG UCITS ETF (Dist),IE00B99FL386,SYBK,SPDR,Passive,Optimised,Distributing,EUR,0.564903657,1.019237681,142.9187456167085,45.3851428571429
,1352,Lyxor STOXX Europe 600 Personal & Household Goods UCITS ETF,LU2082998324,MTDA,Lyxor,Passive,Swap-based,Distributing,EUR,0.5646296700000001,0.0476686,10.930007328,20.499619047619
,1353,Lyxor STOXX Europe 600 Insurance UCITS ETF,LU2082997946,EGV1,Lyxor,Passive,Swap-based,Distributing,EUR,0.55876384,0.72454239,10.0834839534,18.4102857142857
,1354,iShares MDAX UCITS ETF (DE) EUR (Dist),DE000A2QP349,EXID,iShares,Passive,Full Replication,Distributing,EUR,0.5558155685,0.580838292,1.40863768,18.8009047619048
,1355,Xtrackers S&P 500 Swap UCITS ETF 5C - EUR Hedged,LU2196472984,XS5E,Xtrackers,Passive,Swap-based,Accumulating,EUR,0.5555297426,1.1850239906,1.06361899,24.569619047619
,1356,JPM USD Emerging Markets Sovereign Bond UCITS ETF - USD (acc),IE00BJ06C937,JMBA,J.P. Morgan ETF,Passive,Optimised,Accumulating,EUR,0.5551303639999999,0.026339754,72.53785067228398,68.9682857142857
,1357,Xtrackers MSCI Japan ESG Screened UCITS ETF 3C EUR Hedged,IE00BRB36B93,XDNE,Xtrackers,Passive,Full Replication,Accumulating,EUR,0.553709128,0.133610476,6.986437457999999,35.1781904761905
,1358,VanEck New China ESG UCITS ETF ,IE0000H445G8,CNIE,VanEck,Passive,Full Replication,Accumulating,EUR,0.5514948639999999,0.425244494,7.586558605234851,107.6675
,1359,Invesco Nasdaq-100 ESG UCITS ETF Acc,IE000COQKPO9,N1ES,Invesco,Passive,Full Replication,Accumulating,EUR,0.544983745,0.453544065,11.11520606601251,39.9997142857143
,1360,L&G Digital Payments UCITS ETF,IE00BF92J153,DPGA,L&G ETF,Passive,Full Replication,Accumulating,EUR,0.542158546,0.6685060820000001,14.33307867515239,52.1355714285714
,1361,BNP Paribas Easy MSCI Europe ESG Filtered Min TE UCITS ETF,LU1291099718,EEUX,EasyETF,Passive,Optimised,Accumulating,EUR,0.5407544320000001,0.806823476,65.11733578,15.357619047619
,1362,SPDR S&P Euro Dividend Aristocrats ESG UCITS ETF (Dist),IE00BYTH5T38,ZPD9,SPDR,Passive,Full Replication,Distributing,EUR,0.5387776729999999,0.13987201,2.02167547,25.440619047619
,1363,iShares USD Corp Bond Interest Rate Hedged UCITS ETF USD (Dist),IE00BCLWRB83,IS3F,iShares,Passive,Optimised,Distributing,EUR,0.5367576559999999,0.31941078,290.804103818573,37.92
,1364,"Xtrackers MSCI EM Europe, Middle East & Africa ESG Swap UCITS ETF 1C",LU0292109005,DBX4,Xtrackers,Passive,Swap-based,Accumulating,EUR,0.53461823,0.9681844549999999,43.41435780733899,82.4685714285714
,1365,WisdomTree Japan Equity UCITS ETF - EUR Hedged Acc,IE00BYQCZJ13,WTIF,WisdomTree,Passive,Optimised,Accumulating,EUR,0.533842778,0.354972428,5.675327559999999,33.736380952381
,1366,Amundi Prime US Corporates UCITS ETF DR - USD (C),LU2089239276,PRAP,Amundi,Passive,Optimised,Accumulating,EUR,0.5307288625000001,1.6750030955,6.30630677073085,87.3829523809524
,1367,Lyxor 1 SDAX (DR) UCITS ETF,DE000ETF9058,E905,Lyxor,Passive,Full Replication,Distributing,EUR,0.52900714,1.29762138,19.30248224,36.8565238095238
,1368,Lyxor Pan Africa UCITS ETF - Acc,LU1287022708,LGQM,Lyxor,Passive,Swap-based,Accumulating,EUR,0.52711488,0.426312571,40.4777317158,103.074857142857
,1369,Invesco JPX-Nikkei 400 UCITS ETF EUR Hdg Acc,IE00BVGC6645,NS4E,Invesco,Passive,Swap-based,Accumulating,EUR,0.52552175,1.26925303,7.863625567200001,20.1207142857143
,1370,SPDR Bloomberg EM Inflation Linked Local Bond UCITS ETF,IE00B7MXFZ59,SYBI,SPDR,Passive,Optimised,Distributing,EUR,0.52209624,1.560614331,37.36840830942991,88.2177142857143
,1371,Fidelity Sustainable Research Enhanced Pacific ex-Japan Equity UCITS ETF,IE00BNGFMY78,FEPX,Fidelity ETF,Active,Full Replication,Accumulating,EUR,0.518060882,0.487810822,76.83650166726427,43.0478095238095
,1372,Tabula European iTraxx Crossover Credit Short UCITS ETF (EUR) - Acc,IE00BH05CB83,TAB1,Tabula,Passive,Full Replication,Accumulating,EUR,0.517929644,0.06886644,10.28667561,49.4480952380952
,1373,Lyxor Nasdaq-100 UCITS ETF - Daily Hedged to EUR - Acc,LU1954152853,BUNH,Lyxor,Passive,Swap-based,Accumulating,EUR,0.5151833339999999,0.20063737,4.697165,21.4899047619048
,1374,Xtrackers MSCI USA UCITS ETF 1D,IE00BK1PV445,XD9D,Xtrackers,Passive,Full Replication,Distributing,EUR,0.5144191445,0.523175994,291.826288911544,21.941619047619
,1375,SPDR Bloomberg 10+ Year U.S. Corporate Bond UCITS ETF,IE00BZ0G8860,SYBN,SPDR,Passive,Optimised,Distributing,EUR,0.513098855,1.208834234,62.13054387773396,48.5958571428571
,1376,Xtrackers FTSE 250 UCITS ETF 1D,LU0292097317,DBXY,Xtrackers,Passive,Full Replication,Distributing,EUR,0.5130066400000001,0.8698484350000001,60.558443374078,22.7715238095238
,1377,Invesco FTSE RAFI Emerging Markets UCITS ETF Dist,IE00B23D9570,6PSK,Invesco,Passive,Full Replication,Distributing,EUR,0.511045148,0.127366908,29.97340667659238,47.318380952381
,1378,Xtrackers ESG USD Emerging Markets Bond Quality Weighted UCITS ETF 2D EUR Hedged,IE00BD4DXB77,XQUE,Xtrackers,Passive,Optimised,Distributing,EUR,0.5068577425,0.3705082455,56.9833095286,68.4471904761905
,1379,Amundi JPX-Nikkei 400 UCITS ETF - EUR (C),LU1681038912,JP40,Amundi,Passive,Swap-based,Accumulating,EUR,0.50487692,2.43324546,55.48312643999164,33.6065238095238
,1380,Global X Cybersecurity UCITS ETF,IE00BMH5Y871,BUG,Global X,Passive,Full Replication,Accumulating,EUR,0.504509548,0.18959563,1.898984403011832,48.1790476190476
,1381,First Trust Germany AlphaDEX UCITS ETF,IE00BWTNM966,FTGG,First Trust,Passive,Full Replication,Accumulating,EUR,0.504146395,0.592303205,16.19462,27.9933333333333
,1382,HSBC MSCI South Africa UCITS ETF,IE00B57S5Q22,H4ZQ,HSBC ETF,Passive,Full Replication,Distributing,EUR,0.50341937,0.32829863,5.448575129,64.1812857142857
,1383,Invesco Euro Corporate Hybrid Bond UCITS ETF Dist,IE00BKWD3966,EHBD,Invesco,Passive,Full Replication,Distributing,EUR,0.498007957,0.145731004,52.14060748428,44.6068095238095
,1384,Amundi MSCI Emerging ESG Universal Select UCITS ETF DR (C),LU2109787049,SBIM,Amundi,Passive,Full Replication,Accumulating,EUR,0.49658065,0.790641755,7.956214067791566,24.9982380952381
,1385,UBS ETF (IE) CMCI Commodity Carry SF UCITS ETF (USD) A-acc,IE00BKFB6L02,UEQC,UBS ETF,Passive,Swap-based,Accumulating,EUR,0.49190506,1.16984378,40.86886852814629,42.919
,1386,BNP Paribas Easy EUR High Yield SRI Fossil Free UCITS ETF - Acc,LU2244386053,ASRF,EasyETF,Passive,Full Replication,Accumulating,EUR,0.4840296363,0.1382770165,100.12006979,77.5234285714286
,1387,Digital Infrastructure and Connectivity UCITS ETF - Acc,IE00BL643144,DIGI,HANetf,Passive,Full Replication,Accumulating,EUR,0.482557349,0.453657435,27.42562564539261,56.5427142857143
,1388,Xtrackers MSCI EM Asia Swap UCITS ETF 1D,LU2296661775,XMA1,Xtrackers,Passive,Swap-based,Distributing,EUR,0.47550681,1.973542436,290.3702564416409,36.8066666666667
,1389,Ossiam ESG Low Carbon Shiller Barclays CAPE US Sector UCITS ETF - 1A (USD),IE00BF92LR56,5HED,Ossiam,Active,Full Replication,Accumulating,USD,0.4743684049440115,0.2971747206269465,230.552086387619,41.9546666666667
,1390,Invesco MSCI China All Shares Stock Connect UCITS ETF Acc,IE00BK80XL30,MCHN,Invesco,Passive,Full Replication,Accumulating,EUR,0.47125748,0.153792195,69.66522569134712,69.2798095238095
,1391,Lyxor MSCI Indonesia UCITS ETF - Acc,LU1900065811,LYXI,Lyxor,Passive,Swap-based,Accumulating,EUR,0.47008926,0.194854,35.9816625479,105.598666666667
,1392,iShares MSCI USA ESG Enhanced UCITS ETF EUR Hedged (Acc),IE000U7L59A3,CBUC,iShares,Passive,Full Replication,Accumulating,EUR,0.469579942,0.123141436,1.9110231,33.4543333333333
,1393,JPM Global High Yield Corporate Bond Multi-Factor UCITS ETF - USD (acc),IE00BKKCKJ46,JGHY,J.P. Morgan ETF,Passive,Optimised,Accumulating,EUR,0.46902636,0.098256292,71.86096505019721,44.0129047619048
,1394,PIMCO Euro Short Maturity UCITS ETF EUR ACC,IE00BVZ6SP04,PJSR,PIMCO,Active,Full Replication,Accumulating,EUR,0.46848976,3.104074728,1221.79407397,4.48661904761905
,1395,Xtrackers MSCI USA Industrials UCITS ETF 1D,IE00BCHWNV48,XUIN,Xtrackers,Passive,Full Replication,Distributing,EUR,0.4657495,0.48928559,17.33626326393,38.9468571428571
,1396,L&G US Equity UCITS ETF,IE00BFXR5Q31,ETLS,L&G ETF,Passive,Optimised,Accumulating,EUR,0.464230218,0.365424694,268.1839302886339,20.8792857142857
,1397,HAN-GINS Indxx Healthcare Megatrend Equal Weight UCITS ETF - Acc,IE00BJQTJ848,W311,HANetf,Passive,Optimised,Accumulating,EUR,0.452874702,1.041750386,13.86177714234493,65.1991428571429
,1398,Xtrackers II USD Emerging Markets Bond UCITS ETF 1D - EUR Hedged,LU2361257269,XUEE,Xtrackers,Passive,Optimised,Distributing,EUR,0.4522401165,2.543665632,1.126479277,48.3490952380952
,1399,UBS ETF (IE) MSCI USA Socially Responsible UCITS ETF (USD) A-acc,IE00BJXT3C94,4UBI,UBS ETF,Passive,Full Replication,Accumulating,EUR,0.45179514,0.5280297820000001,430.4862731,26.1355714285714
,1400,UBS ETF (IE) MSCI ACWI Climate Paris Aligned UCITS ETF (USD) A-acc,IE00BN4Q0P93,AW14,UBS ETF,Passive,Full Replication,Accumulating,EUR,0.444835084,0.428257282,16.56893514,178.846666666667
,1401,Amundi ETF MSCI UK UCITS ETF - EUR (C/D),FR0010655761,540K,Amundi,Passive,Swap-based,Accumulating,EUR,0.4439462,0.9603353,38.28411047998544,15.8601904761905
,1402,iShares MSCI EMU ESG Enhanced UCITS ETF EUR (Dist),IE00BHZPHZ28,EMNE,iShares,Passive,Optimised,Distributing,EUR,0.440901919,0.87272588,368.31051747,24.2377619047619
,1403,Franklin Liberty Euro Green Bond UCITS ETF,IE00BHZRR253,FLRG,Franklin LibertyShares,Active,Full Replication,Accumulating,EUR,0.438787073,0.6834075799999999,107.3842996,24.7503333333333
,1404,L&G Global Equity UCITS ETF,IE00BFXR5S54,ETLQ,L&G ETF,Passive,Optimised,Accumulating,EUR,0.433795842,0.6881324059999999,55.52941479921119,19.8958571428571
,1405,Fidelity US Quality Income UCITS ETF - Acc-EUR Hedged,IE00BYV1Y969,FUSU,Fidelity ETF,Passive,Full Replication,Accumulating,EUR,0.431196398,0.05952352399999999,3.66677662,25.9330952380952
,1406,BNP Paribas Easy STOXX Europe 600 UCITS ETF,FR0011550672,ETSA,EasyETF,Passive,Swap-based,Distributing,EUR,0.4256266500000001,0.5831252539999999,81.55889456,12.5105714285714
,1407,BNP Paribas Easy ESG Dividend Europe UCITS ETF,LU1615090864,EDEU,EasyETF,Passive,Swap-based,Accumulating,EUR,0.42545054,0.0946568,13.27929569,35.5524761904762
,1408,Amundi ETF MSCI Spain UCITS ETF - EUR (C/D),FR0010655746,AMES,Amundi,Passive,Swap-based,Accumulating,EUR,0.42124866,0.40334374,51.95501986997881,33.4683333333333
,1409,FlexShares Developed Markets High Dividend Climate ESG UCITS ETF - Dist,IE00BMYDBM76,QVFE,FlexShares,Passive,Full Replication,Distributing,EUR,0.420347345,0.17682802,14.45858730727859,36.3652380952381
,1410,VanEck Smart Home Active UCITS ETF,IE000FN81QD2,VCAV,VanEck,Active,Full Replication,Accumulating,EUR,0.419633986,0.216983864,14.14904057009681,209.9
,1411,UBS ETF (IE) MSCI USA UCITS ETF (USD) A-dis,IE00B77D4428,UBU3,UBS ETF,Passive,Full Replication,Distributing,EUR,0.414883823,0.464340795,1027.899118,19.8355238095238
,1412,UBS ETF (IE) S&P 500 UCITS ETF (hedged to EUR) A-acc,IE00BD34DK07,UEQD,UBS ETF,Passive,Full Replication,Accumulating,EUR,0.413384138,0.531773589,25.93386181,40.0489047619048
,1413,UBS ETF (LU) Bloomberg MSCI Euro Area Liquid Corporates Sustainable UCITS ETF (EUR) A-acc,LU1484799843,4UBF,UBS ETF,Passive,Optimised,Accumulating,EUR,0.409147125,0.1324064365,417.92555231,26.1119047619048
,1414,HSBC MSCI Korea Capped UCITS ETF,IE00B3Z0X395,H4Z9,HSBC ETF,Passive,Full Replication,Distributing,EUR,0.4087885,3.72805877,61.35468969,51.1874761904762
,1415,UBS ETF (LU) J.P. Morgan USD EM IG ESG Diversified Bond UCITS ETF (USD) A-acc,LU1974695790,EMIG,UBS ETF,Passive,Optimised,Accumulating,EUR,0.4065383835,0.5806658125,176.7583982,91.9000952380952
,1416,VanEck Morningstar North America Equal Weight UCITS ETF,NL0011376074,VMUS,VanEck,Passive,Full Replication,Distributing,EUR,0.406450945,0.28049081,,27.2021818181818
,1417,HSBC Japan Sustainable Equity UCITS ETF,IE00BKY55S33,XU8Z,HSBC ETF,Passive,Full Replication,Accumulating,EUR,0.404065118,0.397128212,139.6234182,24.904
,1418,JPM BetaBuilders EUR Govt Bond 1-3 yr UCITS ETF - EUR (acc),IE00BYVZV757,JE13,J.P. Morgan ETF,Passive,Optimised,Accumulating,EUR,0.401900804,0.280871366,90.01681476,5.857
,1419,Xtrackers II ESG EUR Corporate Bond UCITS ETF 1C,LU0484968903,XB4D,Xtrackers,Passive,Optimised,Accumulating,EUR,0.399501028,0.050583924,1.499467842,23.3542380952381
,1420,Amundi Euro Corporate Financials ESG UCITS ETF DR - EUR (C),LU1681040066,AFIN,Amundi,Passive,Optimised,Accumulating,EUR,0.398272565,1.583057555,74.23824321995302,13.1108571428571
,1421,Xtrackers II Eurozone Government Bond 15-30 UCITS ETF 1C,LU0290357507,DBXF,Xtrackers,Passive,Optimised,Accumulating,EUR,0.39198765,0.21582202,25.075075898,15.0611428571429
,1422,UBS ETF (LU) Bloomberg US 1-3 Year Treasury Bond UCITS ETF (USD) A-dis,LU0721552544,UEFF,UBS ETF,Passive,Full Replication,Distributing,EUR,0.391927035,0.21020907,22.38031638,8.59914285714286
,1423,WisdomTree Europe Equity UCITS ETF - USD Hedged,IE00BVXBH163,WTDH,WisdomTree,Passive,Full Replication,Distributing,EUR,0.388135723,0.183721822,41.56292373610614,27.488
,1424,Franklin Liberty Euro Short Maturity UCITS ETF,IE00BFWXDY69,FVSH,Franklin LibertyShares,Active,Full Replication,Distributing,EUR,0.385941187,0.296256964,219.982883,11.1995238095238
,1425,Amundi Prime Global Govies UCITS ETF DR - EUR (D),LU1931975236,PR1G,Amundi,Passive,Full Replication,Distributing,EUR,0.385674074,0.14970025,20.5138276799898,52.9570476190476
,1426,Lyxor Euro Government Bond 25+Y (DR) UCITS ETF - Dist,LU1686832277,DFOB,Lyxor,Passive,Full Replication,Distributing,EUR,0.38332463,0.36958939,16.4714592,30.2104761904762
,1427,Fidelity Emerging Markets Quality Income UCITS ETF - Acc USD,IE00BYSX4846,FYEM,Fidelity ETF,Passive,Full Replication,Accumulating,EUR,0.382552172,0.396361989,11.57356890462531,54.0499523809524
,1428,Xtrackers ESG USD Corporate Bond UCITS ETF 2C - EUR hedged,IE00BL58LL31,XZBE,Xtrackers,Passive,Optimised,Accumulating,EUR,0.38027411,0.319475721,27.853709442,36.6564285714286
,1429,VanEck iBoxx EUR Sovereign Capped AAA-AA 1-5 UCITS ETF,NL0010273801,VIGB,VanEck,Passive,Full Replication,Distributing,EUR,0.378932872,0.014600505,75.78818822,6.22519047619048
,1430,Lyxor S&P MidCap 400 UCITS ETF,LU0392495965,X022,Lyxor,Passive,Swap-based,Distributing,EUR,0.37565405,0.24553755,18.48731828724353,32.1699523809524
,1431,SPDR Bloomberg  1-5 Year Gilt UCITS ETF,IE00B6YX5K17,SYB5,SPDR,Passive,Full Replication,Distributing,EUR,0.375173248,1.752709142,616.1659884429906,10.5312380952381
,1432,Rize Digital Payments Economy UCITS ETF - USD Acc,IE00BLRPRQ96,PMNT,Rize ETF,Passive,Full Replication,Accumulating,EUR,0.375077469,2.430229048,4.523310326281822,73.157
,1433,Lyxor MSCI World Industrials TR UCITS ETF - Acc (EUR),LU0533033402,LYPF,Lyxor,Passive,Swap-based,Accumulating,EUR,0.36653815,0.2527363,44.858061108,39.2218095238095
,1434,UBS ETF (LU) Bloomberg US Liquid Corporates 1-5 UCITS ETF (USD) A-dis,LU1048314949,UEF7,UBS ETF,Passive,Optimised,Distributing,EUR,0.3643366225,0.173603442,316.15066095,38.4967619047619
,1435,Invesco US High Yield Fallen Angels UCITS ETF EUR Hdg Acc,IE00BYVTMZ20,FAEU,Invesco,Passive,Optimised,Accumulating,EUR,0.362920201,0.832060574,21.76346231514,45.5852857142857
,1436,Lyxor MSCI World Communication Services TR UCITS ETF - Acc (EUR),LU0533034129,LYPI,Lyxor,Passive,Swap-based,Accumulating,EUR,0.36266856,0.66522362,23.8137038061,41.6203333333333
,1437,Amundi JPX-Nikkei 400 UCITS ETF - Daily Hedged EUR (C),LU1681039134,JP4H,Amundi,Passive,Swap-based,Accumulating,EUR,0.36021278,0.35909944,115.0312076099417,35.5837142857143
,1438,JPM US Equity Multi-Factor UCITS ETF - USD (acc),IE00BJRCLK89,JUMF,J.P. Morgan ETF,Passive,Full Replication,Accumulating,EUR,0.360172085,0.40975144,14.15660399784869,29.507380952381
,1439,Lyxor FTSE 100 UCITS ETF,LU1650492256,D100,Lyxor,Passive,Swap-based,Distributing,EUR,0.35985746,0.3533146599999999,53.71571652658658,18.943380952381
,1440,Amundi Index J.P. Morgan EMU Govies IG UCITS ETF DR - EUR (D),LU1737653714,10AL,Amundi,Passive,Optimised,Distributing,EUR,0.359620528,0.201947914,2.450516769998177,8.1577619047619
,1441,UBS ETF (LU) MSCI Europe Socially Responsible UCITS ETF (EUR) A-acc,LU2206597804,UIW1,UBS ETF,Passive,Full Replication,Accumulating,EUR,0.358754638,0.07343835400000001,2.41881839,68.2864761904762
,1442,HSBC MSCI World Climate Paris Aligned UCITS ETF,IE00BP2C1V62,HPAW,HSBC ETF,Passive,Full Replication,Accumulating,EUR,0.357169095,0.32032679,160.4184961,58.1449047619048
,1443,iShares USD Floating Rate Bond UCITS ETF EUR Hedged (Dist),IE00BF11F458,SXRR,iShares,Passive,Optimised,Distributing,EUR,0.355571871,1.1639261418,58.57920344,33.1289523809524
,1444,WisdomTree Enhanced Commodity ex-Agriculture UCITS ETF – USD Acc,IE00BDVPNS35,WAXG,WisdomTree,Passive,Swap-based,Accumulating,EUR,0.354971298,0.04039704,0.7340241305127286,148.083538461538
,1445,L&G US Equity (Responsible Exclusions) UCITS ETF - Acc,IE00BKLWY790,DELG,L&G ETF,Passive,Full Replication,Accumulating,EUR,0.352687854,0.502233464,1399.666182045536,23.0540476190476
,1446,SPDR ICE BofA 0-5 Year EM USD Government Bond UCITS ETF,IE00BP46NG52,ZPR5,SPDR,Passive,Optimised,Distributing,EUR,0.350089316,0.3993414870000001,111.9081050645393,34.1084761904762
,1447,Invesco FTSE RAFI Europe UCITS ETF Dist,IE00B23D8X81,6PSC,Invesco,Passive,Full Replication,Distributing,EUR,0.346142892,0.066054064,7.57022381459,21.7251904761905
,1448,Xtrackers II ESG Global Government Bond UCITS ETF - 4D - EUR Hedged,LU2385068593,XZEG,Xtrackers,Passive,Optimised,Distributing,EUR,0.3453360486,0.0214360208,0.0968419496,27.4203333333333
,1449,Deka MSCI Japan LC UCITS ETF,DE000ETFL102,EL4J,Deka ETF,Passive,Full Replication,Distributing,EUR,0.34099924,0.20127835,7.02597509167378,19.4827142857143
,1450,Lyxor 1 EURO STOXX 50 (DR) UCITS ETF,DE000ETF9504,E950,Lyxor,Passive,Full Replication,Distributing,EUR,0.340641925,0.505577905,34.64330465,16.7827142857143
,1451,UBS ETF (LU) Bloomberg US 7-10 Year Treasury Bond UCITS ETF (USD) A-dis,LU0721552973,UEFI,UBS ETF,Passive,Full Replication,Distributing,EUR,0.339702957,0.079795869,30.31506091,19.9123333333333
,1452,SPDR Bloomberg Global Aggregate Bond UCITS ETF,IE00BF1QPH33,SPFU,SPDR,Passive,Optimised,Distributing,USD,0.3391292178529815,0.1407413059669725,868.329400170312,17.9431428571429
,1453,HSBC MSCI Malaysia UCITS ETF,IE00B3X3R831,H4ZV,HSBC ETF,Passive,Full Replication,Distributing,EUR,0.337398,0.215972565,4.467511053,77.3460476190476
,1454,Invesco Quantitative Strategies ESG Global Equity Multi-factor UCITS ETF EUR Hdg Acc,IE00BJQRDP39,IQSE,Invesco,Active,Full Replication,Accumulating,EUR,0.33639579,0.43590124,145.9996904382,29.245380952381
,1455,Deka iBoxx EUR Liquid Sovereign Diversified 1-10 UCITS ETF,DE000ETFL110,EL4K,Deka ETF,Passive,Full Replication,Distributing,EUR,0.334868635,1.505915155,69.08507103,12.1994761904762
,1456,JPM BetaBuilders US Equity UCITS ETF,IE00BJK9H860,BBUD,J.P. Morgan ETF,Passive,Full Replication,Distributing,EUR,0.33156744,0.154608185,2.327513400860524,23.7880476190476
,1457,Invesco EURO STOXX High Dividend Low Volatility UCITS ETF Dist,IE00BZ4BMM98,EHDV,Invesco,Passive,Full Replication,Distributing,EUR,0.32954304,0.50484019,16.83650790228,26.5578571428571
,1458,JPM USD Ultra-Short Income UCITS ETF,IE00BG8BCY43,JPPA,J.P. Morgan ETF,Active,Full Replication,Accumulating,EUR,0.3255876,0.863999544,146.3872003585515,16.0560952380952
