,442,Vanguard FTSE 250 UCITS ETF,IE00BKX55Q28,VMID,Vanguard,Passive,Full Replication,Distributing,EUR,10.652804195,11.6522307,2830.944267,8.98785714285714
,443,Xtrackers EURO STOXX Quality Dividend UCITS ETF 1D,LU0292095535,DXSA,Xtrackers,Passive,Full Replication,Distributing,EUR,10.61897528,12.366671395,214.3763797497,9.49990476190476
,444,Vanguard ESG Global All Cap UCITS ETF (USD) - Acc,IE00BNG8L278,V3AA,Vanguard,Passive,Optimised,Accumulating,EUR,10.581063389,8.9023737885,108.4499576,28.9671428571429
,445,iShares MSCI EMU ESG Screened UCITS ETF EUR (Acc),IE00BFNM3B99,SLMA,iShares,Passive,Optimised,Accumulating,EUR,10.50036046,16.994738953,1047.47245013,10.3387142857143
,446,Invesco Nasdaq Biotech UCITS ETF A,IE00BQ70R696,NBTK,Invesco,Passive,Swap-based,Accumulating,EUR,10.39521586,7.169574425,546.5354945000009,22.7226666666667
,447,Lyxor EUR 2-10Y Inflation Expectations UCITS ETF - Acc,LU1390062245,EUIN,Lyxor,Passive,Swap-based,Accumulating,EUR,10.37754589,4.672949032,2216.0494394074,10.958
,448,Xtrackers MSCI Japan ESG Screened UCITS ETF 1D,IE00BPVLQD13,XDNY,Xtrackers,Passive,Full Replication,Distributing,EUR,10.282270438,1.63686556,146.68619768789,23.2945714285714
,449,UBS ETF (LU) Bloomberg Euro Area Liquid Corporates 1-5 Year UCITS ETF (EUR) A-dis,LU1048314196,UEF6,UBS ETF,Passive,Optimised,Distributing,EUR,10.2014751735,5.1139661,524.6002421000001,13.2939047619048
,450,SPDR MSCI Europe Small Cap Value Weighted UCITS ETF,IE00BSPLC298,ZPRX,SPDR,Passive,Optimised,Accumulating,EUR,10.195404465,4.42010171,115.10835167,26.0557619047619
,451,Xtrackers EUR Corporate Green Bond UCITS ETF 1C,IE000MCVFK47,XGBE,Xtrackers,Passive,Optimised,Accumulating,EUR,10.160201337,4.406879644999999,157.6038202938,21.8940952380952
,452,Xtrackers Bloomberg Commodity ex-Agriculture & Livestock Swap UCITS ETF 1C EUR Hedged,LU0292106167,DXSM,Xtrackers,Passive,Swap-based,Accumulating,EUR,10.158156205,12.854954585,241.80726691,79.4708095238095
,453,iShares STOXX Europe Mid 200 UCITS ETF (DE),DE0005933998,EXSD,iShares,Passive,Full Replication,Distributing,EUR,10.13962069,8.719993619999999,465.97990323,20.1450476190476
,454,Vanguard FTSE All-World High Dividend Yield UCITS ETF - USD Acc,IE00BK5BR626,VGWE,Vanguard,Passive,Optimised,Accumulating,EUR,10.11029819,3.8285933,95.34343339,27.625
,455,HSBC MSCI China UCITS ETF,IE00B44T3H88,H4ZP,HSBC ETF,Passive,Full Replication,Distributing,EUR,10.057442029,12.935103699,572.1470637000001,22.874
,456,Lyxor ShortDAX Daily (-1x) Inverse UCITS ETF,LU0603940916,C004,Lyxor,Passive,Swap-based,Distributing,EUR,10.049598342,9.237052386,75.08551145,13.8481904761905
,457,iShares Core FTSE 100 UCITS ETF GBP (Acc),IE00B53HP851,SXRW,iShares,Passive,Full Replication,Accumulating,EUR,10.0490753,4.9671197,1935.153326362248,8.8322380952381
,458,Vanguard FTSE Developed Europe UCITS ETF - (EUR) Accumulating,IE00BK5BQX27,VWCG,Vanguard,Passive,Full Replication,Accumulating,EUR,10.03157592,7.091829434999999,378.3257139,10.9635238095238
,459,iShares USD TIPS UCITS ETF USD (Acc),IE00B1FZSC47,IUST,iShares,Passive,Optimised,Accumulating,EUR,9.992414349999999,9.663370089999999,3331.106817515239,15.0458571428571
,460,iShares EUR High Yield Corp Bond ESG UCITS ETF EUR (Acc),IE00BJK55C48,AYE2,iShares,Passive,Optimised,Accumulating,EUR,9.9053171836,4.9654720234,1101.1797413,20.6755714285714
,461,iShares EURO STOXX Mid UCITS ETF EUR (Dist),IE00B02KXL92,IQQM,iShares,Passive,Optimised,Distributing,EUR,9.8298806,5.68834613,567.84572228,16.9569523809524
,462,iShares MSCI Europe Quality Dividend UCITS ETF,IE00BYYHSM20,QDVX,iShares,Passive,Optimised,Distributing,EUR,9.723287999,5.8792129015,132.2913963,20.9537619047619
,463,iShares Dow Jones U.S. Select Dividend UCITS ETF (DE),DE000A0D8Q49,EXX5,iShares,Passive,Full Replication,Distributing,EUR,9.65602182,6.56982588,353.3166924973109,19.0091904761905
,464,iShares USD Corp Bond ESG UCITS ETF EUR Hedged (Dist),IE00BH4G7D40,36BA,iShares,Passive,Optimised,Distributing,EUR,9.6252871884,7.712043581000001,208.36809963,22.1148095238095
,465,iShares STOXX Europe Small 200 UCITS ETF (DE),DE000A0D8QZ7,EXSE,iShares,Passive,Full Replication,Distributing,EUR,9.621569095,8.974585825,562.38269826,19.5772857142857
,466,iShares MSCI USA SRI UCITS ETF EUR Hedged (Dist),IE00BZ173V67,3SUR,iShares,Passive,Full Replication,Distributing,EUR,9.595707800000001,6.744102799999999,388.99664394,17.435
,467,SPDR Bloomberg Euro Corporate Bond UCITS ETF,IE00B3T9LM79,SYBC,SPDR,Passive,Optimised,Distributing,EUR,9.587604584000001,9.567392598,757.60576657,8.04195238095238
,468,iShares US Aggregate Bond UCITS ETF USD (Dist),IE00B44CGS96,EUNX,iShares,Passive,Optimised,Distributing,EUR,9.58493423,7.475392052,1134.561648449265,33.7017142857143
,469,Invesco STOXX Europe 600 UCITS ETF Acc,IE00B60SWW18,SC0C,Invesco,Passive,Swap-based,Accumulating,EUR,9.56809206,4.171550799999999,305.4929936384,8.63195238095238
,470,L&G Asia Pacific ex Japan Equity UCITS ETF,IE00BFXR5W90,ETLK,L&G ETF,Passive,Optimised,Accumulating,EUR,9.557444046,11.311739444,208.9045849677304,25.4671904761905
,471,SPDR MSCI USA Value UCITS ETF,IE00BSPLC520,ZPRU,SPDR,Passive,Full Replication,Accumulating,EUR,9.497219045,2.88323766,214.7447572068842,17.6311428571429
,472,SPDR S&P U.S. Materials Select Sector UCITS ETF,IE00BWBXM831,ZPDM,SPDR,Passive,Full Replication,Accumulating,EUR,9.412898140000001,3.864207805,61.62530394406598,13.9840952380952
,473,Lyxor STOXX Europe 600 Oil & Gas UCITS ETF - Acc,LU1834988278,LOGS,Lyxor,Passive,Swap-based,Accumulating,EUR,9.364256730000001,4.165642635,365.1669094799,11.2170476190476
,474,Xtrackers MSCI Europe UCITS ETF 1D,LU1242369327,XIEE,Xtrackers,Passive,Full Replication,Distributing,EUR,9.36197225,6.43023979,126.634017056681,16.7188095238095
,475,iShares MSCI World Value Factor ESG UCITS ETF USD (Acc),IE000H1H16W5,CBUI,iShares,Passive,Full Replication,Accumulating,EUR,9.358874268,1.443439165,22.83697765328075,20.2356666666667
,476,SPDR Morningstar Multi-Asset Global Infrastructure UCITS ETF,IE00BQWJFQ70,ZPRI,SPDR,Passive,Optimised,Distributing,EUR,9.270901755,10.52885736,1474.896713804231,33.3114285714286
,477,Xtrackers MSCI Europe Value UCITS ETF 1C,LU0486851024,D5BL,Xtrackers,Passive,Full Replication,Accumulating,EUR,9.07703336,1.887686775,41.6497203,24.9280476190476
,478,Deka EURO iSTOXX ex Fin Dividend+ UCITS ETF,DE000ETFL482,ELFC,Deka ETF,Passive,Full Replication,Distributing,EUR,8.999850645,7.866604645,431.76562248,12.4492857142857
,479,SPDR S&P U.S. Health Care Select Sector UCITS ETF,IE00BWBXM617,ZPDH,SPDR,Passive,Full Replication,Accumulating,EUR,8.934295775,8.013862900000001,255.3390289799212,11.9907619047619
,480,L&G Longer Dated All Commodities UCITS ETF,IE00B4WPHX27,ETL2,L&G ETF,Passive,Swap-based,Accumulating,EUR,8.93308732,7.353898502000001,777.1854147812837,21.802380952381
,481,iShares Euro Dividend UCITS ETF EUR (Dist),IE00B0M62S72,IQQA,iShares,Passive,Full Replication,Distributing,EUR,8.866816635,4.177690399999999,928.5805585700001,9.85895238095238
,482,Xtrackers S&P Global Infrastructure Swap UCITS ETF 1C,LU0322253229,DX2E,Xtrackers,Passive,Swap-based,Accumulating,EUR,8.805857595,3.655780965,232.720017131395,23.6391428571429
,483,Xtrackers MSCI USA ESG Screened UCITS ETF 1C,IE00BJZ2DC62,XRSM,Xtrackers,Passive,Full Replication,Accumulating,EUR,8.766699635,4.749520075,94.55463735083701,14.2219523809524
,484,iShares Fallen Angels High Yield Corp Bond UCITS ETF EUR Hedged (Dist),IE00BF3N7219,IBC7,iShares,Passive,Optimised,Distributing,EUR,8.747938914999999,6.681412759200001,540.56874851,22.9339047619048
,485,Ossiam Shiller Barclays CAPE US Sector Value TR UCITS ETF 1C (EUR),LU1079841273,USCP,Ossiam,Passive,Swap-based,Accumulating,EUR,8.7116967,3.0811398,583.2391850800001,26.0146666666667
,486,Xtrackers MSCI Europe Materials ESG Screened UCITS ETF 1C,LU0292100806,DXSC,Xtrackers,Passive,Full Replication,Accumulating,EUR,8.68063744,2.74842658,113.6908853544,22.5302380952381
,487,UBS ETF (LU) MSCI Japan Socially Responsible UCITS ETF (JPY) A-dis,LU1230561679,FRCJ,UBS ETF,Passive,Full Replication,Distributing,EUR,8.66917907,4.68869634,687.4946365,17.5883333333333
,488,iShares MSCI Saudi Arabia Capped UCITS ETF USD (Acc),IE00BYYR0489,IUSS,iShares,Passive,Full Replication,Accumulating,EUR,8.666037644,2.231448566,378.7859142972392,52.8610952380952
,489,iShares Global High Yield Corp Bond UCITS ETF EUR Hedged (Dist),IE00BJSFR200,HYLE,iShares,Passive,Optimised,Distributing,EUR,8.638994239,9.966075149,461.01715934,14.9656666666667
,490,Deka MSCI USA UCITS ETF,DE000ETFL268,EL4Z,Deka ETF,Passive,Full Replication,Distributing,EUR,8.623929551000002,8.718530937999999,391.0162291436217,15.7278095238095
,491,iShares Dow Jones Asia Pacific Select Dividend 50 UCITS ETF (DE),DE000A0H0744,EXXW,iShares,Passive,Full Replication,Distributing,EUR,8.557954455,6.848035435,250.42948605,33.0678571428571
,492,iShares € Corp Bond Interest Rate Hedged ESG UCITS ETF ,IE00B6X2VY59,IS0Y,iShares,Passive,Optimised,Distributing,EUR,8.505501652000001,5.448140990000001,762.7043933,8.25285714285714
,493,SPDR S&P 500 Low Volatility UCITS ETF,IE00B802KR88,SPY1,SPDR,Passive,Full Replication,Accumulating,EUR,8.50129262,5.2247364,173.8052834887056,13.6036666666667
,494,EMQQ Emerging Markets Internet and Ecommerce UCITS ETF - Acc,IE00BFYN8Y92,EMQQ,HANetf,Passive,Full Replication,Accumulating,EUR,8.465418872999999,8.43788233,247.0626941735389,46.5748095238095
,495,Xtrackers S&P Europe ex UK UCITS ETF 1D,IE00BGV5VM45,XUEK,Xtrackers,Passive,Full Replication,Distributing,EUR,8.42476898,8.53583474,746.6604760013,18.2951428571429
,496,Vanguard LifeStrategy 80% Equity UCITS ETF (EUR) - Acc,IE00BMVB5R75,V80A,Vanguard,Active,Full Replication,Accumulating,EUR,8.42391149,5.646326725,123.3273936,29.1265714285714
,497,L&G Russell 2000 US Small Cap Quality UCITS ETF,IE00B3CNHJ55,ETLZ,L&G ETF,Passive,Optimised,Accumulating,EUR,8.39257051,8.974186710000001,36.74669342058085,14.0734285714286
,498,Amundi Prime Euro Govies UCITS ETF DR - EUR (D),LU1931975152,PR1R,Amundi,Passive,Full Replication,Distributing,EUR,8.391252286,5.073934645,874.8376398589252,9.65109523809524
,499,iShares Edge MSCI USA Size Factor UCITS ETF USD (Acc),IE00BD1F4K20,QDVC,iShares,Passive,Optimised,Accumulating,EUR,8.390238868,2.964006483,124.052354446038,22.5332380952381
,500,Vanguard EUR Eurozone Government Bond UCITS ETF - (EUR) Accumulating,IE00BH04GL39,VGEA,Vanguard,Passive,Optimised,Accumulating,EUR,8.364797519,9.249100327999999,593.6640936,7.385
,501,Rize Sustainable Future of Food UCITS ETF - USD Acc,IE00BLRPQH31,RIZF,Rize ETF,Passive,Full Replication,Accumulating,EUR,8.3510638285,9.244545086999999,250.7596531014701,33.9870952380952
,502,Lyxor MDAX (DR) UCITS ETF,LU1033693638,C007,Lyxor,Passive,Full Replication,Distributing,EUR,8.340993235000001,7.04707354,254.09956374,16.9229047619048
,503,iShares MSCI Japan ESG Enhanced UCITS ETF USD (Acc),IE00BHZPJ452,EDMJ,iShares,Passive,Optimised,Accumulating,EUR,8.338365486999999,6.360431611999999,397.6378787110075,18.7404285714286
,504,Vanguard FTSE Developed Asia Pacific ex Japan UCITS ETF,IE00B9F5YL18,VGEJ,Vanguard,Passive,Full Replication,Distributing,EUR,8.338279835,5.953829605,823.2663212,22.6448095238095
,505,UBS ETF (IE) Factor MSCI USA Quality UCITS ETF (USD) A-dis,IE00BX7RRJ27,UBUT,UBS ETF,Passive,Full Replication,Distributing,EUR,8.302825705,4.999359525,518.9078537,23.5922857142857
,506,Lyxor DJ Switzerland Titans 30 (DR) UCITS ETF,LU0392496427,C030,Lyxor,Passive,Full Replication,Distributing,EUR,8.291591219999999,5.05090784,96.60900942799654,33.7157619047619
,507,UBS ETF (LU) MSCI EMU UCITS ETF (EUR) A-dis,LU0147308422,UIM4,UBS ETF,Passive,Full Replication,Distributing,EUR,8.29037906,6.90950802,743.33141925,10.3315238095238
,508,Amundi CAC 40 UCITS ETF DR - EUR (C),LU1681046931,GC40,Amundi,Passive,Full Replication,Accumulating,EUR,8.2901426,3.8991604,1051.427242469379,6.33157142857143
,509,iShares Dow Jones Industrial Average UCITS ETF (DE),DE0006289390,EXI3,iShares,Passive,Full Replication,Distributing,EUR,8.2676595,5.877759950000001,238.1347759591252,9.33252380952381
,510,Lyxor MSCI Russia UCITS ETF - Acc,LU1923627092,LRUS,Lyxor,Passive,Swap-based,Accumulating,EUR,8.2647754,7.79148925,272.2431441015,35.1116190476191
,511,Lyxor MSCI Disruptive Technologies ESG Filtered (DR) UCITS ETF,LU2023678282,DRUP,Lyxor,Passive,Full Replication,Accumulating,EUR,8.253739732,6.434117256,205.0564237232562,25.3251904761905
,512,Xtrackers MSCI Singapore UCITS ETF 1C,LU0659578842,XBAS,Xtrackers,Passive,Full Replication,Accumulating,EUR,8.2424009376,5.7810170964,35.4878595552,44.2171904761905
,513,Xtrackers II Eurozone Government Bond 3-5 UCITS ETF 1C,LU0290356954,DBXQ,Xtrackers,Passive,Optimised,Accumulating,EUR,8.24229849,2.35593446,531.7839596409,7.04480952380952
,514,Amundi Index MSCI Japan SRI UCITS ETF DR (C),LU2233156749,JARI,Amundi,Passive,Full Replication,Accumulating,EUR,8.22820774,5.97413574,329.111174644589,24.6999523809524
,515,Lyxor MSCI Pacific UCITS ETF,LU0392495023,X014,Lyxor,Passive,Swap-based,Accumulating,EUR,8.21878809,3.77743976,224.8370724620874,31.4688095238095
,516,Lyxor Green Bond (DR) UCITS ETF - Monthly Hedged to EUR - Acc,LU1563454823,KLMH,Lyxor,Passive,Optimised,Accumulating,EUR,8.163021384,8.13527695,180.639121815,19.0254761904762
,517,iShares MSCI Korea UCITS ETF USD (Dist),IE00B0M63391,IQQK,iShares,Passive,Full Replication,Distributing,EUR,8.15307172,7.972353515,375.5373458856221,30.4654761904762
,518,iShares MSCI EM Small Cap UCITS ETF USD (Dist),IE00B3F81G20,EUNI,iShares,Passive,Optimised,Distributing,EUR,8.12325565,8.86146092,319.7701643689495,60.2146190476191
,519,iShares Edge MSCI World Minimum Volatility ESG UCITS ETF,IE00BKVL7778,MVEW,iShares,Passive,Optimised,Accumulating,EUR,8.064730753,13.469329648,223.5641825654357,19.9137619047619
,520,iShares J.P. Morgan ESG USD EM Bond UCITS ETF EUR Hedged (Acc),IE00BKP5L730,SLMG,iShares,Passive,Optimised,Accumulating,EUR,8.0639843028,10.0604948998,354.38987847,20.352
,521,L&G Ecommerce Logistics UCITS ETF,IE00BF0M6N54,ETLH,L&G ETF,Passive,Full Replication,Accumulating,EUR,8.062645719999999,3.580621082,415.3592734940839,18.6007142857143
,522,Lyxor MSCI AC Asia Pacific Ex Japan UCITS ETF - Acc,LU1900068328,LASP,Lyxor,Passive,Swap-based,Accumulating,EUR,8.02449775,4.32925598,446.4131549745,18.5025238095238
,523,Deka MSCI Europe Climate Change ESG UCITS ETF,DE000ETFL565,D6RR,Deka ETF,Passive,Full Replication,Distributing,EUR,8.011381224,9.5221918,229.58886912,18.184619047619
,524,Invesco STOXX Europe 600 Optimised Basic Resources UCITS ETF Acc,IE00B5MTWY73,SC0W,Invesco,Passive,Swap-based,Accumulating,EUR,8.0041802,2.4345699,20.840718208,19.1578095238095
,525,L&G Clean Water UCITS ETF,IE00BK5BC891,XMLC,L&G ETF,Passive,Full Replication,Accumulating,EUR,8.003047462,7.47510009,299.3086484223737,20.0000476190476
,526,BNP Paribas Easy JPM ESG EMBI Global Diversified Composite UCITS ETF - Acc h EUR,LU1547515137,ASRD,EasyETF,Passive,Optimised,Accumulating,EUR,8.0013291746,6.3432397138,126.136,44.0856666666667
,527,iShares USD Short Duration Corp Bond UCITS ETF USD (Dist),IE00BCRY5Y77,IS3J,iShares,Passive,Optimised,Distributing,EUR,7.974810658,18.993295612,1963.7912005199,26.3054285714286
,528,UBS ETF (LU) EURO STOXX 50 ESG UCITS ETF (EUR) A-dis,LU1971906802,UET5,UBS ETF,Passive,Full Replication,Distributing,EUR,7.967117826,1.962761686,43.98107993,26.8205238095238
,529,iShares Asia Pacific Dividend UCITS ETF USD (Dist),IE00B14X4T88,IQQX,iShares,Passive,Full Replication,Distributing,EUR,7.945859115,5.265668542999999,303.1372643330943,25.9321428571429
,530,iShares Automation & Robotics UCITS ETF USD (Dist),IE00BYWZ0333,2B7F,iShares,Passive,Optimised,Distributing,EUR,7.945520045,5.10467405,149.0374493635712,24.833619047619
,531,Deka MSCI EMU Climate Change ESG UCITS ETF,DE000ETFL557,D6RS,Deka ETF,Passive,Full Replication,Distributing,EUR,7.921601438,3.806608002,376.02656041,15.546619047619
,532,Xtrackers MSCI Russia Capped Swap UCITS ETF 1C,LU0322252502,DBXV,Xtrackers,Passive,Swap-based,Distributing,EUR,7.86959819,5.241617575,104.119688464665,39.267380952381
,533,BNP Paribas Easy S&P 500 UCITS ETF EUR Hedged - C,FR0013041530,ESEH,EasyETF,Passive,Swap-based,Accumulating,EUR,7.8475394505,4.359367518,332.99354066,9.88252380952381
,534,Deka iBoxx EUR Liquid Corporates Diversified UCITS ETF,DE000ETFL375,EL49,Deka ETF,Passive,Full Replication,Distributing,EUR,7.83649911,4.407971695000001,280.99461588,16.5337619047619
,535,iShares MSCI EMU Small Cap UCITS ETF EUR (Acc),IE00B3VWMM18,SXRJ,iShares,Passive,Optimised,Accumulating,EUR,7.8011964,6.02298295,795.2068002799999,12.6721904761905
,536,Fidelity Global Quality Income UCITS ETF Inc-USD,IE00BYXVGZ48,FGEQ,Fidelity ETF,Passive,Full Replication,Distributing,EUR,7.656708025,6.009897496000001,343.4967528863392,31.1980476190476
,537,iShares USD Ultrashort Bond UCITS ETF USD (Dist),IE00BCRY6227,IS3L,iShares,Passive,Optimised,Distributing,EUR,7.586657824,0.64600582,364.9180527787738,25.354380952381
,538,iShares Edge MSCI Europe Quality Factor UCITS ETF EUR (Acc),IE00BQN1K562,CEMQ,iShares,Passive,Optimised,Accumulating,EUR,7.579415222,6.119815555,267.94798418,15.9715714285714
,539,Xtrackers MSCI AC Asia ex Japan Swap UCITS ETF 1C,LU0322252171,DXS5,Xtrackers,Passive,Swap-based,Accumulating,EUR,7.55160324,12.40340337,471.676996083118,21.9588095238095
,540,UBS ETF (IE) CMCI Composite SF UCITS ETF (USD) A-acc,IE00B53H0131,UIQK,UBS ETF,Passive,Swap-based,Accumulating,EUR,7.536682320000001,3.41364545,1505.476231624238,21.9728571428571
,541,Lyxor MSCI Emerging Markets Ex China UCITS ETF - Acc,LU2009202107,EMXC,Lyxor,Passive,Swap-based,Accumulating,EUR,7.487438675,4.05733074,133.2707901353845,33.4069523809524
,542,iShares MSCI Australia UCITS ETF USD (Acc),IE00B5377D42,IBC6,iShares,Passive,Full Replication,Accumulating,EUR,7.446425615,4.740212865,464.8714099318753,10.7095238095238
,543,iShares MSCI Europe Consumer Discretionary Sector UCITS ETF EUR (Acc),IE00BMW42298,ESIC,iShares,Passive,Full Replication,Accumulating,EUR,7.440467014999999,2.853986489,291.53493143,21.5502857142857
,544,Xtrackers MSCI Europe Health Care ESG Screened UCITS ETF 1C,LU0292103222,DXSE,Xtrackers,Passive,Full Replication,Accumulating,EUR,7.44037772,3.0812206,111.232567545,18.6918571428571
,545,Lyxor STOXX Europe 600 Travel & Leisure UCITS ETF - Acc,LU1834988781,LTVL,Lyxor,Passive,Swap-based,Accumulating,EUR,7.398884014999999,4.99574869,105.7829888162,14.042
,546,Lyxor 1 TecDAX (DR) UCITS ETF,DE000ETF9082,E908,Lyxor,Passive,Full Replication,Distributing,EUR,7.39375675,3.679023615,96.20717323999999,25.0222380952381
,547,iShares Global Timber & Forestry UCITS ETF USD (Dist),IE00B27YCF74,IUSB,iShares,Passive,Full Replication,Distributing,EUR,7.348904235,6.525012335,283.9518860523485,24.1614761904762
,548,Lyxor MSCI EMU ESG (DR) - UCITS ETF Acc,LU0908501058,LGQG,Lyxor,Passive,Full Replication,Accumulating,EUR,7.32621725,5.40059175,394.2756795837,15.5246666666667
,549,Lyxor EuroMTS Highest Rated Macro-Weighted Govt Bond 1-3Y (DR) UCITS ETF - Acc,LU1829219556,LYS4,Lyxor,Passive,Full Replication,Accumulating,EUR,7.281271626000001,15.867006284,211.2754700324,8.60447619047619
,550,L&G All Commodities UCITS ETF,IE00BF0BCP69,ETLF,L&G ETF,Passive,Swap-based,Accumulating,EUR,7.246916836,1.28776252,82.50057293832916,35.2901428571429
,551,UBS ETF (IE) MSCI USA hedged EUR UCITS ETF (EUR) A-acc,IE00BD4TYG73,UBUJ,UBS ETF,Passive,Full Replication,Accumulating,EUR,7.228789474999999,4.770649703,986.3913796,14.4998095238095
,552,iShares Digital Security UCITS ETF USD (Dist),IE00BG0J4841,IS4S,iShares,Passive,Optimised,Distributing,EUR,7.18849066,6.136519154,155.9899961097167,20.5610952380952
,553,Vanguard FTSE Developed Europe ex UK UCITS ETF,IE00BKX55S42,VERX,Vanguard,Passive,Full Replication,Distributing,EUR,7.175940805,4.03752392,1668.883787,9.7052380952381
,554,Deka MSCI China ex A Shares UCITS ETF,DE000ETFL326,EL46,Deka ETF,Passive,Full Replication,Distributing,EUR,7.174773258999999,5.291719904,103.0382125042186,50.0049047619048
,555,SPDR S&P 500 EUR Hdg UCITS ETF (Acc),IE00BYYW2V44,SPPE,SPDR,Passive,Full Replication,Accumulating,EUR,7.146207678500001,8.678952487,412.1217899697,9.07395238095238
,556,UBS ETF (LU) MSCI USA UCITS ETF (USD) A-dis,LU0136234654,UIM6,UBS ETF,Passive,Full Replication,Distributing,EUR,7.14106022,3.55275712,502.7344730299999,15.0537619047619
,557,Xtrackers II US Treasuries UCITS ETF 1D,LU0429459356,XUTD,Xtrackers,Passive,Full Replication,Distributing,EUR,7.121349105,4.926187965,641.891316388478,8.6412380952381
,558,iShares Euro Government Bond Capped 1.5-10.5yr UCITS ETF (DE),DE000A0H0785,EXHF,iShares,Passive,Optimised,Distributing,EUR,7.114080925,3.265110105,238.12107473,8.00466666666667
,559,Lyxor SDAX (DR) UCITS ETF,LU0603942888,C005,Lyxor,Passive,Full Replication,Distributing,EUR,7.06967648,4.7771241,150.26367129,31.6323333333333
,560,iShares Edge MSCI EM Minimum Volatility UCITS ETF USD (Acc),IE00B8KGV557,EUNZ,iShares,Passive,Optimised,Accumulating,EUR,7.04071428,4.387898755,417.014018707422,26.1017619047619
,561,iShares EUR Govt Bond 7-10yr UCITS ETF EUR (Acc),IE00B3VTN290,SXRQ,iShares,Passive,Optimised,Accumulating,EUR,7.03688738,6.371882875,105.79756994,6.72195238095238
,562,Amundi MSCI EMU ESG Universal Select UCITS ETF DR (A),LU2109786827,SBIZ,Amundi,Passive,Full Replication,Accumulating,EUR,7.03177007,0.8521261099999999,25.46503710996657,18.6194285714286
,563,Amundi MSCI Europe UCITS ETF - EUR (C),LU1681042609,CEUG,Amundi,Passive,Swap-based,Accumulating,EUR,7.02846365,7.675825400000001,2571.142616849594,7.81838095238095
,564,SPDR Refinitiv Global Convertible Bond UCITS ETF,IE00BNH72088,ZPRC,SPDR,Passive,Optimised,Distributing,EUR,6.99481241,8.812178985,683.7257734671925,45.4805714285714
,565,iShares STOXX Europe 600 Media UCITS ETF (DE),DE000A0H08L5,EXH6,iShares,Passive,Full Replication,Distributing,EUR,6.956717575,1.357892145,17.20883919,20.6434761904762
,566,SPDR MSCI Emerging Markets UCITS ETF,IE00B469F816,SPYM,SPDR,Passive,Optimised,Accumulating,EUR,6.940913822,10.538056356,498.4601193438509,14.8363333333333
,567,Lyxor MSCI USA ESG Leaders Extra (DR) UCITS ETF - Acc,LU1792117696,LESU,Lyxor,Passive,Full Replication,Accumulating,EUR,6.93397171,5.509587610000001,307.2397364445573,19.3030952380952
,568,UBS ETF (LU) MSCI Canada UCITS ETF (CAD) A-dis,LU0446734872,UIM9,UBS ETF,Passive,Full Replication,Distributing,EUR,6.906878474999999,10.059042255,1438.47970057,17.9602857142857
,569,Invesco KBW Nasdaq Fintech UCITS ETF Acc,IE00BYMS5W68,KFTK,Invesco,Passive,Swap-based,Accumulating,EUR,6.900464015,2.80911156,83.71369743559335,22.0329523809524
,570,iShares S&P 500 Consumer Staples Sector UCITS ETF,IE00B40B8R38,2B7D,iShares,Passive,Full Replication,Accumulating,EUR,6.898668251,2.763728578,201.4262470688419,16.2294285714286
,571,UBS ETF (LU) J.P. Morgan USD EM IG ESG Diversified Bond UCITS ETF (hedged to EUR) A-acc,LU1974696418,EMIE,UBS ETF,Passive,Optimised,Accumulating,EUR,6.8496339015,3.3590411785,248.17412344,50.0674761904762
,572,Lyxor S&P 500 UCITS ETF - Daily Hedged to EUR - Dist,LU0959211243,LYP2,Lyxor,Passive,Swap-based,Distributing,EUR,6.84079146,3.89204285,897.1383590528,15.9704761904762
,573,Xtrackers MSCI India Swap UCITS ETF 1C,LU0514695187,XCS5,Xtrackers,Passive,Swap-based,Accumulating,EUR,6.795361639999999,1.818351418,78.20941523890599,28.5740952380952
,574,PIMCO Euro Low Duration Corporate Bond UCITS ETF,IE00BP9F2J32,LDCE,PIMCO,Active,Full Replication,Distributing,EUR,6.795151815000001,5.458552285000001,223.89256017,14.3087142857143
,575,Xtrackers MSCI World Utilities UCITS ETF 1C,IE00BM67HQ30,XDWU,Xtrackers,Passive,Optimised,Accumulating,EUR,6.749307934999999,4.41306241,129.747302218504,18.9796666666667
,576,Xtrackers MSCI EM Latin America ESG Swap UCITS ETF 1C,LU0292108619,DBX3,Xtrackers,Passive,Swap-based,Accumulating,EUR,6.748780885,5.87405654,105.988060052274,56.1203333333333
,577,Xtrackers MSCI USA Consumer Discretionary UCITS ETF 1D,IE00BGQYRR35,XUCD,Xtrackers,Passive,Full Replication,Distributing,EUR,6.74066044,3.26090561,493.01871609621,20.4230952380952
,578,Lyxor Euro Government Bond 1-3Y (DR) UCITS ETF - Acc,LU1650487413,LYQ2,Lyxor,Passive,Full Replication,Accumulating,EUR,6.729408105,8.967890835,1373.7114364603,3.46642857142857
,579,Amundi Index MSCI Pacific ex Japan SRI UCITS ETF DR - EUR (C),LU1602144906,18MM,Amundi,Passive,Full Replication,Accumulating,EUR,6.7175791,3.3834162,396.7644044399935,37.3636666666667
,580,Xtrackers iBoxx EUR Corporate Bond Yield Plus UCITS ETF 1D,IE00BYPHT736,XDEP,Xtrackers,Passive,Optimised,Distributing,EUR,6.7088813755,7.470366836,451.4871330486,18.1590476190476
,581,Xtrackers EUR Credit 12.5 Swap UCITS ETF 1C,IE00B3Z66S39,D3V3,Xtrackers,Passive,Swap-based,Accumulating,EUR,6.67362435,5.17107397,17.789422759,100.470523809524
,582,iShares EUR Govt Bond 3-5yr UCITS ETF EUR (Dist),IE00B1FZS681,IBCN,iShares,Passive,Optimised,Distributing,EUR,6.64441107,7.256480255,1748.84447768,3.33680952380952
,583,iShares MSCI EM IMI ESG Screened UCITS ETF USD (Dist),IE00BFNM3N12,OM3Y,iShares,Passive,Optimised,Distributing,EUR,6.621982458,6.233309432,336.2212471764074,32.2285714285714
,584,SPDR Dow Jones Global Real Estate UCITS ETF,IE00B8GF1M35,SPYJ,SPDR,Passive,Optimised,Distributing,EUR,6.618468355,6.90649658,276.0448601021872,19.6614761904762
,585,HSBC EURO STOXX 50 UCITS ETF,IE00B4K6B022,H4ZA,HSBC ETF,Passive,Full Replication,Distributing,EUR,6.609228610000001,2.81507501,510.9051118,8.12419047619048
,586,Invesco FTSE Emerging Markets High Dividend Low Volatility UCITS ETF Dist,IE00BYYXBF44,EHDL,Invesco,Passive,Full Replication,Distributing,EUR,6.602687175,4.851363045,96.39214549900106,62.6410952380952
,587,SPDR S&P Pan Asia Dividend Aristocrats UCITS ETF,IE00B9KNR336,ZPRA,SPDR,Passive,Optimised,Distributing,EUR,6.593265115,9.167743455,145.9783916009322,24.266619047619
